id,title,url,selftext,score,num_comments,author,subreddit,created_utc,upvote_ratio,permalink,stickied
1g9oov8,Elon buying votes for Trump,https://i.redd.it/ijjl5yq0lcwd1.png,,24770,3277,JesusIsMySecondSon,pics,2024-10-22 18:04:42+00:00,0.83,/r/pics/comments/1g9oov8/elon_buying_votes_for_trump/,False
1g9kjuc,Even Trump said “ nigga what?” 😂,https://v.redd.it/rjnff99lqbwd1,,33878,1729,detox02,BlackPeopleTwitter,2024-10-22 15:13:39+00:00,0.91,/r/BlackPeopleTwitter/comments/1g9kjuc/even_trump_said_nigga_what/,False
1g9utw3,Trump. Unreal,https://i.redd.it/1j8adrduudwd1.png,"Unreal 

https://www.yahoo.com/news/trump-enraged-funeral-cost-f-211006973.html",268,42,Scared-Pomegranate84,millenials,2024-10-22 22:21:01+00:00,0.94,/r/millenials/comments/1g9utw3/trump_unreal/,False
1g9nlt6,Trump is terrified!,https://i.redd.it/tnuox4e4dcwd1.jpeg,,1292,71,Miserable-Lizard,WhitePeopleTwitter,2024-10-22 17:19:54+00:00,0.99,/r/WhitePeopleTwitter/comments/1g9nlt6/trump_is_terrified/,False
1g9b5py,Putting up a Trump sign,https://www.reddit.com/r/BoomersBeingFools/comments/1g9b5py/putting_up_a_trump_sign/,"So my neighbor was trying to put up a vote for Trump sign.  She was having issues, so I helped.  I may not like Trump, but I get everyone has the rights to their opinions.

I was totally wearing an anti Trump shirt.  

She started going on and on about how Harris & Biden have completely destroyed this country.  I am just like:  doesn’t seem destroyed to me.

Then she started talking about Venezuela sending all its criminals here to kill Americans.  I am like:  how many story have you hear about Venezuelans killing Americans.  She said none, because the news is covering for Biden.  

She was tell me that basically everything bad about Trump was created by AI to make him look bad.  

I said as a teacher, how do you feel about him talking about Arnold Palmers penis, where kids may have been.  She said it absolutely didn’t happen, it was all AI.

I said many sources verified.  She is like, most news is against Trump and they lie.  

To think she is a school teacher….. so scary",19752,1609,Really-ChillDude,BoomersBeingFools,2024-10-22 05:51:56+00:00,0.89,/r/BoomersBeingFools/comments/1g9b5py/putting_up_a_trump_sign/,False
1g9h2gf,Trump indicted...,https://i.redd.it/e0nsrkbfyawd1.jpeg,,682,9,chabanais,ConservativeMemes,2024-10-22 12:35:58+00:00,0.89,/r/ConservativeMemes/comments/1g9h2gf/trump_indicted/,False
1g9ra60,Trump: ‘I Need the Kind of Generals Hitler Had’,https://www.theatlantic.com/politics/archive/2024/10/trump-military-generals-hitler/680327/?taid=6717ffe956474d000110c05d&utm_campaign=the-atlantic&utm_content=true-anthem&utm_medium=social&utm_source=twitter,,12065,1094,harleybarley1013,politics,2024-10-22 19:51:02+00:00,0.96,/r/politics/comments/1g9ra60/trump_i_need_the_kind_of_generals_hitler_had/,False
1g9nzya,McDonald Trump ,https://v.redd.it/jh3fqpi0gcwd1,,513,104,Im_A_Fuckin_Liar,TikTokCringe,2024-10-22 17:36:07+00:00,0.87,/r/TikTokCringe/comments/1g9nzya/mcdonald_trump/,False
1g9phu8,Trump just cancelled ANOTHER town hall,https://i.redd.it/ct0dk67zqcwd1.png,,2673,138,vulturesponge,PoliticalHumor,2024-10-22 18:37:36+00:00,0.99,/r/PoliticalHumor/comments/1g9phu8/trump_just_cancelled_another_town_hall/,False
1g9rs2u,AOC responds to Trump’s McDonald’s costume,https://v.redd.it/uu5l17rk7dwd1,,9878,633,UnluckyStar237,TikTokCringe,2024-10-22 20:10:38+00:00,0.91,/r/TikTokCringe/comments/1g9rs2u/aoc_responds_to_trumps_mcdonalds_costume/,False
1g9hou5,trump life,https://i.redd.it/jllhcivy3bwd1.png,,471,51,MileneGlade,shitposting,2024-10-22 13:07:06+00:00,0.87,/r/shitposting/comments/1g9hou5/trump_life/,False
1g9osdn,Trump in Austin ,https://www.reddit.com/r/Austin/comments/1g9osdn/trump_in_austin/,45 is coming to appear on Joe Rogan’s podcast on Friday. Gird your loins when you’re out in traffic.,433,267,txnaughty,Austin,2024-10-22 18:08:35+00:00,0.87,/r/Austin/comments/1g9osdn/trump_in_austin/,False
1g9slsw,Charlamagne Tha God Laughs In Lara Trump's Face After She Claims Trump Isn't 'Racist',https://www.comicsands.com/charlamagne-lara-donald-trump-racist-2669457078.html,,113,2,Blue_Wave2024,Fuckthealtright,2024-10-22 20:45:22+00:00,0.99,/r/Fuckthealtright/comments/1g9slsw/charlamagne_tha_god_laughs_in_lara_trumps_face/,False
1g9ikab,"In every way, Trump is the leaker ",https://i.redd.it/n2jzsf0ebbwd1.jpeg,,6788,166,ExactlySorta,WhitePeopleTwitter,2024-10-22 13:48:24+00:00,0.99,/r/WhitePeopleTwitter/comments/1g9ikab/in_every_way_trump_is_the_leaker/,False
1g9pe9m,"Following ‘exhaustion’ report, Trump cancels yet another appearance",https://www.msnbc.com/rachel-maddow-show/maddowblog/exhaustion-report-trump-cancels-yet-another-appearance-rcna176616,,4757,357,msnbc,politics,2024-10-22 18:33:36+00:00,0.98,/r/politics/comments/1g9pe9m/following_exhaustion_report_trump_cancels_yet/,False
1g9lqv8,Trump Gets Surprising News on His Performance From a Shocking Poll - Donald Trump supporters are just making up data now to make him look good.,https://newrepublic.com/post/187391/donald-trump-shocking-poll-performance-fake,,5907,624,kiltedturtle,politics,2024-10-22 16:03:53+00:00,0.97,/r/politics/comments/1g9lqv8/trump_gets_surprising_news_on_his_performance/,False
1g9wc3u,Top Trump Ally MAKES LEAK WORSE.... then BURIES TRUMP,https://youtu.be/qHcTDcvqwtk?si=idh8Tiw4lkNoNCqi,Adam Mockler with MeidasTouch Network breaks down Donald Trump's former ally explaining his dictatorial obsession.,4,0,JimCripe,MeidasTouch,2024-10-22 23:31:04+00:00,1.0,/r/MeidasTouch/comments/1g9wc3u/top_trump_ally_makes_leak_worse_then_buries_trump/,False
1g9srya,"Trump Cult-Members: Trump May be the Oldest Candidate to Ever Run for President, but he is Strong and Energetic.  He’ll Fight For Us!!",https://i.redd.it/1ewh10e2fdwd1.jpeg,,1311,246,BeefCurtians5,johnoliver,2024-10-22 20:52:36+00:00,0.94,/r/johnoliver/comments/1g9srya/trump_cultmembers_trump_may_be_the_oldest/,False
1g9mgkz,Trump Town Hall Goes Off the Rails When Trump Says He Has ‘No Cognitive Problems’ and Then Immediately Forgets His Age,https://www.politicalflare.com/2024/10/trumps-town-hall-in-pa-goes-off-the-rails-as-he-claims-hes-not-that-close-to-80-and-i-have-no-cognitive/,,738,34,nikkisixxi,USNewsHub,2024-10-22 16:33:00+00:00,0.99,/r/USNewsHub/comments/1g9mgkz/trump_town_hall_goes_off_the_rails_when_trump/,False
1g9sl31,Charlamagne Tha God Laughs In Lara Trump's Face After She Claims Trump Isn't 'Racist',https://www.comicsands.com/charlamagne-lara-donald-trump-racist-2669457078.html,,64,5,Blue_Wave2024,MAGANAZI,2024-10-22 20:44:33+00:00,0.98,/r/MAGANAZI/comments/1g9sl31/charlamagne_tha_god_laughs_in_lara_trumps_face/,False
1g9s4we,Trump's history with racism,https://v.redd.it/mq7p3j94adwd1,,329,21,MiltonManners,BlackPeopleTwitter,2024-10-22 20:25:24+00:00,0.96,/r/BlackPeopleTwitter/comments/1g9s4we/trumps_history_with_racism/,False
1g9g4ss,What’s wrong with Donald Trump?,https://www.nytimes.com/2024/10/22/opinion/donald-trump-ezra-klein-podcast.html?unlocked_article_code=1.UE4.ghv7.2tWZY8wPWz60&smid=nytcore-ios-share&referringSource=articleShare,,2647,749,Charming_Proof_4357,politics,2024-10-22 11:46:32+00:00,0.94,/r/politics/comments/1g9g4ss/whats_wrong_with_donald_trump/,False
1g9tlfs,Donald Trump Brags That Daughter Tiffany Trump Graduated 'No. 1' In Class - But Georgetown Law Doesn't Rank Students,https://abovethelaw.com/2024/10/donald-trump-brags-that-daughter-tiffany-trump-graduated-no-1-in-class-but-georgetown-law-doesnt-rank-students/,,131,19,ValleyGrouch,AntiTrumpAlliance,2024-10-22 21:27:10+00:00,0.99,/r/AntiTrumpAlliance/comments/1g9tlfs/donald_trump_brags_that_daughter_tiffany_trump/,False
1g9oimh,Trump going on Rogan podcast Friday.,https://www.reddit.com/r/Conservative/comments/1g9oimh/trump_going_on_rogan_podcast_friday/,"Per a lot of different places. Not sure if I love it but should be interesting. Secret service going to have to sweep the hell out of that place.

Now I need a 50 word minimum blah here filler we go vote Trump maga make America great again self post",692,237,MichaelSquare,Conservative,2024-10-22 17:57:41+00:00,0.8,/r/Conservative/comments/1g9oimh/trump_going_on_rogan_podcast_friday/,False
1g9pewq,Trump Jr. announces Trump will appear on Rogans podcast on October 25th.,https://i.redd.it/cr2i1p17qcwd1.jpeg,,16,43,IAdmitILie,Destiny,2024-10-22 18:34:18+00:00,0.86,/r/Destiny/comments/1g9pewq/trump_jr_announces_trump_will_appear_on_rogans/,False
1g9o0am,Trump abruptly cancels 'virtual roundtable' amid reports of 'exhaustion',https://www.rawstory.com/trump-cancels-roundtable-exhaustation/,,4423,433,BeardedCrank,inthenews,2024-10-22 17:36:33+00:00,0.98,/r/inthenews/comments/1g9o0am/trump_abruptly_cancels_virtual_roundtable_amid/,False
1g9mso3,Trumps double ED,https://i.redd.it/uv01z1u87cwd1.jpeg,,263,14,suziespends,WhitePeopleTwitter,2024-10-22 16:46:57+00:00,0.99,/r/WhitePeopleTwitter/comments/1g9mso3/trumps_double_ed/,False
1g9ug8b,God Sends Cease-And-Desist Letter After Trump Signs Trump Bibles As “Jesus”,https://www.reddit.com/r/onionheadlines/comments/1g9ug8b/god_sends_ceaseanddesist_letter_after_trump_signs/,,11,0,electricmehicle,onionheadlines,2024-10-22 22:04:17+00:00,0.83,/r/onionheadlines/comments/1g9ug8b/god_sends_ceaseanddesist_letter_after_trump_signs/,False
1g9jcxu,Kamala vs Trump.,https://i.redd.it/pqx9aqmhhbwd1.png,,201,8,Bitter-Gur-4613,CommunismMemes,2024-10-22 14:23:15+00:00,0.97,/r/CommunismMemes/comments/1g9jcxu/kamala_vs_trump/,False
1g9skkr,Charlamagne Tha God Laughs In Lara Trump's Face After She Claims Trump Isn't 'Racist',https://www.comicsands.com/charlamagne-lara-donald-trump-racist-2669457078.html,,45,1,Blue_Wave2024,stop_the_GOP,2024-10-22 20:43:56+00:00,0.98,/r/stop_the_GOP/comments/1g9skkr/charlamagne_tha_god_laughs_in_lara_trumps_face/,False
1g9cq5k,Lara Trump Eloquently Dismantles Breakfast Club's Fear Mongering of Donald Trump,https://rumble.com/v5jn9kc-lara-trump-eloquently-dismantles-breakfast-clubs-fear-mongering-of-donald-t.html,,66,1,proandcon111,TheBidenshitshow,2024-10-22 07:46:59+00:00,0.95,/r/TheBidenshitshow/comments/1g9cq5k/lara_trump_eloquently_dismantles_breakfast_clubs/,False
1g9gl55,Jon Stewart Is Taking Trump’s ‘Enemy Within’ Threats Very Seriously,https://www.thedailybeast.com/jon-stewart-is-taking-trumps-enemy-within-threats-very-seriously/,,24915,1330,bluerose297,politics,2024-10-22 12:10:38+00:00,0.94,/r/politics/comments/1g9gl55/jon_stewart_is_taking_trumps_enemy_within_threats/,False
1g9pkbw,Ivanka Trump,https://v.redd.it/8t0vhr1frcwd1,,35,0,fullfath0m,womenoftheright,2024-10-22 18:40:22+00:00,1.0,/r/womenoftheright/comments/1g9pkbw/ivanka_trump/,False
1g9m0g5,"Trump’s ‘crazy,’ false ad claiming ‘massive layoffs’ among autoworkers. Motor vehicle manufacturing employment hit a 34-year high in July. Like much of Trump’s rhetoric, the ad is false. The Trump campaign earns Four Pinocchios.",https://www.washingtonpost.com/politics/2024/10/22/trumps-crazy-false-ad-claiming-massive-layoffs-among-auto-workers/,,457,54,mafco,energy,2024-10-22 16:14:52+00:00,0.92,/r/energy/comments/1g9m0g5/trumps_crazy_false_ad_claiming_massive_layoffs/,False
1g9unuc,My Trump yard sign ,https://i.redd.it/zd11zlyhtdwd1.jpeg,This is ,71,7,Soggy-Welder2265,trump,2024-10-22 22:13:39+00:00,0.84,/r/trump/comments/1g9unuc/my_trump_yard_sign/,False
1g9qumh,Trump has nothing that benefits anyone or anything! ,https://i.redd.it/6e1r8xau0dwd1.jpeg,,1288,208,Available_Reason7795,MurderedByWords,2024-10-22 19:32:51+00:00,0.95,/r/MurderedByWords/comments/1g9qumh/trump_has_nothing_that_benefits_anyone_or_anything/,False
1g969b8,Trump’s greatest achievement ,https://i.redd.it/ou19nyb0l7wd1.jpeg,,2958,96,GadreelsSword,PoliticalHumor,2024-10-22 01:15:12+00:00,0.98,/r/PoliticalHumor/comments/1g969b8/trumps_greatest_achievement/,False
1g9nl76,Trump has no business asking anyone to release anything ,https://i.redd.it/uxxpt310dcwd1.png,,2901,143,bbrk9845,MurderedByWords,2024-10-22 17:19:13+00:00,0.99,/r/MurderedByWords/comments/1g9nl76/trump_has_no_business_asking_anyone_to_release/,False
1g9fo46,Trump Roasted by McDonald’s Staff: ‘Where’s His Hairnet?’,https://www.thedailybeast.com/trump-roasted-by-mcdonalds-staff-wheres-his-hairnet/?via=newsletter&source=DDMorning&user_emailA=103953d1ff4fa17936205e1bf6bc7cf5&user_emailB=7223100dd1bf53a51ae271b88cb4834da89244093058f435a4101021d1d3e2af&utm_source=Sailthru&utm_medium=email&utm_campaign=241022-am-digest&utm_term=F%20List%20Daily%20Beast%20Newsletter%20AM,,20886,949,TheCatAteMyGymsuit,politics,2024-10-22 11:19:12+00:00,0.92,/r/politics/comments/1g9fo46/trump_roasted_by_mcdonalds_staff_wheres_his/,False
1g9nst2,Trump has a new Halloween Costume ,https://i.redd.it/rcjbk357ecwd1.jpeg,,513,17,CLUB770,PoliticalHumor,2024-10-22 17:27:49+00:00,0.99,/r/PoliticalHumor/comments/1g9nst2/trump_has_a_new_halloween_costume/,False
1g9izel,Trump signs are an embarrassment ,https://i.redd.it/y90hb4tkebwd1.jpeg,Noticing Harris signs in front yards vs trumpers on roads side makes me wonder if decent people are embarrassed of voting for him. ,477,71,slcexpat,democrats,2024-10-22 14:06:38+00:00,0.98,/r/democrats/comments/1g9izel/trump_signs_are_an_embarrassment/,False
1g9twmz,"What (Really) Happens If trump Wins? | Like Hitler, trump Has Made Clear His Plan is Dictatorship, Not Democracy",https://open.substack.com/pub/thecycle/p/what-really-happens-if-trump-wins?utm_source=share&utm_medium=android&r=25i5q1,,54,4,Youarethebigbang,esist,2024-10-22 21:40:45+00:00,0.99,/r/esist/comments/1g9twmz/what_really_happens_if_trump_wins_like_hitler/,False
1g8mbmr,[Anti Trump post] Kamala Harris thinks it's funny Trump cooked fries at a closed McDonald's,https://i.imgflip.com/97egjh.jpg,,11941,1723,NOT_MEEHAN,AdviceAnimals,2024-10-21 10:22:00+00:00,0.85,/r/AdviceAnimals/comments/1g8mbmr/anti_trump_post_kamala_harris_thinks_its_funny/,False
1g9pito,Trump just cancelled ANOTHER town hall,https://i.redd.it/ct0dk67zqcwd1.png,,305,10,vulturesponge,EnoughTrumpSpam,2024-10-22 18:38:40+00:00,0.99,/r/EnoughTrumpSpam/comments/1g9pito/trump_just_cancelled_another_town_hall/,False
1g9q0ze,Donald Trump Backs Out Of Yet Another Scheduled Appearance,https://www.huffpost.com/entry/donald-trump-backs-out-health-town-hall_n_6717d1b0e4b0f3057ef76032,,1346,88,UWCG,politics,2024-10-22 18:59:22+00:00,0.98,/r/politics/comments/1g9q0ze/donald_trump_backs_out_of_yet_another_scheduled/,False
1g9r490,AI Trump working at McDonald's,https://v.redd.it/qm29qlfq2dwd1,,235,19,Arnukas,discordVideos,2024-10-22 19:44:00+00:00,0.86,/r/discordVideos/comments/1g9r490/ai_trump_working_at_mcdonalds/,False
1g9t2x7,Trump on Rogan!,https://www.politico.com/live-updates/2024/10/22/2024-elections-live-coverage-updates-analysis/trump-joe-rogan-podcast-00184894,,30,4,LeoLover77,Republican,2024-10-22 21:05:14+00:00,0.83,/r/Republican/comments/1g9t2x7/trump_on_rogan/,False
1g9uzz8,McTrump didn’t wash his hands ,https://www.reddit.com/r/johnoliver/comments/1g9uzz8/mctrump_didnt_wash_his_hands/,https://www.nytimes.com/2024/10/22/health/ecoli-outbreak-mcdonalds-hamburgers.html?smid=nytcore-ios-share&referringSource=articleShare,239,39,PuzzleheadedBat9474,johnoliver,2024-10-22 22:28:43+00:00,0.98,/r/johnoliver/comments/1g9uzz8/mctrump_didnt_wash_his_hands/,False
1g9cpxb,Lara Trump Eloquently Dismantles Breakfast Club's Fear Mongering of Donald Trump,https://rumble.com/v5jn9kc-lara-trump-eloquently-dismantles-breakfast-clubs-fear-mongering-of-donald-t.html,,32,1,proandcon111,TheDonaldTrump2024,2024-10-22 07:46:28+00:00,0.89,/r/TheDonaldTrump2024/comments/1g9cpxb/lara_trump_eloquently_dismantles_breakfast_clubs/,False
1g9cqaj,Lara Trump Eloquently Dismantles Breakfast Club's Fear Mongering of Donald Trump,https://rumble.com/v5jn9kc-lara-trump-eloquently-dismantles-breakfast-clubs-fear-mongering-of-donald-t.html,,33,3,proandcon111,Patriot911,2024-10-22 07:47:15+00:00,0.92,/r/Patriot911/comments/1g9cqaj/lara_trump_eloquently_dismantles_breakfast_clubs/,False
1g9ryhk,Trump: ‘I Need the Kind of Generals That Hitler Had’,https://www.theatlantic.com/politics/archive/2024/10/trump-military-generals-hitler/680327/,,1617,206,oblongsalacia,politics,2024-10-22 20:18:05+00:00,0.96,/r/politics/comments/1g9ryhk/trump_i_need_the_kind_of_generals_that_hitler_had/,False
1g95u9t,The last time we elected Trump,https://i.redd.it/s18z39b2h7wd1.jpeg,,6179,80,pantsmeplz,PoliticalHumor,2024-10-22 00:53:34+00:00,0.99,/r/PoliticalHumor/comments/1g95u9t/the_last_time_we_elected_trump/,False
1g8ob1r,Crazed Trump ally had a homophobic meltdown after Pete Buttigieg joked about Donald Trump,https://www.lgbtqnation.com/2024/10/crazed-trump-ally-has-a-homophobic-meltdown-after-pete-buttigieg-joked-about-donald-trump/,,2740,129,etfvfva,politics,2024-10-21 12:19:33+00:00,0.96,/r/politics/comments/1g8ob1r/crazed_trump_ally_had_a_homophobic_meltdown_after/,False
1g9kfjx,Aides Claim The Reason Trump Went To McDonalds And Not Burger King Is Because Trump More Closely Resembles A Clown Than A King,https://www.reddit.com/r/onionheadlines/comments/1g9kfjx/aides_claim_the_reason_trump_went_to_mcdonalds/,,537,10,SiriusGD,onionheadlines,2024-10-22 15:08:44+00:00,0.98,/r/onionheadlines/comments/1g9kfjx/aides_claim_the_reason_trump_went_to_mcdonalds/,False
1g9pfp0,Collection of Anti-Trump billboards ,https://www.reddit.com/gallery/1g9pfp0,,116,5,wrapityup,MarchAgainstNazis,2024-10-22 18:35:14+00:00,0.98,/r/MarchAgainstNazis/comments/1g9pfp0/collection_of_antitrump_billboards/,False
1g9pia3,Trump just cancelled ANOTHER town hall,https://i.redd.it/ct0dk67zqcwd1.png,,199,19,vulturesponge,Trumpvirus,2024-10-22 18:38:03+00:00,1.0,/r/Trumpvirus/comments/1g9pia3/trump_just_cancelled_another_town_hall/,False
1g8wrqk,"Trump playing the ""fast food worker"" game",https://i.redd.it/82y118lej5wd1.png,,31167,2012,bbrk9845,MurderedByWords,2024-10-21 18:22:39+00:00,0.9,/r/MurderedByWords/comments/1g8wrqk/trump_playing_the_fast_food_worker_game/,False
1g8kmqa,"""Trump is a Chump"" - An anti-Trump rally by the Nation of Islam in front of Trump Towers in 1988. Photo by Ricky Flores.",https://i.redd.it/7jc1nc4ti2wd1.jpeg,,4473,189,Perfect-Pen5722,SnapshotHistory,2024-10-21 08:14:04+00:00,0.89,/r/SnapshotHistory/comments/1g8kmqa/trump_is_a_chump_an_antitrump_rally_by_the_nation/,False
1g9fcao,Trump Defends Right to Make Threats Against FEMA Workers,https://www.thedailybeast.com/trump-defends-right-to-make-threats-against-fema-workers/,,4219,222,HeHateMe337,politics,2024-10-22 10:58:59+00:00,0.96,/r/politics/comments/1g9fcao/trump_defends_right_to_make_threats_against_fema/,False
1g9s3bt,PROOF: everything Trump touches turn into 💩💩💩,https://i.redd.it/dqjh0rjw9dwd1.jpeg,The orangutan does it again! Landslide victory for Kamala,228,19,ed2727,PoliticalHumor,2024-10-22 20:23:39+00:00,0.99,/r/PoliticalHumor/comments/1g9s3bt/proof_everything_trump_touches_turn_into/,False
1g9k90b,Trump's Plan Would Raise Your Prices,https://i.redd.it/l277wdewnbwd1.jpeg,,428,15,UnluckyStar237,Defeat_Project_2025,2024-10-22 15:01:20+00:00,0.98,/r/Defeat_Project_2025/comments/1g9k90b/trumps_plan_would_raise_your_prices/,False
1g9nk3q,"Brits want Donald Trump to lose, poll finds",https://www.politico.eu/article/brits-want-donald-trump-to-lose-kamala-harris-victory-poll-finds/,,562,83,Mysterious_Charge541,politics,2024-10-22 17:17:59+00:00,0.95,/r/politics/comments/1g9nk3q/brits_want_donald_trump_to_lose_poll_finds/,False
1g968h8,Total Trump Victory,https://i.redd.it/oqyne30hk7wd1.jpeg,,596,59,fembro621,trump,2024-10-22 01:14:04+00:00,0.86,/r/trump/comments/1g968h8/total_trump_victory/,False
1g9mf64,Trump Town Hall Goes Off the Rails When Trump Says He Has ‘No Cognitive Problems’ and Then Immediately Forgets His Age,https://www.politicalflare.com/2024/10/trumps-town-hall-in-pa-goes-off-the-rails-as-he-claims-hes-not-that-close-to-80-and-i-have-no-cognitive/,,130,6,nikkisixxi,AnythingGoesNews,2024-10-22 16:31:21+00:00,1.0,/r/AnythingGoesNews/comments/1g9mf64/trump_town_hall_goes_off_the_rails_when_trump/,False
1g9ewks,Donald Trump ❌ Donald Trung ✅,https://i.redd.it/8pjd2p4ybawd1.jpeg,,565,32,Cheechfz_borneo,VietNam,2024-10-22 10:29:46+00:00,0.98,/r/VietNam/comments/1g9ewks/donald_trump_donald_trung/,False
1g9r3a4,US army ordered to release records about Trump’s Arlington cemetery visit | Donald Trump,https://www.theguardian.com/us-news/2024/oct/22/trump-arlington-ceremony-records-release?CMP=Share_iOSApp_Other,,8,0,BeigeListed,OneTermPresident,2024-10-22 19:42:51+00:00,1.0,/r/OneTermPresident/comments/1g9r3a4/us_army_ordered_to_release_records_about_trumps/,False
1g9pnb3,Trump indicted...,https://i.redd.it/e0nsrkbfyawd1.jpeg,,12,0,Slske,ConservativeTalk,2024-10-22 18:43:43+00:00,0.93,/r/ConservativeTalk/comments/1g9pnb3/trump_indicted/,False
1g9lr9q,Charla tryna sue Trump,https://i.redd.it/fdudtevmzbwd1.jpeg,Charla wylin?,63,27,Chuckles991,brilliantidiots,2024-10-22 16:04:18+00:00,0.86,/r/brilliantidiots/comments/1g9lr9q/charla_tryna_sue_trump/,False
1g9pd57,Favorite movie inspired by Trump?,https://i.redd.it/gyc5x8i0qcwd1.jpeg,,74,34,snowleave,okbuddycinephile,2024-10-22 18:32:15+00:00,0.91,/r/okbuddycinephile/comments/1g9pd57/favorite_movie_inspired_by_trump/,False
1g9rkdo,Yelp disables comments on the McDonald's that hosted Trump after influx of one-star reviews,https://www.cnbc.com/2024/10/22/yelp-disables-comments-on-the-mcdonalds-trump-visited.html,,13303,1131,printial,technology,2024-10-22 20:02:11+00:00,0.93,/r/technology/comments/1g9rkdo/yelp_disables_comments_on_the_mcdonalds_that/,False
1g9gxnw,Steve Jobs on Trump,https://i.redd.it/hsmlr0x8xawd1.jpeg,Steve Jobs relays what people showering with Donald Trump told him. ,109,7,PeterPuck99,PoliticalHumor,2024-10-22 12:29:08+00:00,0.92,/r/PoliticalHumor/comments/1g9gxnw/steve_jobs_on_trump/,False
1g9gs83,Remember: Donald Trump shouldn’t even be eligible for the presidency after Jan. 6,https://www.msnbc.com/deadline-white-house/deadline-legal-blog/trump-shouldnt-be-eligible-presidency-jan-6-rcna175458,,24360,1519,lala_b11,scotus,2024-10-22 12:20:59+00:00,0.8,/r/scotus/comments/1g9gs83/remember_donald_trump_shouldnt_even_be_eligible/,False
1g9snpe,Walz knocks Elon Musk for 'skipping like a dips---' at Trump rally,https://www.nbcnews.com/news/amp-video/mmvo222400069718,,1983,114,Mono_KS,politics,2024-10-22 20:47:37+00:00,0.98,/r/politics/comments/1g9snpe/walz_knocks_elon_musk_for_skipping_like_a_dips_at/,False
1g9j2g1,MAGA Trump on Base aka Blue Trump! CTO chads!,https://www.reddit.com/r/basechainmemecoins/comments/1g9j2g1/maga_trump_on_base_aka_blue_trump_cto_chads/,"MAGA $TRUMP ON BASE 

$TRUMP is a CTO that was taken over by the Secret Base group (7k members) on telegram.  After a lazy dev decided to dump and give up completely. With all the bad devs and scams that plague the space, we decided to Make the Meme Space Great Again. 100% safe. All ran by a community full of chads. Something that Donald Trump himself would be proud to be a part of. 🤝

Join us on the journey to billions and billions. It's gonna be yuge. 


TG: magatrumpbaseportal

X: MAGATRUMPONBASE",1,1,floridajay727,basechainmemecoins,2024-10-22 14:10:25+00:00,0.57,/r/basechainmemecoins/comments/1g9j2g1/maga_trump_on_base_aka_blue_trump_cto_chads/,False
1g9k4pn,Propaganda Now vs Then (Trump/Mussolini),https://i.redd.it/71mvz3ml8bwd1.png,,231,15,dryeraser,millenials,2024-10-22 14:56:30+00:00,0.94,/r/millenials/comments/1g9k4pn/propaganda_now_vs_then_trumpmussolini/,False
1g9ku5r,Trump Brutally Roasted for His Stupid McDonald’s Farce,https://newrepublic.com/post/187379/donald-trump-roasted-mcdonalds-work,,1917,281,Cute-Perception2335,AnythingGoesNews,2024-10-22 15:25:37+00:00,0.94,/r/AnythingGoesNews/comments/1g9ku5r/trump_brutally_roasted_for_his_stupid_mcdonalds/,False
1g9q6y0,Breaking:  Trump awarded highest McDonalds honor ,https://i.redd.it/exfd4tp0wcwd1.jpeg,“,235,16,kalamazoo43,PoliticalHumor,2024-10-22 19:05:49+00:00,0.98,/r/PoliticalHumor/comments/1g9q6y0/breaking_trump_awarded_highest_mcdonalds_honor/,False
1g9l9xk,Stop Calling Trump an Isolationist,https://foreignpolicy.com/2024/10/22/trump-foreign-policy-dictators-authoritarian-isolationism-america-first/,,98,39,foreignpolicymag,geopolitics,2024-10-22 15:44:17+00:00,0.77,/r/geopolitics/comments/1g9l9xk/stop_calling_trump_an_isolationist/,False
1g9rvei,"Following ‘exhaustion’ report, Trump cancels yet another appearance",https://www.msnbc.com/rachel-maddow-show/maddowblog/exhaustion-report-trump-cancels-yet-another-appearance-rcna176616,,259,24,shallah,AntiTrumpAlliance,2024-10-22 20:14:29+00:00,0.99,/r/AntiTrumpAlliance/comments/1g9rvei/following_exhaustion_report_trump_cancels_yet/,False
1g9r19i,Judge Deals Trump Massive Blow on Appalling Arlington Cemetery Fight,https://newrepublic.com/post/187410/judge-trump-arlington-national-cemetery-fight,,800,47,thenewrepublic,AntiTrumpAlliance,2024-10-22 19:40:30+00:00,0.98,/r/AntiTrumpAlliance/comments/1g9r19i/judge_deals_trump_massive_blow_on_appalling/,False
1g9tunc,"What (Really) Happens If trump Wins? | Like Hitler, trump Has Made Clear His Plan is Dictatorship, Not Democracy",https://thecycle.substack.com/p/what-really-happens-if-trump-wins,,24,1,Youarethebigbang,MarchAgainstNazis,2024-10-22 21:38:20+00:00,0.95,/r/MarchAgainstNazis/comments/1g9tunc/what_really_happens_if_trump_wins_like_hitler/,False
1g9siil,McDonald Trump ,https://v.redd.it/jh3fqpi0gcwd1,,12,2,orel2064,MAGANAZI,2024-10-22 20:41:35+00:00,0.78,/r/MAGANAZI/comments/1g9siil/mcdonald_trump/,False
1g9m6qv,Melania Trump's beauty ,https://www.reddit.com/gallery/1g9m6qv,,51,4,thebreaktime69,womenoftheright,2024-10-22 16:21:53+00:00,0.98,/r/womenoftheright/comments/1g9m6qv/melania_trumps_beauty/,False
