id,title,url,selftext,score,num_comments,author,subreddit,created_utc,upvote_ratio,permalink,stickied
1g9toxk,Trump: ‘I Need the Kind of Generals That Hitler Had’,https://www.theatlantic.com/politics/archive/2024/10/trump-military-generals-hitler/680327/?origin=serp_auto,,250,61,strange_stairs,politics,2024-10-22 21:31:23+00:00,0.94,/r/politics/comments/1g9toxk/trump_i_need_the_kind_of_generals_that_hitler_had/,False
1g9gzu6,"Trump refuses to denounce threats to FEMA, doubles down on falsehoods",https://www.washingtonpost.com/politics/2024/10/21/trump-fema-threats-misinformation-hurricane-helene/,,2259,84,Gadflyabout,politics,2024-10-22 12:32:11+00:00,0.97,/r/politics/comments/1g9gzu6/trump_refuses_to_denounce_threats_to_fema_doubles/,False
1g9fyz5,A Second Trump Administration Would Be a Carnival of Corruption and Greed,https://www.nytimes.com/2024/10/22/opinion/trump-second-term-corruption.html,,4000,158,GirasoleDE,politics,2024-10-22 11:37:15+00:00,0.97,/r/politics/comments/1g9fyz5/a_second_trump_administration_would_be_a_carnival/,False
1g96fhi,Trump gets fact checked on his claims about immigrants,https://v.redd.it/4nb4jrckm7wd1,,5185,413,Salty-Ad-3213,TikTokCringe,2024-10-22 01:24:00+00:00,0.98,/r/TikTokCringe/comments/1g96fhi/trump_gets_fact_checked_on_his_claims_about/,False
1g96pbi,Ukraine May Cost Trump the Election,https://www.rollingstone.com/politics/politics-features/trump-harris-ukraine-russia-election-2024-1235136484/,,926,211,KitchenBanger,politics,2024-10-22 01:38:21+00:00,0.93,/r/politics/comments/1g96pbi/ukraine_may_cost_trump_the_election/,False
1g9sh02,TRUMP / GORE 2024 ,https://www.reddit.com/r/foxandcat/comments/1g9sh02/trump_gore_2024/,,8,10,Ambitious_Wealth9169,foxandcat,2024-10-22 20:39:45+00:00,1.0,/r/foxandcat/comments/1g9sh02/trump_gore_2024/,False
1g9qg7i,Dad got punched for being a trump supporter... ,https://www.youtube.com/watch?v=IqffOPN1L7g&feature=share,,129,75,therealdebbith,the_everything_bubble,2024-10-22 19:16:30+00:00,0.9,/r/the_everything_bubble/comments/1g9qg7i/dad_got_punched_for_being_a_trump_supporter/,False
1g9n642,Trumps double ED,https://i.redd.it/uv01z1u87cwd1.jpeg,,17,1,MoochoMaas,GQPShitposting,2024-10-22 17:02:00+00:00,1.0,/r/GQPShitposting/comments/1g9n642/trumps_double_ed/,False
1g9txuo,Georgia Supreme Court declines to reinstate Trump-allied board’s election rules ,https://www.washingtonpost.com/politics/2024/10/22/georgia-supreme-court-declines-reinstate-trump-allied-boards-election-rules/?utm_campaign=wp_main&utm_medium=social&utm_source=reddit.com,,584,26,washingtonpost,law,2024-10-22 21:42:12+00:00,0.99,/r/law/comments/1g9txuo/georgia_supreme_court_declines_to_reinstate/,False
1g9kqwt,Things I Trust More Than Trump,https://v.redd.it/f7etcxh1sbwd1,,86,2,pbpilot,USNewsHub,2024-10-22 15:21:45+00:00,0.98,/r/USNewsHub/comments/1g9kqwt/things_i_trust_more_than_trump/,False
1g909ro,Trump 2024,https://v.redd.it/ctwyaejv76wd1,,153,1,X_LetsGoGifs,AskThe_Donald,2024-10-21 20:43:02+00:00,0.96,/r/AskThe_Donald/comments/1g909ro/trump_2024/,False
1g9oxlo,Trump abruptly cancels 'virtual roundtable' amid reports of 'exhaustion',https://www.rawstory.com/trump-cancels-roundtable-exhaustation/,,237,50,justin_quinnn,USNewsHub,2024-10-22 18:14:20+00:00,0.96,/r/USNewsHub/comments/1g9oxlo/trump_abruptly_cancels_virtual_roundtable_amid/,False
1g9upnt,Trump: ‘I Need the Kind of Generals That Hitler Had’,https://www.theatlantic.com/politics/archive/2024/10/trump-military-generals-hitler/680327/?gift=eVpKCtw2TUuakbK_F8tXLYMpzeEHULi63uMqTprZnHc,,204,25,newzee1,Foodforthought,2024-10-22 22:15:56+00:00,0.96,/r/Foodforthought/comments/1g9upnt/trump_i_need_the_kind_of_generals_that_hitler_had/,False
1g9qxdi,If Trump Wins...,https://www.nytimes.com/interactive/2024/06/16/us/politics/trump-policy-list-2025.html,,6,6,Disastrous-Rabbit108,democrats,2024-10-22 19:36:01+00:00,0.8,/r/democrats/comments/1g9qxdi/if_trump_wins/,False
1g8va36,Trump insulted the Undertaker on his own show.,https://i.redd.it/orv9evmp85wd1.jpeg,,15167,746,VeryPerry1120,LeopardsAteMyFace,2024-10-21 17:22:43+00:00,0.97,/r/LeopardsAteMyFace/comments/1g8va36/trump_insulted_the_undertaker_on_his_own_show/,False
1g9cq00,Lara Trump Eloquently Dismantles Breakfast Club's Fear Mongering of Donald Trump,https://rumble.com/v5jn9kc-lara-trump-eloquently-dismantles-breakfast-clubs-fear-mongering-of-donald-t.html,,7,2,proandcon111,conservatives,2024-10-22 07:46:38+00:00,0.77,/r/conservatives/comments/1g9cq00/lara_trump_eloquently_dismantles_breakfast_clubs/,False
1g9m4zh,Vegas Betting Odds now has trump at 60%,https://electionbettingodds.com/President2024_week.html,,170,39,Specter017,Conservative,2024-10-22 16:19:56+00:00,0.69,/r/Conservative/comments/1g9m4zh/vegas_betting_odds_now_has_trump_at_60/,False
1g9okfl,Trackdown Trump from 1958! ,https://i.redd.it/h512a639kcwd1.jpeg,"https://www.youtube.com/watch?v=SMHTZTtdRvE

This is weird.  A TV show way before most of us been born talks about a con man Trump.  He can build a wall and only he can save us.   Hmmm.  🤔 hmm ",11,1,JASPER933,democrats,2024-10-22 17:59:52+00:00,0.93,/r/democrats/comments/1g9okfl/trackdown_trump_from_1958/,False
1g9dg93,Christians should not normalize Trump,https://www.reddit.com/r/Christianity/comments/1g9dg93/christians_should_not_normalize_trump/,"Christians should realize Trump is using them; he disregards their morality, he dismisses human dignity; he shows no respect for the common good. Why do so many either support him, or at least, normalize him? None of us should: [https://www.patheos.com/blogs/henrykarlson/2024/10/prs-xxiii-we-must-not-normalize-trump/](https://www.patheos.com/blogs/henrykarlson/2024/10/prs-xxiii-we-must-not-normalize-trump/)",118,1028,SergiusBulgakov,Christianity,2024-10-22 08:42:41+00:00,0.6,/r/Christianity/comments/1g9dg93/christians_should_not_normalize_trump/,False
1g8y6j6,Fox FINALLY fact checks Trump to his face,https://v.redd.it/xzqvdpxet5wd1,,8855,524,hoodratpolitics,BoomersBeingFools,2024-10-21 19:19:12+00:00,0.98,/r/BoomersBeingFools/comments/1g8y6j6/fox_finally_fact_checks_trump_to_his_face/,False
1g9s1i1,Trump: “I need the kind of generals Hitler had”,https://www.theatlantic.com/politics/archive/2024/10/trump-military-generals-hitler/680327/,,149,283,HatsOnTheBeach,moderatepolitics,2024-10-22 20:21:32+00:00,0.68,/r/moderatepolitics/comments/1g9s1i1/trump_i_need_the_kind_of_generals_hitler_had/,False
1g8s2st,Crazed Trump ally had a homophobic meltdown after Pete Buttigieg joked about Donald Trump,https://www.lgbtqnation.com/2024/10/crazed-trump-ally-has-a-homophobic-meltdown-after-pete-buttigieg-joked-about-donald-trump/,,282,8,jk_arundel,LGBTnews,2024-10-21 15:13:40+00:00,1.0,/r/LGBTnews/comments/1g8s2st/crazed_trump_ally_had_a_homophobic_meltdown_after/,False
1g96vn4,A plea to Trump voters.,https://i.redd.it/93vifezqq7wd1.jpeg,,403,48,Engetarist,Trumpvirus,2024-10-22 01:47:22+00:00,0.99,/r/Trumpvirus/comments/1g96vn4/a_plea_to_trump_voters/,False
1g9tgv5,Oh My: Trump Beats Harris to the Rogan Podcast,https://hotair.com/ed-morrissey/2024/10/22/oh-my-trump-beats-harris-to-the-rogan-podcast-n3796132,,108,23,Ask4MD,Conservative,2024-10-22 21:21:38+00:00,0.75,/r/Conservative/comments/1g9tgv5/oh_my_trump_beats_harris_to_the_rogan_podcast/,False
1g9ucqt,"Walz on Trump, Elon and corruption",https://v.redd.it/wn8ubsh2rdwd1,"""Elon was on that stage jumping around skipping like a dipshit. That guy is literally the richest man in the world, spending millions of dollars to help Donald Trump buy an election. Trump has already promised that he would put Elon in charge of government regulations that oversee the businesses that Elon runs. In other words, Trump is openly promising corruption""",20,2,MathiasHan,Destiny,2024-10-22 22:00:13+00:00,1.0,/r/Destiny/comments/1g9ucqt/walz_on_trump_elon_and_corruption/,False
1g9vqm5,Trump callers posing as “Team Harris.”,https://www.reddit.com/r/NorthCarolina/comments/1g9vqm5/trump_callers_posing_as_team_harris/,"I just had a very strange call of what seems like Trump campaigners pretending to be Harris campaigners. 

A lady called with a Cary number saying she was with “Democratic Volunteer” then she asked me the following:

Her: How can we get you to go out and vote? Reply: I already did..

Her: Did you vote for Trump? Reply: No

Her: Did you vote for Harris Reply: Yes

Her: oh you voted for Harris?

Her: For governor who did you vote for? 
Reply: I answered before she finished “Josh Stein”

She says “Oh ok. Thank you.” And then asks “Would you like to volunteer for Team Trump?”

WHAT!?

I asked her again who she she’s with any she says “Team Harris” but then when I asked her why she asked me to volunteer for “Team Trump” she said “I’m just trying to get people to volunteer.”

I asked her again “If you’re Team Harris why are you asking me to volunteer for Team Trump?” Her: “I just want people to volunteer, it’s an important election.”

I shouldn’t have answered her questions….
Now reflecting, I should have know something was up when she asked me if I voted for Trump as her first question after her intro. 

Has anyone else had a call like this?
What would be the benefit of doing this?",24,4,DuckSeveral,NorthCarolina,2024-10-22 23:03:14+00:00,0.85,/r/NorthCarolina/comments/1g9vqm5/trump_callers_posing_as_team_harris/,False
1g9m9y9,AOC accuses Elon Musk and Donald Trump of 'laughing at' working people,https://www.newsweek.com/alexandria-ocasio-cortez-elon-musk-donald-trump-working-people-1972844,,1427,40,Murky-Site7468,politics,2024-10-22 16:25:25+00:00,0.96,/r/politics/comments/1g9m9y9/aoc_accuses_elon_musk_and_donald_trump_of/,False
1g8x42h,An Alarming Number of Republicans Want Trump to Do Another Coup. One in Five Republicans Support Trump Doing Whatever it Takes to Reclaim Power.,https://newrepublic.com/post/187350/alarming-number-republicans-want-trump-another-coup,,3807,515,OkayButFoRealz,politics,2024-10-21 18:36:12+00:00,0.95,/r/politics/comments/1g8x42h/an_alarming_number_of_republicans_want_trump_to/,False
1g9gstq,What’s wrong with Donald Trump?,https://www.nytimes.com/2024/10/22/opinion/donald-trump-ezra-klein-podcast.html?unlocked_article_code=1.UE4.ghv7.2tWZY8wPWz60&smid=nytcore-ios-share&referringSource=articleShare,,99,28,Thetimmybaby,usanews,2024-10-22 12:21:52+00:00,0.94,/r/usanews/comments/1g9gstq/whats_wrong_with_donald_trump/,False
1g999w3,AI Trump working at McDonald's ,https://v.redd.it/v0rp4hr5d8wd1,,572,96,Urmomsjuicyvagina,AIArtwork,2024-10-22 03:53:09+00:00,0.89,/r/AIArtwork/comments/1g999w3/ai_trump_working_at_mcdonalds/,False
1g9ud3c,Perhaps Trump shouldn't be allowed to work the frier anymore.,https://i.redd.it/7kizw6p4rdwd1.png,,173,26,ForwardBias,PoliticalHumor,2024-10-22 22:00:36+00:00,0.98,/r/PoliticalHumor/comments/1g9ud3c/perhaps_trump_shouldnt_be_allowed_to_work_the/,False
1g9sq8a,Christian Nationalists are worshipping Trump like a deity.,https://www.reddit.com/gallery/1g9sq8a,"You know how the Bible says the antichrist will have everyone worship him and get his mark on their FOREHEAD OR WRIST and anyone who opposes his laws will be punished (ahem… project 2025)

You know what’s strange, I made a hypothetical question in r /Christianity asking what if Trump was the antichrist, and some people got mad at me and insulted me. One guy even called me fat.",67,6,PearPublic7501,religiousfruitcake,2024-10-22 20:50:36+00:00,0.96,/r/religiousfruitcake/comments/1g9sq8a/christian_nationalists_are_worshipping_trump_like/,False
1g9p5u4,Trump’s Deranged Plan to Lower Food Prices by Raising Them,https://www.theatlantic.com/politics/archive/2024/09/trump-tariffs-grocery-prices/679942/,,452,60,Ok-Strawberry-9474,NewsOfTheStupid,2024-10-22 18:23:49+00:00,0.98,/r/NewsOfTheStupid/comments/1g9p5u4/trumps_deranged_plan_to_lower_food_prices_by/,False
1g9jq97,Trump Defends Right to Make Threats Against FEMA Workers,https://www.thedailybeast.com/trump-defends-right-to-make-threats-against-fema-workers/,,435,32,SaaS_Queen,asheville,2024-10-22 14:39:11+00:00,0.9,/r/asheville/comments/1g9jq97/trump_defends_right_to_make_threats_against_fema/,False
1g9us1i,"Scranton, PA Trump Rally",https://youtu.be/ZEgd_hueejY?si=9pEK0Yw3Zy5zn5j7,"The Good Liars visit beautiful Scranton, PA and talk to Trump supporters about aliens, agreeing and disagreeing with Trump, Obama and MORE!
",5,0,JimCripe,LibHumor,2024-10-22 22:18:45+00:00,1.0,/r/LibHumor/comments/1g9us1i/scranton_pa_trump_rally/,False
1g9nt2c,Trump-backed plan seeks to overturn Biden's climate policies,https://www.dailyclimate.org/trump-backed-plan-seeks-to-overturn-biden-s-climate-policies-2669448315.html,,200,22,snappydo99,climate,2024-10-22 17:28:06+00:00,0.95,/r/climate/comments/1g9nt2c/trumpbacked_plan_seeks_to_overturn_bidens_climate/,False
1g9ro6z,Trump: ‘I Need the Kind of Generals That Hitler Had’,https://www.theatlantic.com/politics/archive/2024/10/trump-military-generals-hitler/680327/?utm_source=reddit&utm_medium=social&utm_campaign=the-atlantic&utm_content=edit-promo,,245,84,theatlantic,inthenews,2024-10-22 20:06:12+00:00,0.95,/r/inthenews/comments/1g9ro6z/trump_i_need_the_kind_of_generals_that_hitler_had/,False
1g9kpgv,(USA) Trump over-salts the fries 🧂🍟,https://v.redd.it/kwj1n87nrbwd1,"High blood pressure anyone? Even the employee said, “Whoa!”",114,42,tom_wilson1150,McDonaldsEmployees,2024-10-22 15:20:06+00:00,0.89,/r/McDonaldsEmployees/comments/1g9kpgv/usa_trump_oversalts_the_fries/,False
1g92qrt,Walz grills Trump for McDonald’s ‘cosplaying’,https://thehill.com/newsletters/business-economy/4945802-walz-grills-trump-for-mcdonalds-cosplaying/,,3994,140,don_caveuto,politics,2024-10-21 22:27:52+00:00,0.97,/r/politics/comments/1g92qrt/walz_grills_trump_for_mcdonalds_cosplaying/,False
1g9u3az,Why do Mormons so obsessed with Trump ,https://i.redd.it/l9shit43pdwd1.jpeg,"Sorry for being political, but lately my fb page is swarmed by pro-trump and anti-Harris cringy videos, my friends we are in Canada and you’re not even a US citizen why do u care so much😭🙏, is Trump a new Mormon prophet or god or something?",41,59,LDNiko,exmormon,2024-10-22 21:48:45+00:00,0.8,/r/exmormon/comments/1g9u3az/why_do_mormons_so_obsessed_with_trump/,False
1g9vsjc,"With Election Looming, John Kelly Speaks Out on Trump",https://www.nytimes.com/2024/10/22/us/politics/john-kelly-trump-fitness-character.html,,94,14,RoachedCoach,politics,2024-10-22 23:05:39+00:00,0.96,/r/politics/comments/1g9vsjc/with_election_looming_john_kelly_speaks_out_on/,False
1g9i4x4,'Virtually nothing is correct': Fact-checker left stunned by Trump swing state attack ad,https://www.rawstory.com/michigan-trump-ad/,,5056,107,h20poIo,inthenews,2024-10-22 13:28:15+00:00,0.99,/r/inthenews/comments/1g9i4x4/virtually_nothing_is_correct_factchecker_left/,False
1g9chsa,Kamala Harris beats Donald Trump on disaster response: New polling,https://www.newsweek.com/harris-trump-hurricane-relief-fema-poll-1972641,,2097,92,newsweek,politics,2024-10-22 07:28:30+00:00,0.96,/r/politics/comments/1g9chsa/kamala_harris_beats_donald_trump_on_disaster/,False
1g9g9er,Trump has made more than 100 threats to prosecute or punish perceived enemies,https://www.npr.org/2024/10/21/nx-s1-5134924/trump-election-2024-kamala-harris-elizabeth-cheney-threat-civil-liberties,,3748,91,Iknowwecanmakeit,politics,2024-10-22 11:53:30+00:00,0.98,/r/politics/comments/1g9g9er/trump_has_made_more_than_100_threats_to_prosecute/,False
1g9csvm,Lara Trump Eloquently Dismantles Breakfast Club's Fear Mongering of Donald Trump,https://rumble.com/v5jn9kc-lara-trump-eloquently-dismantles-breakfast-clubs-fear-mongering-of-donald-t.html,,5,0,proandcon111,TrendingPolitics,2024-10-22 07:52:55+00:00,1.0,/r/TrendingPolitics/comments/1g9csvm/lara_trump_eloquently_dismantles_breakfast_clubs/,False
1g9tx4n,Georgia Supreme Court declines to reinstate Trump-allied board’s election rules ,https://www.washingtonpost.com/politics/2024/10/22/georgia-supreme-court-declines-reinstate-trump-allied-boards-election-rules/?utm_campaign=wp_main&utm_medium=social&utm_source=reddit.com,,407,26,washingtonpost,politics,2024-10-22 21:41:20+00:00,0.99,/r/politics/comments/1g9tx4n/georgia_supreme_court_declines_to_reinstate/,False
1g9g3w6,Harris: Donald Trump is no friend of labor.,https://x.com/KamalaHarris/status/1847650255166128257,,326,3,BlueEagleFly,OurPresident,2024-10-22 11:45:09+00:00,0.99,/r/OurPresident/comments/1g9g3w6/harris_donald_trump_is_no_friend_of_labor/,False
1g9n9f4,Trump Reveals Why He Wants America to Return to 1798 in Ominous Speech - Donald Trump admitted exactly how far back we wants to take America.,https://newrepublic.com/post/187380/trump-america-return-1798-immigrants,,110,25,Quirkie,politics,2024-10-22 17:05:40+00:00,0.89,/r/politics/comments/1g9n9f4/trump_reveals_why_he_wants_america_to_return_to/,False
1g9fxgt,Just early voted for Trump! My first election.,https://www.reddit.com/r/trump/comments/1g9fxgt/just_early_voted_for_trump_my_first_election/,"First election, voted straight R (except for unopposed democrat judges). I voted for Trump in the primary. Harris County, TX",368,37,putoriuse,trump,2024-10-22 11:34:51+00:00,0.92,/r/trump/comments/1g9fxgt/just_early_voted_for_trump_my_first_election/,False
1g9s278,A vote for Trump is a vote for Vance,https://i.redd.it/179fkaao9dwd1.png,,120,17,CommercialPound1615,WhitePeopleTwitter,2024-10-22 20:22:21+00:00,0.98,/r/WhitePeopleTwitter/comments/1g9s278/a_vote_for_trump_is_a_vote_for_vance/,False
1g9t78g,"McDonald's Customer Cornered by Trump And Told Graphic Arnold Palmer Shower Story After Trump Mishears Order for an ""Extra Large Coke""",https://www.reddit.com/r/onionheadlines/comments/1g9t78g/mcdonalds_customer_cornered_by_trump_and_told/,,14,1,Present-Smoke-9950,onionheadlines,2024-10-22 21:10:07+00:00,0.94,/r/onionheadlines/comments/1g9t78g/mcdonalds_customer_cornered_by_trump_and_told/,False
1g9n6kl,Elon Musk’s Massive Plan to Help Trump Is Hilariously Crumbling,https://newrepublic.com/post/187389/donald-trump-elon-musk-plan-ground-game,,563,56,likeaforest,Fuckthealtright,2024-10-22 17:02:30+00:00,0.99,/r/Fuckthealtright/comments/1g9n6kl/elon_musks_massive_plan_to_help_trump_is/,False
1g9tl9d,Trump's Sales Tax,https://www.reddit.com/r/economy/comments/1g9tl9d/trumps_sales_tax/,"A simple chart that puts the price tag on the Trump's Sales Tax that we can expect to pay at the register

https://preview.redd.it/2ak62ugc7ewd1.jpg?width=1080&format=pjpg&auto=webp&s=7e505137b60c21e96020c898383b4a9ee15b5027

",4,8,Odd_Seaweed_3420,economy,2024-10-22 21:26:56+00:00,0.64,/r/economy/comments/1g9tl9d/trumps_sales_tax/,False
1g9pjvp,"Wow! In 2020, Trump was (-16). ",https://i.redd.it/q5vn4c9ercwd1.jpeg,,28,53,Curry_For_Three,YAPms,2024-10-22 18:39:54+00:00,0.87,/r/YAPms/comments/1g9pjvp/wow_in_2020_trump_was_16/,False
1g9jpli,"MAGA Supporter with Republican Connections Allegedly Attempts to Harm Donald Trump, MAGA Leader",https://buzzzingo.com/maga-supporter-with-republican-connections-arrested-for-alleged-attempt-on-trumps-life-in-coachella/,,2019,83,whatisoo,LeopardsAteMyFace,2024-10-22 14:38:21+00:00,0.95,/r/LeopardsAteMyFace/comments/1g9jpli/maga_supporter_with_republican_connections/,False
1g9qsri,The St. Louis native who leaked Trump's tax returns,https://i.redd.it/9h36seyb0dwd1.png,,187,35,SLMNick,StLouis,2024-10-22 19:30:46+00:00,0.83,/r/StLouis/comments/1g9qsri/the_st_louis_native_who_leaked_trumps_tax_returns/,False
1g95230,Trump 2024!!! ,https://i.redd.it/77yyixtqa7wd1.jpeg,,73,3,gamer_guts,trump,2024-10-22 00:17:42+00:00,0.86,/r/trump/comments/1g95230/trump_2024/,False
1g990vi,Trump Defends Right to Make Threats Against FEMA Workers,https://www.thedailybeast.com/trump-defends-right-to-make-threats-against-fema-workers/,,2159,101,Real-Work-1953,NewsOfTheStupid,2024-10-22 03:39:13+00:00,0.98,/r/NewsOfTheStupid/comments/1g990vi/trump_defends_right_to_make_threats_against_fema/,False
1g96nne,BWNJ <3 trump,https://i.redd.it/7ia0rtapo7wd1.jpeg,Not surprising but BWNJ publicly liking trumps post 🤮,84,134,ComputerSlow8970,TheMorningToastSnark,2024-10-22 01:35:54+00:00,0.78,/r/TheMorningToastSnark/comments/1g96nne/bwnj_3_trump/,False
1g917ok,"The Trump Anthem:  ""Hail to the Donald--He is Victorious!""  is an anti-Trump song with lyrics so hated by Donald Trump that to repudiate a Trump copyright buyout they were placed into the public domain at:",https://www.williambrahms.com/pages/massachusetts_state_flag.html#T7,,53,0,RedRiverWindsock,EnoughTrumpSpam,2024-10-21 21:21:54+00:00,0.92,/r/EnoughTrumpSpam/comments/1g917ok/the_trump_anthem_hail_to_the_donaldhe_is/,False
1g9tc87,Donald Trump files legal complaint against UK Labour Party over help for Kamala Harris,https://www.politico.eu/article/donald-trump-legal-complaint-uk-labour-party-kamala-harris-us-election/,,987,136,michaelbachari,worldnews,2024-10-22 21:16:05+00:00,0.89,/r/worldnews/comments/1g9tc87/donald_trump_files_legal_complaint_against_uk/,False
1g9go3j,Trump Sends New Demand to CBS Over Harris’ ‘60 Minutes’ Interview,https://www.thedailybeast.com/donald-trump-sends-new-demand-to-cbs-over-harris-60-minutes-interview/,,1166,197,ObjectiveAd6551,NewsOfTheStupid,2024-10-22 12:15:00+00:00,0.96,/r/NewsOfTheStupid/comments/1g9go3j/trump_sends_new_demand_to_cbs_over_harris_60/,False
1g8tnzn,Trump’s McDonald’s gig was staged,https://v.redd.it/g87jbn97x4wd1,,9976,1836,Salty-Ad-3213,TikTokCringe,2024-10-21 16:18:12+00:00,0.83,/r/TikTokCringe/comments/1g8tnzn/trumps_mcdonalds_gig_was_staged/,False
1g7lnjm,"Donald Trump, Donald Trump, Donald Trump, Donald Trump.",https://v.redd.it/6d52vfbrssvd1,,264,62,Xilbert0,Jordan_Peterson_Memes,2024-10-19 23:31:55+00:00,0.93,/r/Jordan_Peterson_Memes/comments/1g7lnjm/donald_trump_donald_trump_donald_trump_donald/,False
1g9pm67,Lawrence: ‘A vote for Jill Stein is a vote for Donald Trump’ and mass deportation,https://www.msnbc.com/the-last-word/watch/lawrence-a-vote-for-jill-stein-is-a-vote-for-donald-trump-mass-deportation-222339653815,,2163,222,peterst28,politics,2024-10-22 18:42:26+00:00,0.97,/r/politics/comments/1g9pm67/lawrence_a_vote_for_jill_stein_is_a_vote_for/,False
1g9dquc,Trump and Black men,https://www.reddit.com/r/thedavidpakmanshow/comments/1g9dquc/trump_and_black_men/,"Another interesting thing I believe is missing in this election is how we're forgetting Trump wanted to use the military / national guard in the inner cities like Detroit and Chicago. I'm a black man from Detroit, and there are other black men here who are talking about voting for Trump. Things get a little interesting though when you show them the clips of Trump wanting to send the military to the cities. AND with him *recently* using that same language about using the military on ""the enemy within,"" it makes you wonder if the people in the inner cities are included in this ""enemy within."" It'd be nice if Trump had to provide an answer for this, since he never has to answer for shit else.",40,53,Noofinator2,thedavidpakmanshow,2024-10-22 09:04:46+00:00,0.92,/r/thedavidpakmanshow/comments/1g9dquc/trump_and_black_men/,False
1g9us1t,Trump Raged at Slain Soldier’s Funeral Bill: ‘$60K to Bury a F***ing Mexican’,https://www.thedailybeast.com/trump-raged-at-slain-soldiers-funeral-bill-60k-to-bury-a-fing-mexican/,,1168,131,football_xix,politics,2024-10-22 22:18:46+00:00,0.98,/r/politics/comments/1g9us1t/trump_raged_at_slain_soldiers_funeral_bill_60k_to/,False
1g9s47p,Trump sending subliminal messages with his roundtables,https://i.redd.it/ido36ajc9dwd1.jpeg,,28,2,bramletabercrombe,PoliticalMemes,2024-10-22 20:24:41+00:00,0.98,/r/PoliticalMemes/comments/1g9s47p/trump_sending_subliminal_messages_with_his/,False
1g9b7mn,Former Trump aide thinks there might be a strategy behind Trump’s vulgar comments,https://edition.cnn.com/2024/10/21/politics/video/alyssa-farah-griffin-trump-vulgar-comments-arnold-palmer-ebof-digvid,,14,7,donutloop,CosmopolitanNews,2024-10-22 05:55:46+00:00,1.0,/r/CosmopolitanNews/comments/1g9b7mn/former_trump_aide_thinks_there_might_be_a/,False
1g9uv1q,Democrats are literally ripping up Trump signs.,https://i.redd.it/eyksn2t3vdwd1.jpeg,,22,3,EmperorSnake1,ShitPoliticsSays,2024-10-22 22:22:29+00:00,0.92,/r/ShitPoliticsSays/comments/1g9uv1q/democrats_are_literally_ripping_up_trump_signs/,False
1g9i3ak,Opinion | What’s Wrong With Donald Trump?,https://archive.ph/2024.10.22-131324/https://www.nytimes.com/2024/10/22/opinion/donald-trump-ezra-klein-podcast.html,,205,116,Maxcactus,AntiTrumpAlliance,2024-10-22 13:26:10+00:00,1.0,/r/AntiTrumpAlliance/comments/1g9i3ak/opinion_whats_wrong_with_donald_trump/,False
1g9nrq8,Trump-backed plan seeks to overturn Biden's climate policies,https://www.ehn.org/trump-backed-plan-seeks-to-overturn-biden-s-climate-policies-2669445895.html,,145,7,snappydo99,environment,2024-10-22 17:26:38+00:00,0.97,/r/environment/comments/1g9nrq8/trumpbacked_plan_seeks_to_overturn_bidens_climate/,False
1g9l0dw,Swearing Off Trump,https://i.redd.it/svlnxkoytbwd1.png,,6,0,RichLoammiser,HarrisWalz,2024-10-22 15:33:03+00:00,1.0,/r/HarrisWalz/comments/1g9l0dw/swearing_off_trump/,False
1g9twda,Donald Trump's Christian Nationalist Grift for Power ,https://www.youtube.com/watch?v=hNsOhlGGvgs,,49,8,Wooden_Reputation370,atheism,2024-10-22 21:40:26+00:00,0.95,/r/atheism/comments/1g9twda/donald_trumps_christian_nationalist_grift_for/,False
1g9mraz,Army ordered to release records on Trump’s Arlington cemetery visit,https://www.militarytimes.com/news/pentagon-congress/2024/10/22/army-ordered-to-release-records-on-trumps-arlington-cemetery-visit/,,486,10,LA_search77,The_Mueller,2024-10-22 16:45:23+00:00,1.0,/r/The_Mueller/comments/1g9mraz/army_ordered_to_release_records_on_trumps/,False
