id,title,url,selftext,score,num_comments,author,subreddit,created_utc,upvote_ratio,permalink,stickied
1g9ix7o,What’s Wrong with Donald Trump?,https://www.nytimes.com/2024/10/22/opinion/donald-trump-ezra-klein-podcast.html?smid=nytcore-ios-share&referringSource=articleShare,Truer words haven’t been spoken. Kudos to Ezra for the clarity in this episode. ,254,240,heli0s_7,ezraklein,2024-10-22 14:04:05+00:00,0.95,/r/ezraklein/comments/1g9ix7o/whats_wrong_with_donald_trump/,False
1g9hveh,Trump acknowledged Tiffany? Then it must be a lie,https://i.redd.it/8yujt6dk5bwd1.jpeg,,1517,127,basket_foso,PoliticalHumor,2024-10-22 13:15:47+00:00,0.99,/r/PoliticalHumor/comments/1g9hveh/trump_acknowledged_tiffany_then_it_must_be_a_lie/,False
1g9fq86,McDonald’s debunks Trump's accusation that Harris lied about fast food work,https://www.rawstory.com/trump-mcdonalds-kamala-harris/?10222024,,22519,1266,P_a_s_g_i_t_24,inthenews,2024-10-22 11:22:42+00:00,0.9,/r/inthenews/comments/1g9fq86/mcdonalds_debunks_trumps_accusation_that_harris/,False
1g9tcc5,John Kelly: Trump offered private praise for 'Hitler’s generals',https://www.msnbc.com/rachel-maddow-show/maddowblog/john-kelly-trump-offered-private-praise-hitlers-generals-rcna176664,,728,66,WhatYouThinkYouSee,politics,2024-10-22 21:16:13+00:00,0.97,/r/politics/comments/1g9tcc5/john_kelly_trump_offered_private_praise_for/,False
1g9ij03,"3 tell-tale signs that Harris will beat Trump: Real polls, fake polls, enthusiasm",https://www.nj.com/politics/2024/10/3-tell-tale-signs-that-kamala-harris-will-beat-donald-trump.html,,13662,2843,Kashmir75,politics,2024-10-22 13:46:45+00:00,0.87,/r/politics/comments/1g9ij03/3_telltale_signs_that_harris_will_beat_trump_real/,False
1g96l4e,Donald Trump,https://i.redd.it/x9ztgzc1o7wd1.jpeg,,181,1,cursingpeople,EnoughTrumpSpam,2024-10-22 01:32:16+00:00,0.97,/r/EnoughTrumpSpam/comments/1g96l4e/donald_trump/,False
1g9t4gj,Trump: ‘I Need the Kind of Generals That Hitler Had’,https://www.theatlantic.com/politics/archive/2024/10/trump-military-generals-hitler/680327/?taid=6717ffe956474d000110c05d&utm_campaign=the-atlantic&utm_content=true-anthem&utm_medium=social&utm_source=twitter,,590,121,RedRawTrashHatch,NewsOfTheStupid,2024-10-22 21:06:50+00:00,0.97,/r/NewsOfTheStupid/comments/1g9t4gj/trump_i_need_the_kind_of_generals_that_hitler_had/,False
1g9skmt,Trump Set To Go On Joe Rogan,https://www.dailywire.com/news/trump-set-to-go-on-joe-rogan,,148,28,interestingfactoid,Conservative,2024-10-22 20:44:01+00:00,0.76,/r/Conservative/comments/1g9skmt/trump_set_to_go_on_joe_rogan/,False
1g9mad6,Yellen says world was 'worse off' under Trump-era isolationism,https://fortune.com/2024/10/22/yellen-trump-isolationism-worse-off-imf-world-bank/,,1347,23,fortune,politics,2024-10-22 16:25:53+00:00,0.97,/r/politics/comments/1g9mad6/yellen_says_world_was_worse_off_under_trumpera/,False
1g9nf17,Jan. 6 should've disqualified Trump. The Supreme Court disagreed.,https://www.msnbc.com/msnbc/amp/shows/deadlinewhitehouse/blog/rcna175458,,665,18,bigedcactushead,CapitolConsequences,2024-10-22 17:12:11+00:00,1.0,/r/CapitolConsequences/comments/1g9nf17/jan_6_shouldve_disqualified_trump_the_supreme/,False
1g9r4yl,The Klan rides again. Trump has made this acceptable. ,https://i.redd.it/uiy16xlz2dwd1.jpeg,,490,60,AggressivelyProgress,conservativeterrorism,2024-10-22 19:44:53+00:00,0.97,/r/conservativeterrorism/comments/1g9r4yl/the_klan_rides_again_trump_has_made_this/,False
1g9mqja,Army ordered to release records on Trump’s Arlington cemetery visit,https://www.militarytimes.com/news/pentagon-congress/2024/10/22/army-ordered-to-release-records-on-trumps-arlington-cemetery-visit/,,2045,71,ob001,politics,2024-10-22 16:44:30+00:00,0.99,/r/politics/comments/1g9mqja/army_ordered_to_release_records_on_trumps/,False
1g9vkxv,This is what Trump really thought of Vanessa Guillen. ,https://www.reddit.com/gallery/1g9vkxv,,216,31,CalifaDaze,LatinoPeopleTwitter,2024-10-22 22:56:09+00:00,0.9,/r/LatinoPeopleTwitter/comments/1g9vkxv/this_is_what_trump_really_thought_of_vanessa/,False
1g9v5to,AI Trump at McDonald's ,https://v.redd.it/yj7mfokfxdwd1,,27,6,GluttonoussGoblin,shitposting,2024-10-22 22:36:09+00:00,0.88,/r/shitposting/comments/1g9v5to/ai_trump_at_mcdonalds/,False
1g9u49n,Trump 2024 ,https://www.reddit.com/r/Trump2024to2028/comments/1g9u49n/trump_2024/,[https://www.youtube.com/watch?v=dwqzXSPRtvI](https://www.youtube.com/watch?v=dwqzXSPRtvI),4,0,Previous_Extreme_792,Trump2024to2028,2024-10-22 21:49:54+00:00,1.0,/r/Trump2024to2028/comments/1g9u49n/trump_2024/,False
1g9o4u3,Trump confidant Laura Loomer claims she is ‘blacker’ than Kamala Harris,https://www.independent.co.uk/news/world/americas/us-politics/donald-trump-laura-loomer-kamala-harris-black-b2633558.html,,1503,232,RedRawTrashHatch,NewsOfTheStupid,2024-10-22 17:41:46+00:00,0.97,/r/NewsOfTheStupid/comments/1g9o4u3/trump_confidant_laura_loomer_claims_she_is/,False
1g9itl3,How could Trump do this to mcdondal!!!,https://v.redd.it/9mpmrx3fdbwd1,,336,34,prodigalsun888,lies,2024-10-22 13:59:58+00:00,0.94,/r/lies/comments/1g9itl3/how_could_trump_do_this_to_mcdondal/,False
1g9rv7r,I’m pretty sure my parents just committed voter fraud for Trump!,https://i.redd.it/hkl14j388dwd1.jpeg,"So here’s the deal: my sister has a disease called PANS, and she is in the middle of a relapse which for her means she’s not at all there mentally. Think of a crazy person ranting nonstop about absolute nonsense, making connections between random thoughts, jumping from topic to topic. 

In my opinion, she could very easily be declared mentally incompetent in court. 

Shockingly, my parents decided to “walk her through the ballot”. To vote for “who she would have voted for anyways”. Like WTF. 

My dad who believes the election was stolen does this! 

I live in Michigan btw -  a swing state. My brother and I are canceling out my parents votes. But now we got +1 for Trump from our family from frickin voter fraud. 

Please for the love of all that is good, if you are a democrat and are thinking of not voting. Just do it for me. Please. Especially if you are in Michigan. Please! ",1607,306,EB-Crusher,democrats,2024-10-22 20:14:14+00:00,0.93,/r/democrats/comments/1g9rv7r/im_pretty_sure_my_parents_just_committed_voter/,False
1g9ru2x,Trump just cancelled ANOTHER town hall,https://i.redd.it/ct0dk67zqcwd1.png,,56,1,The-Writer_30,MeidasTouch,2024-10-22 20:12:55+00:00,1.0,/r/MeidasTouch/comments/1g9ru2x/trump_just_cancelled_another_town_hall/,False
1g9l3rz,Jan. 6 should've disqualified Trump. The Supreme Court disagreed.,https://www.msnbc.com/deadline-white-house/deadline-legal-blog/trump-shouldnt-be-eligible-presidency-jan-6-rcna175458,,908,60,justin_quinnn,law,2024-10-22 15:37:02+00:00,0.98,/r/law/comments/1g9l3rz/jan_6_shouldve_disqualified_trump_the_supreme/,False
1g9ofs7,"If Trump wins, blame the New York Times",https://presswatchers.org/2024/10/if-trump-wins-blame-the-new-york-times/,,278,32,Auntie_M123,AntiTrumpAlliance,2024-10-22 17:54:24+00:00,0.99,/r/AntiTrumpAlliance/comments/1g9ofs7/if_trump_wins_blame_the_new_york_times/,False
1g9s3o0,What if it isn't about Trump?,https://www.reddit.com/r/Defeat_Project_2025/comments/1g9s3o0/what_if_it_isnt_about_trump/,"What if P2025 is the Republican platform? What if it doesn't matter who is president? It could be a goal that would still exist and happen no matter which Republican is in office.

And it's already in motion considering the Supreme Court right now. Maybe it's already a done deal. ",70,40,GoldCoastCat,Defeat_Project_2025,2024-10-22 20:24:02+00:00,0.94,/r/Defeat_Project_2025/comments/1g9s3o0/what_if_it_isnt_about_trump/,False
1g9leds,Scamvangelist Paula White: Trump Repeated My Sermons Verbatim.,https://www.joemygod.com/2024/10/scamvangelist-trump-repeated-my-sermons-verbatim/,,406,19,Leeming,atheism,2024-10-22 15:49:21+00:00,0.98,/r/atheism/comments/1g9leds/scamvangelist_paula_white_trump_repeated_my/,False
1g9r1nw,"Elon cares about his government contracts, not Trump ",https://i.redd.it/gwsgqoia2dwd1.jpeg,,186,2,Detroitish24,WhitePeopleTwitter,2024-10-22 19:40:59+00:00,0.98,/r/WhitePeopleTwitter/comments/1g9r1nw/elon_cares_about_his_government_contracts_not/,False
1g9g8v4,Remember: Donald Trump shouldn’t even be eligible for the presidency after Jan. 6,https://www.msnbc.com/deadline-white-house/deadline-legal-blog/trump-shouldnt-be-eligible-presidency-jan-6-rcna175458,,14265,442,plz-let-me-in,politics,2024-10-22 11:52:37+00:00,0.96,/r/politics/comments/1g9g8v4/remember_donald_trump_shouldnt_even_be_eligible/,False
1g9qy02,Trump’s Actual Agenda,https://www.nytimes.com/interactive/2024/06/16/us/politics/trump-policy-list-2025.html?unlocked_article_code=1.UE4.brjR.F1_hmo7nUST6&smid=url-share,"Please take a look at this article (there’s no paywall) and look at some of the things that Trump wants to do to ruin this country. 

Among them are ending birthright citizenship, build internment camps for illegal immigrants, politicize nonpartisan positions.

Please share this with anyone on the fence and point out that especially the last one would increase government disfunction even more than it already has been when every election would mean firing tens of thousands of civil servants and rehiring new ones. It would be a mess. ",17,2,Reelwizard,KamalaHarris,2024-10-22 19:36:44+00:00,0.95,/r/KamalaHarris/comments/1g9qy02/trumps_actual_agenda/,False
1g9tfc8,"Trump: “It doesn’t cost 60,000 bucks to bury a f--king Mexican!”",https://i.redd.it/0yd0lr5xjdwd1.jpeg,,2897,263,UnluckyStar237,WhitePeopleTwitter,2024-10-22 21:19:47+00:00,0.99,/r/WhitePeopleTwitter/comments/1g9tfc8/trump_it_doesnt_cost_60000_bucks_to_bury_a_fking/,False
1g9rn5e,Trump: ‘I Need the Kind of Generals That Hitler Had’,https://www.theatlantic.com/politics/archive/2024/10/trump-military-generals-hitler/680327/?utm_source=reddit&utm_medium=social&utm_campaign=the-atlantic&utm_content=edit-promo,,582,81,theatlantic,politics,2024-10-22 20:05:04+00:00,0.95,/r/politics/comments/1g9rn5e/trump_i_need_the_kind_of_generals_that_hitler_had/,False
1g9sk13,Charlamagne Tha God Laughs In Lara Trump's Face After She Claims Trump Isn't 'Racist',https://www.comicsands.com/charlamagne-lara-donald-trump-racist-2669457078.html,,4,1,Blue_Wave2024,MAGAnonsense,2024-10-22 20:43:14+00:00,0.84,/r/MAGAnonsense/comments/1g9sk13/charlamagne_tha_god_laughs_in_lara_trumps_face/,False
1g9ka8n,"To Trump, Everything is Rigged Against Him",https://www.reddit.com/gallery/1g9ka8n,Definition of a sore loser…?,230,130,DrRockBoognish,the_everything_bubble,2024-10-22 15:02:42+00:00,0.96,/r/the_everything_bubble/comments/1g9ka8n/to_trump_everything_is_rigged_against_him/,False
1g9fhva,David Letterman Exposes Donald Trump,https://youtu.be/SYoOPgeTMQc?si=c1FJ58KhsAIrct8y,,143,21,Captain_Smartass_,AntiTrumpAlliance,2024-10-22 11:08:20+00:00,0.98,/r/AntiTrumpAlliance/comments/1g9fhva/david_letterman_exposes_donald_trump/,False
1g8xx3h,"Trump attempted a coup in 2020 and the guardrails for Democracy barely held. Yet some of you will with a straight face say: ""Trump isn't a threat to democracy"". ",https://i.redd.it/vhltsmkyq5wd1.jpeg,,26628,4122,GabeSter,AdviceAnimals,2024-10-21 19:08:32+00:00,0.79,/r/AdviceAnimals/comments/1g8xx3h/trump_attempted_a_coup_in_2020_and_the_guardrails/,False
1g978gp,Vote For Trump,https://www.reddit.com/gallery/1g978gp,Amsterdam Rules!,239,10,Antron-Eiderlon,trump,2024-10-22 02:05:10+00:00,0.9,/r/trump/comments/1g978gp/vote_for_trump/,False
1g9ngco,Survey shows that young voters strongly prefer Harris to Trump.,https://thehill.com/blogs/blog-briefing-room/news/4946838-young-voters-prefer-harris-poll/,,785,69,shami1111,politics,2024-10-22 17:13:43+00:00,0.96,/r/politics/comments/1g9ngco/survey_shows_that_young_voters_strongly_prefer/,False
1g9lns9,"Trump claims if Kamala wins, there won't be another election",https://i.redd.it/t2utbdbuybwd1.png,,1141,416,dimforest,WhitePeopleTwitter,2024-10-22 16:00:25+00:00,0.96,/r/WhitePeopleTwitter/comments/1g9lns9/trump_claims_if_kamala_wins_there_wont_be_another/,False
1g9t21i,Trump on Rogan!,https://www.politico.com/live-updates/2024/10/22/2024-elections-live-coverage-updates-analysis/trump-joe-rogan-podcast-00184894,,7,2,LeoLover77,TheBidenshitshow,2024-10-22 21:04:12+00:00,0.89,/r/TheBidenshitshow/comments/1g9t21i/trump_on_rogan/,False
1g9opy0,Trump’s Pathetic McDonald’s Stunt Backfires Spectacularly,https://newrepublic.com/post/187339/trump-dodges-major-question-minimum-wage-mcdonalds,,389,76,P_a_s_g_i_t_24,politics,2024-10-22 18:05:57+00:00,0.95,/r/politics/comments/1g9opy0/trumps_pathetic_mcdonalds_stunt_backfires/,False
1g9vq7o,"Trump's own former Whitehouse Director Alyssa Griffin, who knows him very well, says that Trump is the most unfit man for the presidency in all of our lifetimes!",https://v.redd.it/j7jznwz42ewd1,,317,49,snappydo99,TikTokCringe,2024-10-22 23:02:43+00:00,0.93,/r/TikTokCringe/comments/1g9vq7o/trumps_own_former_whitehouse_director_alyssa/,False
1g9d5m5,Trump only fans,https://i.redd.it/vow3qde7o9wd1.jpeg,,56,4,hottiesxbabe,Memes_Of_The_Dank,2024-10-22 08:20:25+00:00,0.87,/r/Memes_Of_The_Dank/comments/1g9d5m5/trump_only_fans/,False
1g9v4g6,Trump Crimes Lest We Forget,https://store.mcsweeneys.net/products/lest-we-forget-the-horrors,,18,1,Bleedingeck,Defeat_Project_2025,2024-10-22 22:34:23+00:00,0.96,/r/Defeat_Project_2025/comments/1g9v4g6/trump_crimes_lest_we_forget/,False
1g9mgoe,Trump no McDonald's,https://i.redd.it/3emf3dsr4cwd1.jpeg,Aí está uma coisa que eu faria se fosse bilionário: trabalhar em subemprego e falar que é divertido.,33,21,-Kosmux,farialimabets,2024-10-22 16:33:06+00:00,0.81,/r/farialimabets/comments/1g9mgoe/trump_no_mcdonalds/,False
1g94uej,Reporter's anecdote about Trump supporters is truly scary if true: 30 of 50 asked say Trump won California in 2020...,https://www.reddit.com/r/skeptic/comments/1g94uej/reporters_anecdote_about_trump_supporters_is/,"[""_...because I was actually at his rally in Coachella, CA a week ago this weekend and went to talk to 50 of his supporters there at that rally and very straightforwardly asked them whether they believed that Donald Trump had actually won the 2020 election in California **and out of those 50 individuals — trump supporters that I talked to   — 30 of them said that**..._ ](https://youtu.be/pPNaB-2qFRQ?t=638)

.

I don't know what to say beyond providing a link to the clip.",703,112,saijanai,skeptic,2024-10-22 00:07:01+00:00,0.93,/r/skeptic/comments/1g94uej/reporters_anecdote_about_trump_supporters_is/,False
1g9awyx,Central Park Five sue Donald Trump for jogger case remarks made at presidential debate - Five innocent men that Trump wanted executed,https://apnews.com/article/central-park-five-exonerated-donald-trump-lawsuit-harris-6d7cfa4e5d117fb653d83555423b35f9,,489,6,burtzev,The_Mueller,2024-10-22 05:34:55+00:00,1.0,/r/The_Mueller/comments/1g9awyx/central_park_five_sue_donald_trump_for_jogger/,False
1g9rw89,"Following ‘exhaustion’ report, Trump cancels yet another appearance",https://www.msnbc.com/msnbc/amp/shows/maddow/blog/rcna176616,,154,40,hhh888hhhh,inthenews,2024-10-22 20:15:26+00:00,0.98,/r/inthenews/comments/1g9rw89/following_exhaustion_report_trump_cancels_yet/,False
1g9jdov,Trump is doing more damage than the storm.,https://www.reddit.com/r/NorthCarolina/comments/1g9jdov/trump_is_doing_more_damage_than_the_storm/,"

North Carolina, it is simply beyond comprehension that you can support a man who has gone out of his way to do further harm to your storm ravaged communities; he doesn't give a damn about the pain his constant lying provokes!

It's plain to see his lies are meant to manipulate, to deceive, and if he can convince you through his duplicity that your own government is working against you, then that will fulfill the lust for power that drives him.

He claims he has policies that will cure America's ills, yet he never divulges any real policy, Rather, in his rallies he concentrates on spreading fear, causing division, and trying to manipulate through terror tactics by taking your attention from the real issue.

Listen to his words, do you really believe any of them? And if you see the absurdity now, consider whether he'll ever follow through on his promises.

Look at this -- boldface mine.



""Communities across the Southeast, most notably in North Carolina, have spent the last several weeks trying to recover from Hurricane Helene and its aftermath. It was against this backdrop that **Donald Trump** visited the Tar Heel State two weeks ago and pursued a radical idea: Maybe, the former president said, he could advance his own interests by **brazenly lying about the governmental response** to the deadly storm. **State and local officials, including plenty of Republicans,** asked him to **stop deceiving** the public, but he ignored the appeals — even as evidence emerged that **Trump’s lies were having an adverse impact** on the response to the crisis.

It was, by some measures, a genuine **election-season scandal:** The GOP nominee for the nation’s highest office saw **devastated communities and human suffering,** which inspired **Trump to repeatedly lie about the heartbreaking circumstances,** hoping it would advance **his quest for power.** Two weeks later, he did it again. NBC News reported that the former president returned to North Carolina, where he “again **made the false claim that FEMA had no money to help victims in the hurricane-stricken area because it was spending funds on migrants.”**

As he’s done for weeks, Trump appeared to conflate two completely separate funds to paint a **misleading picture**. FEMA has **dedicated disaster relief money that cannot be used for other purposes,** and it was separately tasked by Congress in 2022 to disseminate money from Customs and Border Protection to help communities that received influxes of migrants. “They spent a lot of money on bringing illegal migrants. ... They don’t have any money for the people who live here,” **Trump said, despite reality.** “They’ve spent it on illegal migrants.”

**He was, of course, lying —** or more to the point, he was echoing previous lies, which he knows have been discredited, but which he continued to repeat in the hopes that it’ll benefit him personally.

Reminded that these and related conspiratorial lives have led to threats against FEMA workers in the area, Trump expressed relative indifference. “I think you have to let people know how they’re doing,” he told reporters. “If they’re doing a poor job, are we not supposed to say it?” I’m not in a position to say whether Trump actually believes his lies, or whether he knows he’s peddling nonsense. But either way, the consequences of his dangerous lies are the same.

To be sure, I’m mindful of the broader circumstances: North Carolina is a highly competitive battleground state, and the latest polling suggests he’s effectively tied with Vice President Kamala Harris in the state. It’s hardly surprising that the Republican has concluded that he’ll say whatever he has to say, regardless of accuracy or propriety, to get ahead.

But there is a risk of a backlash. If you’re an on-the-fence North Carolinian, unsure which candidate to support, and **one candidate comes to your state to lie about the response to a deadly natural disaster,** would you be more or less likely to vote for that candidate?

Trump could’ve simply made an appearance and expressed his support. He instead decided to take a chance by peddling easily discredited nonsense.

[https://www.msn.com/en-us/news/politics/in-n-c-trump-takes-a-chance-pretending-his-fema-lies-are-true/ar-AA1sIgiB?ocid=msedgdhp&pc=HCTS&cvid=3f0c9d5d65f74e3fb239a7821a307468&ei=17](https://www.msn.com/en-us/news/politics/in-n-c-trump-takes-a-chance-pretending-his-fema-lies-are-true/ar-AA1sIgiB?ocid=msedgdhp&pc=HCTS&cvid=3f0c9d5d65f74e3fb239a7821a307468&ei=17)",439,368,LetterGrouchy6053,NorthCarolina,2024-10-22 14:24:11+00:00,0.75,/r/NorthCarolina/comments/1g9jdov/trump_is_doing_more_damage_than_the_storm/,False
1g9t05d,Trump on Rogan! ,https://www.politico.com/live-updates/2024/10/22/2024-elections-live-coverage-updates-analysis/trump-joe-rogan-podcast-00184894,,7,1,LeoLover77,Trumped,2024-10-22 21:01:59+00:00,1.0,/r/Trumped/comments/1g9t05d/trump_on_rogan/,False
1g9hi9n,Remember: Donald Trump shouldn’t even be eligible for the presidency after Jan. 6,https://www.msnbc.com/deadline-white-house/deadline-legal-blog/trump-shouldnt-be-eligible-presidency-jan-6-rcna175458,,9199,248,BobbyLucero,law,2024-10-22 12:58:35+00:00,0.91,/r/law/comments/1g9hi9n/remember_donald_trump_shouldnt_even_be_eligible/,False
1g9v1oi,Biden calls for Trump to be jailed,https://nypost.com/2024/10/22/us-news/biden-calls-for-trump-to-be-jailed-14-days-before-2024-election-we-gotta-lock-him-up/,,57,23,stoffel_bristov,Conservative,2024-10-22 22:30:49+00:00,0.82,/r/Conservative/comments/1g9v1oi/biden_calls_for_trump_to_be_jailed/,False
1g9mmtu,AI Trump working at McDonald's ,https://v.redd.it/v0rp4hr5d8wd1,,75,8,Disastrous_Tomato715,KamalaHarrisMemes,2024-10-22 16:40:15+00:00,0.95,/r/KamalaHarrisMemes/comments/1g9mmtu/ai_trump_working_at_mcdonalds/,False
1g9u0nc,Anons bf makes her vote for Trump ,https://www.reddit.com/gallery/1g9u0nc,Voting is completely anonymous and if you want to vote for one candidate but your family wants you to vote for a different candidate just lie to them and vote for who you want. The system is like that so your voice can be heard and you should take advantage of it,56,12,DClassPersonel,4tran,2024-10-22 21:45:38+00:00,1.0,/r/4tran/comments/1g9u0nc/anons_bf_makes_her_vote_for_trump/,False
1g9vfbc,Biden On Trump: ‘We Gotta Lock Him Up’,https://www.dailywire.com/news/biden-on-trump-we-gotta-lock-him-up,,127,50,f1sh98,Conservative,2024-10-22 22:49:01+00:00,0.83,/r/Conservative/comments/1g9vfbc/biden_on_trump_we_gotta_lock_him_up/,False
1g9ngr0,Make No Mistake: Trump Still Has A Russia Problem,https://nationalinterest.org/blog/paul-pillar/make-no-mistake-trump-still-has-russia-problem-213273,,339,12,WaterLittle2495,politics,2024-10-22 17:14:10+00:00,0.97,/r/politics/comments/1g9ngr0/make_no_mistake_trump_still_has_a_russia_problem/,False
1g87j6v,The Macdonald's that Trump visited posted a notice saying they were closed for Trump's staged visit.,https://i.redd.it/ekh6e59mvyvd1.jpeg,,53058,3510,Lifegoesonforever,pics,2024-10-20 19:58:38+00:00,0.81,/r/pics/comments/1g87j6v/the_macdonalds_that_trump_visited_posted_a_notice/,False
1g9oaof,How Matt Drudge turned on Trump  ,https://thehill.com/homenews/media/4941585-drudge-report-turns-anti-trump/,,56,26,2020Homebuyer,politics,2024-10-22 17:48:33+00:00,0.82,/r/politics/comments/1g9oaof/how_matt_drudge_turned_on_trump/,False
1g96xfb,Trump Political Cartoons,https://i.redd.it/t9lzplw6r7wd1.jpeg,I have been collecting Trump political cartoons for years. Show us your favorites !,167,11,grolaw,politicus,2024-10-22 01:49:51+00:00,0.99,/r/politicus/comments/1g96xfb/trump_political_cartoons/,False
1g9t1jg,Trump on Rogan!,https://www.politico.com/live-updates/2024/10/22/2024-elections-live-coverage-updates-analysis/trump-joe-rogan-podcast-00184894,,4,0,LeoLover77,The_Chocker,2024-10-22 21:03:37+00:00,0.76,/r/The_Chocker/comments/1g9t1jg/trump_on_rogan/,False
1g9tahg,Trump Was Enraged by Funeral Cost for ‘F–king Mexican’ U.S. Solider: Report,https://www.rollingstone.com/politics/politics-news/trump-raged-solider-funeral-hitler-generals-1235140426/,,2273,190,rollingstone,politics,2024-10-22 21:13:58+00:00,0.98,/r/politics/comments/1g9tahg/trump_was_enraged_by_funeral_cost_for_fking/,False
1g9sxx7,Trump: “I need generals like Hitler had”,https://www.theatlantic.com/politics/archive/2024/10/trump-military-generals-hitler/680327/,,62,22,politicalthrow99,thedavidpakmanshow,2024-10-22 20:59:35+00:00,0.95,/r/thedavidpakmanshow/comments/1g9sxx7/trump_i_need_generals_like_hitler_had/,False
1g9lcu5,McDonald's Donald Trump worked at failed last health inspection,https://www.newsweek.com/mcdonalds-donald-trump-worked-failed-last-health-inspection-1971998,,736,77,hooray4horus,politics,2024-10-22 15:47:37+00:00,0.91,/r/politics/comments/1g9lcu5/mcdonalds_donald_trump_worked_at_failed_last/,False
1g9jwli,Both Campaigns Release Ads Showcasing Trump’s Most Racist Comments,https://theonion.com/both-campaigns-release-ads-showcasing-trumps-most-racist-comments/,,929,4,dwaxe,TheOnion,2024-10-22 14:46:51+00:00,0.99,/r/TheOnion/comments/1g9jwli/both_campaigns_release_ads_showcasing_trumps_most/,False
1g9mux4,Trump overtakes Harris in our forecast,https://www.economist.com/in-brief/2024/10/21/trump-overtakes-harris-in-our-forecast,,74,472,awaythrowawaying,moderatepolitics,2024-10-22 16:49:34+00:00,0.63,/r/moderatepolitics/comments/1g9mux4/trump_overtakes_harris_in_our_forecast/,False
1g9j0rz,Trump surrogates,https://www.reddit.com/r/cnn/comments/1g9j0rz/trump_surrogates/,"Trump surrogates talking over your hosts makes your hosts look weak, and promotes an insurrectionist.
What is your position? 
Rueters and BBC are getting a lot of new patrons since CNN has gone MAGAtt.",9,8,pathf1nder00,cnn,2024-10-22 14:08:22+00:00,1.0,/r/cnn/comments/1g9j0rz/trump_surrogates/,False
1g93nat,Vernon Trump Store 🤡,https://i.redd.it/rwye51dmy6wd1.jpeg,,457,504,Transgrrrl69,Connecticut,2024-10-21 23:09:44+00:00,0.82,/r/Connecticut/comments/1g93nat/vernon_trump_store/,False
1g9shh3,Judge Deals Trump Massive Blow on Appalling Arlington Cemetery Fight,https://newrepublic.com/post/187410/judge-trump-arlington-national-cemetery-fight,,308,17,Maviopia,politics,2024-10-22 20:40:19+00:00,0.97,/r/politics/comments/1g9shh3/judge_deals_trump_massive_blow_on_appalling/,False
