id,title,url,selftext,score,num_comments,author,subreddit,created_utc,upvote_ratio,permalink,stickied
1g9u0h5,I am very confused on why they want her to freestyle ,https://www.reddit.com/r/Kamala/comments/1g9u0h5/i_am_very_confused_on_why_they_want_her_to/,"This is regarding  Donald going on Joe Rogen. I stated I wanted her to go one, as well. That she enjoys these kinds of interviews. People were saying it would be scripted. I stated she's applying for a job Even if she' s more relaxed, and in a discussion, she's still applying. If a Boss did whatever in a job interview, they'd be fired. If a candidate free styles you get Trump talking about a man's anatomy. I truly don't get this focus on her being ""free""",3,3,SpiritualMedicine7,Kamala,2024-10-22 21:45:26+00:00,0.8,/r/Kamala/comments/1g9u0h5/i_am_very_confused_on_why_they_want_her_to/,False
1g9swev,JP Morgan's Chief Executive  Privately Supports Kamala Harris. He Just Won’t Say So.,https://www.nytimes.com/2024/10/22/business/jamie-dimon-jpmorgan-harris-trump.html?algo=combo_clicks_decay_6_lda_unique_80_diversified&block=3&campaign_id=142&emc=edit_fory_20241022&fellback=false&imp_id=8904689472370226&instance_id=137526&nl=for-you&nlid=53831380&pool=channel-replacement-ls&rank=6&regi_id=53831380&req_id=8836564546738115&segment_id=181097&surface=for-you-email-channelless&user_id=fe5d662adf685ae9dedd7464c832fcdf&variant=0_channel_translated_pool_popularity_pers,,8,1,Free_Swimming,Kamala,2024-10-22 20:57:47+00:00,1.0,/r/Kamala/comments/1g9swev/jp_morgans_chief_executive_privately_supports/,False
1g9rro5,Kamala Harris narrowly leads Donald Trump in Times poll,https://www.thetimes.com/world/us-world/article/harris-trump-poll-today-latest-us-election-f2gs226xl,,2,1,TimesandSundayTimes,Kamala,2024-10-22 20:10:10+00:00,0.75,/r/Kamala/comments/1g9rro5/kamala_harris_narrowly_leads_donald_trump_in/,False
1g9qyhv,Julia Louis-Dreyfus Offers Hilariously NSFW Call To Voters To Reject Trump In Epic Viral Video,https://www.comicsands.com/louis-drefus-nsfw-trump-video-2669457748.html,,31,3,Blue_Wave2024,Kamala,2024-10-22 19:37:18+00:00,0.93,/r/Kamala/comments/1g9qyhv/julia_louisdreyfus_offers_hilariously_nsfw_call/,False
1g9q0hs,Cat reacts to Trump-Harris debate ,https://v.redd.it/30c3zovxdcwd1,,6,2,Human-Bluebird-1385,Kamala,2024-10-22 18:58:50+00:00,1.0,/r/Kamala/comments/1g9q0hs/cat_reacts_to_trumpharris_debate/,False
1g9pyhg,MAGA = Losers,https://i.redd.it/1su3w08becwd1.jpeg,,131,3,SoCalLynda,Kamala,2024-10-22 18:56:29+00:00,1.0,/r/Kamala/comments/1g9pyhg/maga_losers/,False
1g9mwyr,Rachel Maddow calls the bluff of Trump supporters who claim to be making a 'business decision',https://youtu.be/Ce3NynoFYSQ?si=jXHu4TtcJVx8IzsQ,"Rachel Maddow looks at some of the reasons why a Trump supporter might claim to look past his many shortcomings because they consider their vote a business decision, and why those business decision reasons actually favor supporting Kamala Harris. This is an excerpted portion of the October 14, 2024 A block. ",11,1,JimCripe,Kamala,2024-10-22 16:51:52+00:00,1.0,/r/Kamala/comments/1g9mwyr/rachel_maddow_calls_the_bluff_of_trump_supporters/,False
1g9mrmw,VoteVets - Son of WW2 'Master of the Air' Speaks Out: VOTE AGAINST TRUMP!,https://youtu.be/Zr_tKAQ20Dg?si=Aeb2WlRkejaSKk4d,"NEW: Jeff Crosby shares the legacy of his father, Harry ""Croz"" Crosby, a WWII hero and ""Master of the Air.""

His message is clear: Trump embodies everything his father fought against. ""He’d crawl out of his grave and into a B-17"" to stop Trump. 

Now, it’s our turn to fight back—by voting for Kamala Harris and protect everything so many served to defend.",3,1,JimCripe,Kamala,2024-10-22 16:45:46+00:00,0.81,/r/Kamala/comments/1g9mrmw/votevets_son_of_ww2_master_of_the_air_speaks_out/,False
1g9lkre,Mail in ballots for the win,https://i.redd.it/87syf7zku4wd1.jpeg,,55,13,SailInternational251,Kamala,2024-10-22 15:56:51+00:00,0.99,/r/Kamala/comments/1g9lkre/mail_in_ballots_for_the_win/,False
1g9jwju,My vote is in! We have to push this! ,https://www.reddit.com/r/Kamala/comments/1g9jwju/my_vote_is_in_we_have_to_push_this/,https://sleepingincollection.etsy.com/listing/1799589242,29,2,josephmichaelpresley,Kamala,2024-10-22 14:46:48+00:00,1.0,/r/Kamala/comments/1g9jwju/my_vote_is_in_we_have_to_push_this/,False
1g9h0hs,"‘They Are Making Fun of Us’: AOC Roasts Trump, Musk After McDonald’s Stunt",https://open.substack.com/pub/washingtoncurrent/p/they-are-making-fun-of-us-aoc-roasts?r=mq6wy&utm_campaign=post&utm_medium=web,,98,4,DCGirl20874,Kamala,2024-10-22 12:33:07+00:00,1.0,/r/Kamala/comments/1g9h0hs/they_are_making_fun_of_us_aoc_roasts_trump_musk/,False
1g9gp85,Devastating! Cheney and Right Wing Radio Host Crush Trump at Harris Event | Bulwark Take,https://youtu.be/doALYckswco?si=XcC86rfs__HDMbie,"Tim Miller recaps highlights from Charlie Sykes' interview with Kamala Harris and Liz Cheney in Waukesha, Wisconsin on the stakes of the election and the risks of a Trump/Vance presidency.",4,1,JimCripe,Kamala,2024-10-22 12:16:34+00:00,0.84,/r/Kamala/comments/1g9gp85/devastating_cheney_and_right_wing_radio_host/,False
1g9gm3h,He/Him,https://youtu.be/bnUBF29tFv0?si=Ax0F_jfvfsFafOW2,Trump is for he/him. Kamala is for us.,5,1,JimCripe,Kamala,2024-10-22 12:12:04+00:00,0.86,/r/Kamala/comments/1g9gm3h/hehim/,False
1g9fstn,Do you think this guy on the left is re-evaluating his life choices?,https://i.redd.it/zfqz0fjnjyud1.gif,,42,3,CarNo8607,Kamala,2024-10-22 11:27:08+00:00,0.96,/r/Kamala/comments/1g9fstn/do_you_think_this_guy_on_the_left_is_reevaluating/,False
1g98d7o,Harris: I love Gen Z…they’re wonderfully impatient,https://v.redd.it/x1hai1q7t7wd1,,17,1,takemusu,Kamala,2024-10-22 03:03:51+00:00,0.96,/r/Kamala/comments/1g98d7o/harris_i_love_gen_ztheyre_wonderfully_impatient/,False
1g93b2a,"Liz Cheney campaigns with Harris in Pennsylvania, painting Trump as a dangerous choice",https://www.pbs.org/newshour/amp/politics/liz-cheney-campaigns-with-harris-in-pennsylvania-painting-trump-as-a-dangerous-choice,,42,2,takemusu,Kamala,2024-10-21 22:54:13+00:00,0.95,/r/Kamala/comments/1g93b2a/liz_cheney_campaigns_with_harris_in_pennsylvania/,False
1g9342d,Stunning Kamala Harris for President Mural in Germantown,https://i.redd.it/nap32jet15wd1.jpeg,,173,4,takemusu,Kamala,2024-10-21 22:45:01+00:00,1.0,/r/Kamala/comments/1g9342d/stunning_kamala_harris_for_president_mural_in/,False
1g92w1v,Kamala caused some deep trauma to Fox News during her interview with Baier and now they're carrying her commentary uninterrupted. Here she is calling Trump a Fascist. 🤣,https://v.redd.it/54jc3d3ln6wd1,,61,1,takemusu,Kamala,2024-10-21 22:34:40+00:00,1.0,/r/Kamala/comments/1g92w1v/kamala_caused_some_deep_trauma_to_fox_news_during/,False
1g8z2cm,Kamala Mural in Detroit,https://i.redd.it/5ws70umyp5wd1.jpeg,,62,1,Ok-Strawberry-9474,Kamala,2024-10-21 19:55:02+00:00,1.0,/r/Kamala/comments/1g8z2cm/kamala_mural_in_detroit/,False
1g8se7j,"Harris raises more than $220 million in September, outraising Trump 3-to-1",https://thehill.com/homenews/campaign/4944454-harris-raises-more-than-220-million-in-september-outraising-trump-3-to-1/,,41,2,takemusu,Kamala,2024-10-21 15:26:53+00:00,0.99,/r/Kamala/comments/1g8se7j/harris_raises_more_than_220_million_in_september/,False
1g8rcps,DON'T TAKE THINGS FROM STRANGE CLOWNS,https://i.redd.it/5n09o8g5g4wd1.jpeg,,7,1,SoCalLynda,Kamala,2024-10-21 14:43:18+00:00,0.82,/r/Kamala/comments/1g8rcps/dont_take_things_from_strange_clowns/,False
1g8qcb0,"Harris raises more than $220 million in September, outraising Trump 3-to-1",https://thehill.com/homenews/campaign/4944454-harris-raises-more-than-220-million-in-september-outraising-trump-3-to-1/,,140,14,Plus-Bluejay-2024,Kamala,2024-10-21 13:58:43+00:00,0.98,/r/Kamala/comments/1g8qcb0/harris_raises_more_than_220_million_in_september/,False
1g8q57l,Postcards ,https://i.redd.it/yntvb5bp64wd1.jpeg,I am so anxious and so scared of the outcome of this election. I tried to redirect my anxiety by filling out and sending postcards to swing States encouraging them to vote for Kamala/Walz.  I sincerely hope this nightmare ends soon. Is anyone else having severe election anxiety and how are they coping?,11,2,RandyNoTandy,Kamala,2024-10-21 13:49:44+00:00,0.92,/r/Kamala/comments/1g8q57l/postcards/,False
1g8pzou,Nuts,https://v.redd.it/ikuntqqalyvd1,,10,2,CarNo8607,Kamala,2024-10-21 13:42:38+00:00,0.91,/r/Kamala/comments/1g8pzou/nuts/,False
1g8p7j9,I have gained so much more confidence thanks to this election ,https://www.reddit.com/r/Kamala/comments/1g8p7j9/i_have_gained_so_much_more_confidence_thanks_to/,"And thanks to the confidence Kamala has in herself. It's catching! I am much more vocal about my beliefs. I fact-check everything people are saying on Instagram, and I tell them when they are wrong. I am realizing the MAGA people are very loud, and angry people that aren't worth talking to. I am more firm in my decision to be in criminal justice I am not used to having this glow inside of me. This is after Kamala's birthday but near enough to share this as a thank you to her",48,8,SpiritualMedicine7,Kamala,2024-10-21 13:05:15+00:00,0.95,/r/Kamala/comments/1g8p7j9/i_have_gained_so_much_more_confidence_thanks_to/,False
1g8nwn9,What happened today,https://i.redd.it/qndtzk7121wd1.jpeg,,75,7,CarNo8607,Kamala,2024-10-21 11:58:20+00:00,0.99,/r/Kamala/comments/1g8nwn9/what_happened_today/,False
1g8no3r,Have not seen this covered in the media for some reason,https://i.redd.it/cg6kn7at72wd1.png,,27,1,CarNo8607,Kamala,2024-10-21 11:45:04+00:00,1.0,/r/Kamala/comments/1g8no3r/have_not_seen_this_covered_in_the_media_for_some/,False
1g8iq7z,"Swifties’ Election Ground Game: Phone-Banking, Fundraising and Lots of Bracelets",https://www.wsj.com/politics/elections/taylor-swift-kamala-trump-election-campaign-8df8f232?st=dwEKSB&reflink=mobilewebshare_permalink,,14,1,takemusu,Kamala,2024-10-21 05:48:19+00:00,0.9,/r/Kamala/comments/1g8iq7z/swifties_election_ground_game_phonebanking/,False
1g8i4pc,What impact will Taylor Swift really have on the US election?,https://www.bbc.co.uk/news/articles/cy4d3y0kl4eo,,7,1,takemusu,Kamala,2024-10-21 05:06:21+00:00,0.88,/r/Kamala/comments/1g8i4pc/what_impact_will_taylor_swift_really_have_on_the/,False
1g8fsa6,Voting for Trump in 2024 would be like doing this in 1936...,https://i.redd.it/kwmuhej0w0wd1.jpeg,,55,5,KmartRadio,Kamala,2024-10-21 02:44:26+00:00,0.97,/r/Kamala/comments/1g8fsa6/voting_for_trump_in_2024_would_be_like_doing_this/,False
1g8fpoz,Man who questioned Trump on pet-eating lies during Univision town hall admits he is now voting for Harris,https://www.the-independent.com/news/world/americas/us-politics/trump-town-hall-pet-eating-harris-vote-b2631966.html,,54,1,takemusu,Kamala,2024-10-21 02:40:19+00:00,0.98,/r/Kamala/comments/1g8fpoz/man_who_questioned_trump_on_peteating_lies_during/,False
1g8fk22,Michelle Obama to hammer home Get Out the Vote message for Harris in final stretch,https://www.msnbc.com/weekends-with-alex-witt/watch/michelle-obama-to-hammer-home-get-out-the-vote-message-for-harris-in-final-stretch-222224453677,,20,1,takemusu,Kamala,2024-10-21 02:31:25+00:00,0.87,/r/Kamala/comments/1g8fk22/michelle_obama_to_hammer_home_get_out_the_vote/,False
1g8bybu,"Is this Trump's ""Tank"" Moment?",https://www.reddit.com/gallery/1g8by03,,2,1,FederationReborn,Kamala,2024-10-20 23:19:58+00:00,1.0,/r/Kamala/comments/1g8bybu/is_this_trumps_tank_moment/,False
1g8akla,Kamala Realistic Landslide Scenario ,https://youtu.be/0wKSNJi94WI?si=KA2Ss81Kiz3_rtvb,,3,1,Fluffy-Operation1992,Kamala,2024-10-20 22:13:04+00:00,0.71,/r/Kamala/comments/1g8akla/kamala_realistic_landslide_scenario/,False
1g8ahoi,😁😁,https://i.redd.it/yb4eoh1yizvd1.jpeg,,182,5,BookRat10001,Kamala,2024-10-20 22:09:23+00:00,0.98,/r/Kamala/comments/1g8ahoi/_/,False
1g84z9n,"Why so many polls, that don't align with fundraising, voter registration or early voting? 'Trump is losing'.",https://youtu.be/k1VThfAs1ww,,13,2,nedjer24,Kamala,2024-10-20 18:09:21+00:00,0.85,/r/Kamala/comments/1g84z9n/why_so_many_polls_that_dont_align_with/,False
1g82vqf,"Kamala Harris at UAW in Lansing, MI",https://x.com/KamalaHQ/status/1847400024352731216,,1,1,takemusu,Kamala,2024-10-20 16:38:43+00:00,0.66,/r/Kamala/comments/1g82vqf/kamala_harris_at_uaw_in_lansing_mi/,False
1g82uz9,"Biden-Harris have Saved over 61,000 Pensions in Michigan",https://www.tiktok.com/@sidneyraz/video/7423003992457743659,,12,1,takemusu,Kamala,2024-10-20 16:37:48+00:00,0.88,/r/Kamala/comments/1g82uz9/bidenharris_have_saved_over_61000_pensions_in/,False
1g82ulj,"When We Fight, We Win!",https://i.redd.it/7cepe4ghvxvd1.gif,,28,2,SoCalLynda,Kamala,2024-10-20 16:37:20+00:00,0.9,/r/Kamala/comments/1g82ulj/when_we_fight_we_win/,False
1g82tw7,Kamala Harris endorses PRO Act,https://i.redd.it/myvi2rn8bqvd1.png,,30,1,takemusu,Kamala,2024-10-20 16:36:30+00:00,0.97,/r/Kamala/comments/1g82tw7/kamala_harris_endorses_pro_act/,False
1g82mqg,Happy Birthday to the Next President of the U.S.A.!,https://i.redd.it/u521okwutxvd1.jpeg,,75,4,SoCalLynda,Kamala,2024-10-20 16:27:54+00:00,0.95,/r/Kamala/comments/1g82mqg/happy_birthday_to_the_next_president_of_the_usa/,False
1g822jv,That’s a good question 🇺🇸,https://v.redd.it/hgzettrzmxvd1,,14,1,Parking_Train8423,Kamala,2024-10-20 16:03:50+00:00,0.9,/r/Kamala/comments/1g822jv/thats_a_good_question/,False
1g7x2oq,Kamala HQ strikes again,https://i.redd.it/38iusonnvtvd1.png,,7,1,CarNo8607,Kamala,2024-10-20 11:59:55+00:00,0.77,/r/Kamala/comments/1g7x2oq/kamala_hq_strikes_again/,False
1g7wzxx,his brain is absolute mush,https://i.redd.it/t4xg930wvtvd1.png,,39,3,CarNo8607,Kamala,2024-10-20 11:55:51+00:00,0.9,/r/Kamala/comments/1g7wzxx/his_brain_is_absolute_mush/,False
1g7vp5i,Nevada! Nevada! Vote! Vote! VOTE!,https://i.redd.it/8f4aik0u1wvd1.jpeg,,19,1,Plus-Bluejay-2024,Kamala,2024-10-20 10:28:07+00:00,0.8,/r/Kamala/comments/1g7vp5i/nevada_nevada_vote_vote_vote/,False
1g7r4sw,Checkmate Senator Babet! ,https://i.redd.it/dgq7o3cpvrvd1.jpeg,,23,1,takemusu,Kamala,2024-10-20 04:48:36+00:00,0.99,/r/Kamala/comments/1g7r4sw/checkmate_senator_babet/,False
1g7r1el,All gas! No brakes! 💙,https://i.redd.it/0glrzo7xrpvd1.png,,69,2,takemusu,Kamala,2024-10-20 04:42:12+00:00,0.96,/r/Kamala/comments/1g7r1el/all_gas_no_brakes/,False
1g7qt3t,Sending a message to the guy who insulted the place last week,https://i.redd.it/p43fype7nrvd1.png,,44,2,takemusu,Kamala,2024-10-20 04:26:56+00:00,0.94,/r/Kamala/comments/1g7qt3t/sending_a_message_to_the_guy_who_insulted_the/,False
1g7qc69,"Wow. He's gonna lose whatever's left of his mind, after his nap",https://i.redd.it/crh0wjz2qsvd1.jpeg,,250,18,takemusu,Kamala,2024-10-20 03:57:11+00:00,1.0,/r/Kamala/comments/1g7qc69/wow_hes_gonna_lose_whatevers_left_of_his_mind/,False
1g7px8z,Statement from Vice President Kamala Harris | The White House,https://www.whitehouse.gov/briefing-room/statements-releases/2024/10/19/statement-from-vice-president-kamala-harris-2/,,8,3,Strict-Marsupial6141,Kamala,2024-10-20 03:31:19+00:00,0.9,/r/Kamala/comments/1g7px8z/statement_from_vice_president_kamala_harris_the/,False
1g7oy6j,Arnold Palmer,https://www.reddit.com/r/Kamala/comments/1g7oy6j/arnold_palmer/,"Trump is obsessed with the size of Arnold Palmer’s penis.  He spoke at length about it ( going on for 12 minutes) at his rally tonight.  So here’s the plan.  Let’s get at least 4 Dems to attend each rally and get them some red hats and signs that say “ARNOLD PALMER-  JUST HOW BIG WAS IT? “.   Trump will spot the sign and he will immediately want to entertain the crowd with more information on how impressed he was with the talented golfer’s member.  We want more and more and more of this… also follow up with requests for him to tell us all about his love for Kim
Jong Un.   And plead with him to share just how brilliant Putin is.  ",23,2,SylviaX6,Kamala,2024-10-20 02:32:16+00:00,0.95,/r/Kamala/comments/1g7oy6j/arnold_palmer/,False
1g7ocvo,The increasingly bizarre — and ominous — home stretch of Trump’s 2024 campaign,https://www.reddit.com/r/Kamala/comments/1g7ocvo/the_increasingly_bizarre_and_ominous_home_stretch/,https://www.vox.com/politics/378299/trump-military-threat-dancing-town-hall,17,2,StratHistory,Kamala,2024-10-20 01:58:40+00:00,0.9,/r/Kamala/comments/1g7ocvo/the_increasingly_bizarre_and_ominous_home_stretch/,False
1g7nti0,EVERYONE NEEDS THIS PEP TALK!,https://v.redd.it/xjjf0wimtrvd1,,26,1,takemusu,Kamala,2024-10-20 01:27:45+00:00,0.95,/r/Kamala/comments/1g7nti0/everyone_needs_this_pep_talk/,False
1g7n5lf,I voted my mail in ballot,https://www.reddit.com/r/Kamala/comments/1g7n5lf/i_voted_my_mail_in_ballot/,"I filled out my mail
In ballot for Harris/Walz and straight Dem down the line. There was an insert included which stated that county clerk recommends that mail in voters either drop the ballot in one of the official ballot collection boxes or take it to the Board of Elections or to County Clerks office ( bit of a rural county here).  I was surprised to see this…  but you bet I will be handing over my ballot personally to a human in the Board of Elections.  I might record it too - not taking any chances 🤨",7,1,SylviaX6,Kamala,2024-10-20 00:50:38+00:00,0.99,/r/Kamala/comments/1g7n5lf/i_voted_my_mail_in_ballot/,False
1g7mzg9,"The true Donald Trump character, this breaks it down perfectly",https://i.redd.it/fhhnrpmlmfvd1.jpeg,,1,0,itsuhWrap,Kamala,2024-10-20 00:41:29+00:00,0.66,/r/Kamala/comments/1g7mzg9/the_true_donald_trump_character_this_breaks_it/,False
1g7mu73,Voted,https://i.redd.it/eusopiiq3tvd1.jpeg,,125,13,birdbrain59,Kamala,2024-10-20 00:33:31+00:00,0.98,/r/Kamala/comments/1g7mu73/voted/,False
1g7m6zr,NOT GOING BACK - William Galison,https://youtu.be/X3vEFk5teUk?si=8Xgl7U_oeJ2bF22F,This video is dedicated to the victory of Kamala Harris and Tim Walz in the most consequential election in American history. ,6,1,JimCripe,Kamala,2024-10-19 23:59:11+00:00,0.87,/r/Kamala/comments/1g7m6zr/not_going_back_william_galison/,False
1g7l1vs,how to get tickets to rally,https://www.reddit.com/r/Kamala/comments/1g7l1vs/how_to_get_tickets_to_rally/,"hey i am looking for tickets to the atlanta rally with obama happening in on october 24, i can't seem to find the tickets anywhere, i understand some of them are invite only. Let me know if you guys know anything more! ",7,1,LettuceLamps,Kamala,2024-10-19 23:02:30+00:00,0.99,/r/Kamala/comments/1g7l1vs/how_to_get_tickets_to_rally/,False
1g7j6d7,"In a Bellwether Pennsylvania County, a Modest Loss Could Be a Win for Harris",https://www.nytimes.com/2024/10/19/us/politics/harris-campaign-western-pennsylvania.html?algo=editorial_importance_fy_email_news&block=4&campaign_id=142&emc=edit_fory_20241019&fellback=false&imp_id=2377820120261923&instance_id=137321&nl=for-you&nlid=53831380&pool=fye-top-news-ls&rank=1&regi_id=53831380&req_id=5872249522018124&segment_id=180889&surface=for-you-email-news&user_id=fe5d662adf685ae9dedd7464c832fcdf&variant=0_edimp_fye_news_dedupe,,10,2,Free_Swimming,Kamala,2024-10-19 21:29:15+00:00,0.85,/r/Kamala/comments/1g7j6d7/in_a_bellwether_pennsylvania_county_a_modest_loss/,False
1g7io92,Go Blue,https://i.redd.it/fziu7pjf2svd1.jpeg,,88,4,bigjhawaii,Kamala,2024-10-19 21:04:22+00:00,0.98,/r/Kamala/comments/1g7io92/go_blue/,False
1g7i7p8,"Ad Proof of Concept: ""Sunshine""",https://www.reddit.com/r/Kamala/comments/1g7i7p8/ad_proof_of_concept_sunshine/,"[Youtube: ""Sunshine""](https://youtu.be/C2zs4O3jyjw)

https://preview.redd.it/p9nom35nyrvd1.png?width=537&format=png&auto=webp&s=66466aa3dc9e4cedf9a4f3825a6f5133753db4c0

",1,1,MaterialDiligent4597,Kamala,2024-10-19 20:42:41+00:00,0.66,/r/Kamala/comments/1g7i7p8/ad_proof_of_concept_sunshine/,False
1g7fb48,Scared,https://www.reddit.com/r/Kamala/comments/1g7fb48/scared/,"Is anyone else out there scared? According to the polls it’s very close. I’m obviously going to vote but I’m
Still very scared. 16 days to go…I’m not sure how to stay calm at this point. 

Signed 
A twentysomething disabled female (registered D) from a blue state ",48,45,catfarmer1998,Kamala,2024-10-19 18:27:55+00:00,0.88,/r/Kamala/comments/1g7fb48/scared/,False
1g7dr69,One in the books for Arizona & Kamala Harris,https://i.redd.it/qnczhxxwxqvd1.jpeg,,109,6,h20poIo,Kamala,2024-10-19 17:17:15+00:00,0.99,/r/Kamala/comments/1g7dr69/one_in_the_books_for_arizona_kamala_harris/,False
1g7d4dh,"The Sick, Twisted, and Dangerous Lies of the Twice-Impeached and Five-Time-Indicted Convicted Felon and Traitor to the Constitution, Donald Trump",https://i.redd.it/kz2vtkn7qqvd1.jpeg,,15,3,SoCalLynda,Kamala,2024-10-19 16:48:38+00:00,0.9,/r/Kamala/comments/1g7d4dh/the_sick_twisted_and_dangerous_lies_of_the/,False
1g7ci65,America vs. Evil,https://www.reddit.com/gallery/1g7cgyw,,44,8,SoCalLynda,Kamala,2024-10-19 16:20:08+00:00,0.96,/r/Kamala/comments/1g7ci65/america_vs_evil/,False
1g7afjo,Razor Thin,https://youtu.be/X2OKkBl6xmk?si=oZ1ZZMMo1w1_l3mi,,9,1,JimCripe,Kamala,2024-10-19 14:44:42+00:00,0.81,/r/Kamala/comments/1g7afjo/razor_thin/,False
1g78ip9,FACT SHEET: The U.S.-Germany Partnership,https://www.whitehouse.gov/briefing-room/statements-releases/2024/10/17/fact-sheet-the-u-s-germany-partnership/,,2,1,Strict-Marsupial6141,Kamala,2024-10-19 13:06:32+00:00,1.0,/r/Kamala/comments/1g78ip9/fact_sheet_the_usgermany_partnership/,False
1g78hv2,"A Proclamation on National Forest Products Week, 2024",https://www.whitehouse.gov/briefing-room/presidential-actions/2024/10/18/a-proclamation-on-national-forest-products-week-2024/,,2,1,Strict-Marsupial6141,Kamala,2024-10-19 13:05:16+00:00,1.0,/r/Kamala/comments/1g78hv2/a_proclamation_on_national_forest_products_week/,False
1g78hjy,"A Proclamation on Minority Enterprise Development Week, 2024 | The White House",https://www.whitehouse.gov/briefing-room/presidential-actions/2024/10/18/a-proclamation-on-minority-enterprise-development-week-2024/,,3,2,Strict-Marsupial6141,Kamala,2024-10-19 13:04:46+00:00,1.0,/r/Kamala/comments/1g78hjy/a_proclamation_on_minority_enterprise_development/,False
1g77bw4,What do u think will happen if trump wins the election,https://www.reddit.com/r/Kamala/comments/1g77bw4/what_do_u_think_will_happen_if_trump_wins_the/,"Kamala 2024!💙💙

[View Poll](https://www.reddit.com/poll/1g77bw4)",0,11,StrangeBad7429,Kamala,2024-10-19 12:01:02+00:00,0.42,/r/Kamala/comments/1g77bw4/what_do_u_think_will_happen_if_trump_wins_the/,False
1g7784z,When your attempt to call the current president stupid fails.,https://v.redd.it/i0siv25v6ivd1,,38,3,CarNo8607,Kamala,2024-10-19 11:54:28+00:00,0.97,/r/Kamala/comments/1g7784z/when_your_attempt_to_call_the_current_president/,False
1g6z1gj,This is the absolute truth! Vance won't wait a moment to coup Hair Fuhrer!,https://i.redd.it/cl8gkvp7dlvd1.jpeg,,51,3,FederationReborn,Kamala,2024-10-19 02:25:12+00:00,0.99,/r/Kamala/comments/1g6z1gj/this_is_the_absolute_truth_vance_wont_wait_a/,False
1g6yc88,Immigrants are significantly less likely to commit crimes than the U.S.-born,https://news.northwestern.edu/stories/2024/03/immigrants-are-significantly-less-likely-to-commit-crimes-than-the-us-born/,,34,2,nedjer24,Kamala,2024-10-19 01:45:54+00:00,0.94,/r/Kamala/comments/1g6yc88/immigrants_are_significantly_less_likely_to/,False
1g6xmxf,If Kamala is WINNING by record amounts  before early voting ends GOP can’t control the narrative,https://thehill.com/homenews/campaign/4939892-early-voting-advantage-harris-campaign/,,59,4,callows5120,Kamala,2024-10-19 01:07:49+00:00,0.95,/r/Kamala/comments/1g6xmxf/if_kamala_is_winning_by_record_amounts_before/,False
1g6wx6f,TOGETHER for AMERICA,https://i.redd.it/ud9gootaylvd1.jpeg,Volunteer to help get out the vote: www.KamalaHarris.com ,49,3,SoCalLynda,Kamala,2024-10-19 00:30:31+00:00,0.95,/r/Kamala/comments/1g6wx6f/together_for_america/,False
1g6ubmu,Jimmy Carter Casts His Ballot for Harris in Georgia,https://www.nytimes.com/2024/10/16/us/jimmy-carter-votes-georgia.html,🇺🇲💙,157,6,roxanne_ROXANNE999,Kamala,2024-10-18 22:21:10+00:00,0.98,/r/Kamala/comments/1g6ubmu/jimmy_carter_casts_his_ballot_for_harris_in/,False
1g6pxa5,Unsealed Jan 6th Document Trove,https://www.courtlistener.com/docket/67656604/united-states-v-trump/?order_by=desc#entry-266,,5,1,Bleedingeck,Kamala,2024-10-18 19:02:23+00:00,0.85,/r/Kamala/comments/1g6pxa5/unsealed_jan_6th_document_trove/,False
1g6pl6t,"We do not have autocracy in the U.S., except in one major respect: the ability to end all life on Earth by starting a nuclear war.",https://i.redd.it/camsp76joevd1.jpeg,,5,2,SoCalLynda,Kamala,2024-10-18 18:48:01+00:00,0.73,/r/Kamala/comments/1g6pl6t/we_do_not_have_autocracy_in_the_us_except_in_one/,False
1g6o8pi,Harris Campaign Trolls Trump With Side-By-Side Graphic Comparing Her And Trump's Fox Ratings—And Uh-oh,https://www.comicsands.com/harris-trump-fox-news-ratings-2669439922.html,,42,1,Blue_Wave2024,Kamala,2024-10-18 17:50:18+00:00,0.99,/r/Kamala/comments/1g6o8pi/harris_campaign_trolls_trump_with_sidebyside/,False
1g6ntkb,Are The Polls Missing The “Blue Wave”?,https://v.redd.it/qqlbvx9nvjvd1,We feel that key demographics are being under-polled. ,22,22,The_VocalMinority,Kamala,2024-10-18 17:32:08+00:00,0.96,/r/Kamala/comments/1g6ntkb/are_the_polls_missing_the_blue_wave/,False
1g6nq8g,Visualize the Future - Manifest the World You Want -  VOTE,https://i.redd.it/547cfxwlrjvd1.jpeg,,13,1,Parking_Train8423,Kamala,2024-10-18 17:28:22+00:00,0.88,/r/Kamala/comments/1g6nq8g/visualize_the_future_manifest_the_world_you_want/,False
1g6nno1,Trump is Exhausted!,https://i.redd.it/25psigpeujvd1.png,,90,33,shipsywor,Kamala,2024-10-18 17:25:19+00:00,0.96,/r/Kamala/comments/1g6nno1/trump_is_exhausted/,False
