id,title,url,selftext,score,num_comments,author,subreddit,created_utc,upvote_ratio,permalink,stickied
1fcnctf,Veterans don't stand a chance.,https://www.reddit.com/r/Kamala/comments/1fcnctf/veterans_dont_stand_a_chance/,"

# Trump's MAGA Manifesto, Project 2025. demands that veterans' benefits be cut by limiting after-care for service-related injury. No matter the cause, no matter the ramifications of that injury, care will be provided only for the initial cause, and any follow up damage will be the injured serviceman's responsibility.

Beyond that, Col. Rep Lauren Boebert failed to support expanded benefits for those who were exposed to toxins during the course of their service.

Remember 'Tommy' by Rudyard Kipling?

'For its Tommy this an;

Tommy that, and chuck him

out, the brute, but its

'Savior of the country'

when the guns begin to shoot.""

Different era, but same unappreciative sentiment.

See this -- boldface mine.

(The Hill) — Rep. Lauren Boebert (R-Colo.) **defended her vote against bipartisan legislation that** expanded health benefits for veterans, saying Tuesday she didn’t want to spend “$600 billion forever.”

Boebert faced off in a general election debate against her Democratic opponent, Trisha Calvarese. The Democrat pressed Boebert to explain why she didn’t support the landmark “Sergeant First Class Heath Robinson Honoring Our PACT Act,” **which expanded benefits for millions of veterans** who were exposed to toxins during service and are suffering illnesses as a result. “If you’re going to take care of folks, what about our veterans, Lauren? You know, because you’re talking about lots of cuts and how to pay for things. I think if you’re going to be America first, **you can’t put veterans last,”** Calvarese said to Boebert during the lunchtime debate in Colorado’s 4th Congressional District.

“I do just want to point to your vote that — **you voted against care for veterans exposed to cancer-causing toxins and burn pits** during war,” Calvarese added.

Boebert responded, saying, “When it comes to our veterans. I have absolutely put them first. In my first year, we were in the minority, and unfortunately not all the legislation was great.”

**The Republican said she voted agains**t some massive omnibus bills that might have supported veterans, because “I’m not voting for something that we have 22 hours to read that’s over 2,000 pages long.”

The House and Senate each passed the PACT Act in July 2022, and **Biden signed it into law** a short time later. All Democrats and a majority of Republicans in both chambers voted for the legislation. **Boebert was one of 88 House Republicans who voted against it.**

The legislation expands eligibility for Department of Veterans Affairs health care to veterans who served in the post-9/11 era and creates a framework for **establishing presumptions of service connections related to toxic exposures.** The bill also expands presumptions for 23 burn pit-related illnesses.

When Boebert then mentioned other work she’s done to help veterans, Calvarese said, “The folks in this room are not — they’re not foolish.” **Boebert cut in, saying, “I’m not spending $600 billion** forever because we couldn’t get a couple pieces of language right in legislation. Just because a bill is on the floor does not make it the only option. “I fought so we could have amendments on the House floor. When that bill first came up, I was in the minority, and amendments were closed on the House floor. I could not give a Colorado voice to the men and women who have served in our military on that legislation.”

Before the PACT Act was signed, some Republicans objected to its $400 billion mandatory spending, which would not have been subject to annual appropriations review. After facing tremendous public pressure — including from high-profile allies such as comedian Jon Stewart, who joined veterans camped out on the U.S. Capitol steps — the Senate agreed to three cost-controlling amendments on the bill, which led a number of Republicans to back it. **Eleven Republican senators still voted against it.**

The Hill has contacted the Boebert campaign for comment.

[https://www.msn.com/en-us/health/other/boebert-defends-vote-against-veterans-health-benefits-saying-she-didn-t-want-to-spend-600-billion-forever/ar-AA1q4OZ6?ocid=msedgdhp&pc=HCTS&cvid=807aa48555b64c1d9b223702503d8864&ei=149](https://www.msn.com/en-us/health/other/boebert-defends-vote-against-veterans-health-benefits-saying-she-didn-t-want-to-spend-600-billion-forever/ar-AA1q4OZ6?ocid=msedgdhp&pc=HCTS&cvid=807aa48555b64c1d9b223702503d8864&ei=149)",29,4,LetterGrouchy6053,Kamala,2024-09-09 11:42:47+00:00,0.89,/r/Kamala/comments/1fcnctf/veterans_dont_stand_a_chance/,False
1fchid8,The republicans wrote a 900+ page manifesto on how to perform a coup... this is fine.,https://i.redd.it/jglz30h8blnd1.jpeg,,86,8,Redbud-3,Kamala,2024-09-09 04:49:57+00:00,0.99,/r/Kamala/comments/1fchid8/the_republicans_wrote_a_900_page_manifesto_on_how/,False
1fc3a43,If you want to understand how Republicans captured the low IQ voter...,https://www.reddit.com/r/Kamala/comments/1fc3a43/if_you_want_to_understand_how_republicans/,https://youtu.be/hgasE5JTz8I?si=PROceefdmmMnlWln,16,3,OCblondie714,Kamala,2024-09-08 17:31:07+00:00,0.77,/r/Kamala/comments/1fc3a43/if_you_want_to_understand_how_republicans/,False
1fc38z8,Made my new FB cover.,https://i.redd.it/qgja9zvnemnd1.jpeg,,15,1,Low_Journalist_2878,Kamala,2024-09-08 17:29:57+00:00,0.89,/r/Kamala/comments/1fc38z8/made_my_new_fb_cover/,False
1fbz17i,"Like Hitler before him, Trump will murder scapegoats and minorities to excuse his bloody lust for power.",https://www.reddit.com/r/Kamala/comments/1fbz17i/like_hitler_before_him_trump_will_murder/,"They came here as babies or children. They know no other country, profess allegiance to no other country, and are as American as any native-born citizen.

Their parents came here seeking only safety for them. Seeking escape from the horrors, the depredations, and injustices of their native lands, and to provide access to the American dream; a good education and the promise of a happy and secure life for their children,

While the parents labored at jobs Americans had no taste for and paid their taxes -- and committed fewer crimes than their native-born neighbors -- the children thrived. Many of them served in the armed forces, vowing to give their lives in service to the country had given them so much.

All 1.6 million of them.

Now Trump and his Republican panderers are making a vow of their own. Not a vow that recognizes the greatness and compassion of our country, but one that promises 'Bloody' retribution as red meat for the rabid and red-eyed racist white supremacists fouling our national being.

Trump has already promised to incarcerate his political opponents, that is where he hasn't openly called for their execution, He has advocated for the murder of some of his own military staff when they disagreed with him, and now says he intends to use any method necessary- including unmitigated violence -- to deport a huge portion of our country.

The irony is, Trump doesn't give a damn about immigration. If he cared he never would have forced the scum in the House to vote down their own bill to improve things at the border, No, he finds it a useful tool to keep MAGA hair on fire,

Here is Trumps promise in his own words: ""And ya know getting them out will be a bloody story,"" Trump told supporters on Saturday, referencing plans for large-scale removal of undocumented immigrants. ""\[They\] should have never been allowed to come into our country. Nobody checked them.""

There are over 10 million so-called 'undocumented immigrants in the U.S.A, and Trump wouldn't hesitate to murder them all to fulfill his bloody lust for power!",75,8,LetterGrouchy6053,Kamala,2024-09-08 14:26:54+00:00,0.95,/r/Kamala/comments/1fbz17i/like_hitler_before_him_trump_will_murder/,False
1fbyqh3,How many times has Nate Silver been right?,https://www.reddit.com/r/Kamala/comments/1fbyqh3/how_many_times_has_nate_silver_been_right/,"He has one poll that is showing 60 percent of Trump winning. I read , elsewhere, when googling him that he was only right once. Is that correct? If so, than why are people losing their minds over this poll?",22,58,SpiritualMedicine7,Kamala,2024-09-08 14:13:28+00:00,0.76,/r/Kamala/comments/1fbyqh3/how_many_times_has_nate_silver_been_right/,False
1fbvzzu,Do you support tax cheats or the people who force them to pay up?,https://www.reddit.com/r/Kamala/comments/1fbvzzu/do_you_support_tax_cheats_or_the_people_who_force/,"

While House MAGA Republicans waste the country's money on phony hearings and investigations (Rumor is they will propose a *new* law to prevent citizens from removing tags from mattresses), the Democrats in the House and Senate are doing real work to make the lives of citizens better.

We all know the administration in a truly lifesaving move, capped the price of insulin for senior citizens at 35.00 and is working to keep the price at that level for all Americans, They have reduced prescription prices, and rescued the country and changed the course of the pandemic. If you remember Trump tried to downplay the horrors of Covid by saying it was 'King Flu', a' Democrat hoax' a 'Chinese hoax', all the while tens of thousands of Americans were needlessly dying. The Democrats also provided untold billions of dollars for infrastructure repair for every state in the union.

You see those roads and highways being repaired? That isn't local money, that is your federal tax dollars being returned to you

Speaking of tax dollars, the IRS has just reported collecting 1.3 billion dollars from mega-millionaires who, under the previous Republican administration were able to dodge their responsibility.

We have to pay taxes, why not the people who are already obscenely wealthy?

If you recall the Republicans fought like hell against increasing IRS funding. They lied through their store bought teeth telling us the money would be used to go after low income earners, when the exact opposite is true.

Millionaires, billionaires, and the tax-dodging corporations have been put on notice, pay up or go to prison.

Now they are paying up.

See below -- boldface mine.

.© Tasos Katopodis/

The IRS said Friday that it has **recovered $1.3 billion in unpaid taxes** from high-income Americans who had either failed to file their returns or who **hadn't fully paid what they owed.**  The announcement, made jointly with the U.S. Treasury Department, is aimed at highlighting the agency's ramped-up **enforcement efforts against tax cheats,** which have been funded under the 2022 Inflation Reduction Act.

That IRS funding has proved controversial, with some **Republican lawmakers falsely claiming the** money would be used to hire 87,000 new IRS agents to ""to audit Walmart shoppers.""

Instead, the IRS says the money is being invested in improved customer service following years of snarls during the pandemic, as well as to **increase the number of audits on people with more than $1 million in** annual income and more than $250,000 in tax debts.

**125,000 high earners haven't paid taxes in years**

The initiative is designed **""to crack down on tax evasion** so that high earners pay what they owe,"" Treasury Secretary Janet Yellen said in prepared remarks released ahead of a scheduled speech in Austin, Texas, on Friday. ""For too long, this hadn't been happening. Between 2010 and 2018, **the audit rate for millionaires fell by 80%.**"" She added, ""And during **the previous administration, as audit rates on high-income taxpayers fell,** the share of audits on taxpayers with incomes under $200,000 increased. In 2019, the top 1% of Americans was estimated to owe over one-fifth of unpaid taxes, **leaving ordinary Americans to shoulder the burden.""** Yellen said the IRS is pursuing 125,000 wealthy taxpayers who **haven't filed taxes in years.** With stronger enforcement, about 21,000 of those taxpayers have filed their returns over the last six months, paying $172 million in taxes, she added.

Those 21,000 taxpayers who have filed their taxes were the first to respond after the IRS reached out to alert them that they needed to file, according to a senior Treasury official who spoke on a conference call with reporters. **The IRS is likely to recoup hundreds of millions more in new tax revenue** from the remaining 104,000 people who still need to file, he said.

The agency is ready to use its enforcement authority to go after the remaining individuals who haven't yet filed, the official noted.

**Since the crackdown roughly 80% of 1,600 millionaires with overdue taxes have paid up,** providing an additional 1.1 billion dollars the Treasury said. That represents an increase of $100 million since July, when the IRS noted it had recovered $1 billion from this group of taxpayers.

>![https://www.msn.com/en-us/money/taxes/irs-has-recovered-1-3-billion-in-unpaid-taxes-from-rich-americans/ar-AA1q6iqa?ocid=msedgdhp&pc=HCTS&cvid=0faad31ace0544318b01173cbab1610f&ei=125](https://www.msn.com/en-us/money/taxes/irs-has-recovered-1-3-billion-in-unpaid-taxes-from-rich-americans/ar-AA1q6iqa?ocid=msedgdhp&pc=HCTS&cvid=0faad31ace0544318b01173cbab1610f&ei=125)!<",7,11,LetterGrouchy6053,Kamala,2024-09-08 11:53:11+00:00,0.67,/r/Kamala/comments/1fbvzzu/do_you_support_tax_cheats_or_the_people_who_force/,False
1fbnxul,New Kamala support video,https://youtu.be/BAVY1jYk5Z4,From a Canadian of all people,7,1,real_ikonn,Kamala,2024-09-08 02:48:58+00:00,1.0,/r/Kamala/comments/1fbnxul/new_kamala_support_video/,False
1fbn9sd,"""Suckers"" and ""Losers""",https://youtube.com/shorts/PJbXPlIdEh0?si=KIztcGGWRJDheK4b,,2,1,SoCalLynda,Kamala,2024-09-08 02:11:11+00:00,1.0,/r/Kamala/comments/1fbn9sd/suckers_and_losers/,False
1fbg1s6,"But we thought, ""Trump has nothing to do with Project 2025"" Right?",https://project2025news.com/dnc-will-fly-banners-about-trump-vance-ticket-project-2025-over-battleground-state-football-games/,,26,1,sayrkhan,Kamala,2024-09-07 20:12:56+00:00,1.0,/r/Kamala/comments/1fbg1s6/but_we_thought_trump_has_nothing_to_do_with/,False
1fbehmf,Immigration Gov News Update Newsletter — September 2024,https://immigration.net/2024/09/03/immigration-news-update-newsletter-september-2024/,,1,1,Strict-Marsupial6141,Kamala,2024-09-07 19:03:55+00:00,0.67,/r/Kamala/comments/1fbehmf/immigration_gov_news_update_newsletter_september/,False
1fbe4w0,Harris Opens $110 Million Cash Edge Over Trump After August Fund-Raising Haul,https://www.nytimes.com/2024/09/06/us/politics/harris-august-fundraising-trump.html?campaign_id=9&emc=edit_nn_20240907&instance_id=133689&nl=the-morning&regi_id=53831380&segment_id=177139&te=1&user_id=fe5d662adf685ae9dedd7464c832fcdf,,45,1,Free_Swimming,Kamala,2024-09-07 18:48:24+00:00,0.96,/r/Kamala/comments/1fbe4w0/harris_opens_110_million_cash_edge_over_trump/,False
1fbe3ag,Madam President,https://v.redd.it/dqahvuaulfnd1,,63,3,Parking_Train8423,Kamala,2024-09-07 18:46:31+00:00,0.99,/r/Kamala/comments/1fbe3ag/madam_president/,False
1fbdom2,"No, 10M 'Illegal Aliens' Weren't Newly Registered To Vote in 2024 in US",https://www.snopes.com/fact-check/10-million-illegal-aliens-newly-registered/,,27,2,Strict-Marsupial6141,Kamala,2024-09-07 18:28:33+00:00,1.0,/r/Kamala/comments/1fbdom2/no_10m_illegal_aliens_werent_newly_registered_to/,False
1fbdmq6,How to talk to non-MAGA R voters: Dear Republicans: Voting Kamala over Trump is Easy (LIVE w/ Adam Kinzinger) | The Bulwark Podcast,https://youtu.be/cNTNmH1WtxE?si=Rlrs9lipp6uFyGJ_,,8,1,SoCalLynda,Kamala,2024-09-07 18:26:11+00:00,1.0,/r/Kamala/comments/1fbdmq6/how_to_talk_to_nonmaga_r_voters_dear_republicans/,False
1fb6afg,MULTI-BILLIONAIRES for TRUMP,https://i.redd.it/56xybrazwdnd1.jpeg,"The fundamental reason Elon Musk and Peter Thiel are supporting dictatorship is to control the masses and to prevent another French Revolution when artificial intelligence results in technological unemployment on a scale that is unimaginable.

It should be noted that, under Donald Trump, the U.S.A. experienced a manufacturing recession before the pandemic struck and lost more jobs than at any time since Herbert Hoover!

It should also be noted that, under President Joe Biden and Vice President Kamala Harris, the U.S. has experienced the lowest rates of unemployment and joblessness in more than a generation. However, we need to be starting to put in place new polices that will take effect as automation causes more widespread job losses, including among white-collar workers and professionals, such as doctors and lawyers.

Automation is the true threat to jobs. Donald Trump wants to demogogue against foreigners, instead, because they are easier to scapegoat. His arguments are about 30-40 years too late. He is stuck in the past. 

Vice President Kamala Harris, conversely, was delegated by President Biden to devote her attention to artificial intelligence and to develop policy responses in order to avoid disruptions that hurt people.

We have to fight against the tech multi-billionaires who are trying to turn the U.S.A. into a dictatorship.",56,5,SoCalLynda,Kamala,2024-09-07 12:55:47+00:00,0.98,/r/Kamala/comments/1fb6afg/multibillionaires_for_trump/,False
1fb66e4,Elon Musk shares theory that only 'alpha males' should vote,https://www.newsweek.com/elon-musk-shares-controversial-theory-democracy-1947873,,35,11,SoCalLynda,Kamala,2024-09-07 12:49:55+00:00,1.0,/r/Kamala/comments/1fb66e4/elon_musk_shares_theory_that_only_alpha_males/,False
1fb5hxv,"Russian whistleblowers reveal what it was like to work for a troll farm and spread anti-American & anti-Ukrainian propaganda lies on social media. There are literally thousands of these guys on social media, and you have interacted with them, without realizing it.",https://worldwar3.substack.com/p/russian-whistleblowers-reveal-what,,23,2,SoCalLynda,Kamala,2024-09-07 12:12:39+00:00,0.97,/r/Kamala/comments/1fb5hxv/russian_whistleblowers_reveal_what_it_was_like_to/,False
1fb50cx,"Did your parents' or grandparents fight the Nazis? Were your grandparents, aunts, uncles, and cousins slain by the Nazis? They are at the door again, and Tucker and the GOP are welcoming them in again.",https://www.reddit.com/r/Kamala/comments/1fb50cx/did_your_parents_or_grandparents_fight_the_nazis/,"Trump's MAGA Manifesto, *Project 2025, who* some say is based on Hitler's '*Enabling Act'* of 1933 wasn't enough for the GOP, now one of their chief adherents, proponents, and apologists, Tucker Carlson,  is inviting the Nazi Party directly into the Republican fold

Tucker Carlson, the man so vile he was fired by Fox News,  has invited a sickening array of deranged fascistic zealots to join him on his streaming show, and to address his upcoming Bund meeting at the T-- Mobile Center in Kansas City.

T-Mobile, ""Can you hear the guttural, moral blasphemies echoing now?"" 

In their insatiable lust for power, the GOP has devolved into a morass of red-eyed drooling opportunists who would follow Satan himself into the raging fires of hell, for a sniff of the raw power Project 2025 foretells.

If some sanity doesn't return, if  some Republican loyalist doesn't stand up for Liberty and condemn fascism, our Democracy will be a  dim memory, and we will be ruled by a dictator even more amoral than Hitler, himself!

See this -- boldface mine.



This week, it became clear that the **sickness among Republicans and conservatives** who have been enthralled by Donald Trump is not going to end when he loses the presidential election. The disease will continue its course. Indeed, it is possible things will get worse. This week, **Tucker Carlson,** a man who had **a prime-time speaking slot at the Republican Convention** where he sat next to Trump, **invited Nazi sympathizer Darryl Cooper** onto his streaming show and into the lives of millions of his fans to **rehabilitate Adolf Hitler as a spurned peacemaker** who was pushed into **Jewish genocide** by a war-mongering Winston Churchill. This is insane.

**Next week**, Carlson is bringing his f**ascist apologia show to T-Mobile Center in Kansas City.** Some people are paying more than $100 to get close. **The next day, Carlson will be speaking before** thousands more in **Wichita at InTrust Bank Arena.** I don’t think this is what T-Mobile and InTrust had in mind when they paid for naming rights to these venues. Carlson is no fringe figure. As a Fox News commentator, he had an audience of millions five nights a week. When he became **too extreme for Fox** **to stomach,** millions followed him to his internet platforms where his commentary and interviews have only grown in popularity. His work has been **shared by billionaire X social network owner Elon Musk.**

Similarly, the guests who will be sharing the stage for his two shows, Megyn Kelly, a defrocked journalist, and Charlie Kirk, head of conservative group Turning Point USA, have millions of their own followers. Locally, Pete Mundo of KCMO has interviewed Carlson on his show.

Right now it is unclear if this descent into shilling for a long-dead dictator **responsible for the deaths of more than 50 million people** is enough to get Kelly, Kirk and Mundo to back away.

**Shilling for dictators** is a growing pastime for those in what remains of **conservative media** if this week’s other news is any indication. The U.S. Attorney for the Southern District of New York **indicted two employees of Russian President Vladimir Putin’s propaganda organization for funneling $10 million** to a Tennessee firm, called Tenet Media, **to pay conservative influencers Benny Johnson, Tim Pool and Dave Rubin** — also with their own millions of followers — to **spew Kremlin propaganda to credulous conservatives** skeptical of U.S. involvement in the Ukraine war. A commentator for Glenn Beck’s Blaze Media was fired by that organization for her involvement in the scheme.

Johnson, Pool and Rubin claim to be victims in this fiasco that was part of a larger Russian effort to **influence the 2024 elections in favor of Trump.** As, yet they are unindicted, so it may be true that they were unwitting tools or, maybe more accurately, **fools for Putin.**

But let me tell you why Johnson, the worst among the three, is willing to take millions from unknown benefactors: He has no other choice because he is unemployable. The serial plagiarist has been fired over and over again for his shady dealings. It is not fair to say that all conservative media have been overtaken by edge-lord **fascism fluffing.** National Review, The Washington Free Beacon and The Dispatch, among others, provide solid reporting, untainted by Russian boodle, and commentary by writers unimpressed with Trump and his acolytes.

But millions of Americans are reading, listening and viewing news that appears to be from **a conservative perspective** but is untethered to reality by “journalists” who are willing to defend whatever garbage behavior or half-truth is convenient that day.

**As long as that is the case, Trump’s legacy will be with us.**",24,1,LetterGrouchy6053,Kamala,2024-09-07 11:44:18+00:00,0.86,/r/Kamala/comments/1fb50cx/did_your_parents_or_grandparents_fight_the_nazis/,False
1fb4lvu,Would you want your children to sound like a presidential candidate?,https://v.redd.it/5kubyyfbbdnd1,,13,2,Jermine1269,Kamala,2024-09-07 11:19:13+00:00,0.88,/r/Kamala/comments/1fb4lvu/would_you_want_your_children_to_sound_like_a/,False
1fb4i57,"Project 2025 and GOP Agenda Would Increase Poverty and Wealth Gap, Experts Say",https://truthout.org/articles/project-2025-and-gop-agenda-would-increase-poverty-and-wealth-gap-experts-say/,,3,2,Strict-Marsupial6141,Kamala,2024-09-07 11:12:28+00:00,0.72,/r/Kamala/comments/1fb4i57/project_2025_and_gop_agenda_would_increase/,False
1fb2pbf,"DOJ: Russia Aimed Propaganda at Gamers, Minorities to Swing 2024 Election",https://www.wired.com/story/project-good-old-usa-russia-2024-election/,,71,18,throwaway146225,Kamala,2024-09-07 09:02:00+00:00,0.96,/r/Kamala/comments/1fb2pbf/doj_russia_aimed_propaganda_at_gamers_minorities/,False
1fb0boa,Biden-Harris: Executive Order on Investing in America and Investing in American Workers,https://www.whitehouse.gov/briefing-room/presidential-actions/2024/09/06/executive-order-on-investing-in-america-and-investing-in-american-workers/,,11,1,Strict-Marsupial6141,Kamala,2024-09-07 06:05:50+00:00,0.79,/r/Kamala/comments/1fb0boa/bidenharris_executive_order_on_investing_in/,False
1faxezm,Getting the word out to women voters…,https://i.redd.it/or07z4960bnd1.jpeg,"

I’m leaving these in women’s restroom stalls. Make your own for your area and join me!",114,5,grapebeyond227,Kamala,2024-09-07 03:08:21+00:00,0.99,/r/Kamala/comments/1faxezm/getting_the_word_out_to_women_voters/,False
1fawmb6,Me regarding the Cheny news ,https://www.reddit.com/r/Kamala/comments/1fawmb6/me_regarding_the_cheny_news/,"https://preview.redd.it/unt8iwagsand1.png?width=500&format=png&auto=webp&s=b37cf768e6239f763d4126c5b227def79cab4476

",32,11,SpiritualMedicine7,Kamala,2024-09-07 02:25:17+00:00,0.94,/r/Kamala/comments/1fawmb6/me_regarding_the_cheny_news/,False
1fav2lm,A moment that I'm surprised didn't go viral with the Republicans ,https://www.reddit.com/r/Kamala/comments/1fav2lm/a_moment_that_im_surprised_didnt_go_viral_with/,"Was when someone asked ""You are so busy. What do you like doing for YOU time?"" And Kamala stated ""I really love cooking for my family"". I wished that went viral more, because some of their gripes is that she's not ""traditional"" enough.",43,6,SpiritualMedicine7,Kamala,2024-09-07 01:02:41+00:00,0.95,/r/Kamala/comments/1fav2lm/a_moment_that_im_surprised_didnt_go_viral_with/,False
