id,title,url,selftext,score,num_comments,author,subreddit,created_utc,upvote_ratio,permalink,stickied
1ezli5n,"How Harris will or can fund the $25,000 credit to first-time homebuyers, about estimated 4.3 million annually, of them. (a detailed analysis)",https://www.reddit.com/r/Kamala/comments/1ezli5n/how_harris_will_or_can_fund_the_25000_credit_to/,"To address the housing market’s challenges and support first-time homebuyers, Biden, Harris, and the government is considering a substantial credit program. 

(The figure of 4.3 million first-time homebuyers is based on a hypothetical calculation using the assumption that 5% of the adult population (estimated at 270 million) might purchase homes in a given year, and that 32% of these purchasers are first-time buyers. )

The idea is to offer a $25,000 credit to first-time homebuyers, which would require a significant budget allocation. To manage this, the government could split the cost with state governments, sharing the financial responsibility. About 108 bln usd ($25,000 credit, 4.3 mln first-time buyers) or so will be need in total. For example, a 50/50 split would mean both the federal and state governments would each need to find $54 billion USD to fund the program. A 60/40 cost sharing arrangement would be, say if the federal government covers 60% of the cost, it would need to allocate $64.8 billion USD, while the states would collectively contribute $43.2 billion USD (from their surplus or annual budget, any raised revenue they can make without burdening taxes on middle to lower brackets).

Raising such a large amount of money requires creative financial strategies. The federal government could start by lifting the cap on Social Security taxes for high earners, which would increase revenue without affecting the majority of taxpayers. Additionally, reforming the tax code to close loopholes and ensure that corporations and wealthy individuals pay their fair share could also boost the budget. They could also enforce existing ordinances more strictly to generate revenue through fines and fees. Encouraging population growth in certain areas can lead to higher property and sales tax collections.

Local governments could contribute by reforming zoning laws to increase the supply of affordable housing, which would, in turn, increase property tax revenues. They could also enforce existing ordinances more strictly, generating revenue through fines and fees. Encouraging population growth in certain areas can lead to higher property and sales tax collections, further supporting the initiative.

Public-private partnerships (PPPs) are another avenue to explore. These partnerships between the government and private housing companies can lead to more efficient and cost-effective housing developments. The government could provide incentives like tax credits or zoning concessions to attract private investment, while private entities bring in capital, expertise, and innovation. Public-private partnerships (PPPs) could be leveraged. 

These partnerships between the government and private housing companies can lead to more efficient and cost-effective housing developments. The government could provide incentives like tax credits or zoning concessions to attract private investment, while private entities bring in capital, expertise, and innovation.

By combining resources from federal and state budgets with contributions from the private sector, the government can create a robust system to support first-time homebuyers. This collaborative approach not only makes the program financially viable but also promotes sustainable development and economic growth in the housing sector. It’s a win-win situation where the government, private companies, and citizens all play a part in strengthening the housing market.

To facilitate such a partnership, both federal and state governments could establish agreements that outline the funding mechanisms, eligibility criteria, and program goals. States could leverage their own budgets, bonds, or other revenue sources to meet their share of the costs. Additionally, states could implement policies to encourage local investment in affordable housing, such as tax exemptions for developers or reimbursements for landlords[^(1)](https://www.multistate.us/insider/2022/4/20/states-look-to-address-affordable-housing-what-are-their-policy-options).



1. Estimate the Total Number of Homebuyers: Total Homebuyers=270,000,000×0.05Total Homebuyers=13,500,000
2. Calculate the Number of First-Time Homebuyers: First-Time Homebuyers=13,500,000×0.32First-Time Homebuyers=4,320,000

This calculation suggests that there could be approximately 4.32 million first-time homebuyers.

A synergistic approach that maximizes the strengths and resources of each sector to achieve a common goal can be utilized. By combining resources from federal and state budgets with contributions from the private sector, the government can create a robust system to support first-time homebuyers. This collaborative approach not only makes the program financially viable but also promotes sustainable development and economic growth in the housing sector. It’s a win-win situation where the government, private companies, and citizens all play a part in strengthening the housing market.

For instance, the government could relaunch partnerships between the Department of Treasury and HUD to provide low-cost capital for affordable housing development. This could involve raising equity caps for federal programs like the Low-Income Housing Tax Credit (LIHTC), which is a significant tool for constructing and rehabilitating affordable rental housing[^(3)](https://www.whitehouse.gov/briefing-room/statements-releases/2021/09/01/fact-sheet-biden-harris-administration-announces-immediate-steps-to-increase-affordable-housing-supply/). Additionally, Community Development Finance Institutions (CDFIs) and non-profit housing groups could receive more funding under programs like the Capital Magnet Fund to boost affordable housing production[^(3)](https://www.whitehouse.gov/briefing-room/statements-releases/2021/09/01/fact-sheet-biden-harris-administration-announces-immediate-steps-to-increase-affordable-housing-supply/).

By combining state and federal resources with private sector capabilities, these collaborative efforts can lead to the creation of more affordable housing units, stimulate local economies, and provide long-term solutions to housing challenges.

Streamlining government operations presents a significant opportunity for budget savings that could support initiatives like the proposed housing credit program. The Government Accountability Office (GAO) has highlighted the potential to save over half a trillion dollars by eliminating inefficiencies and redundancies across federal agencies[^(1)](https://www.gao.gov/blog/where-can-government-save-money-weve-found-more-half-trillion-dollars-potential-savings). By consolidating operations and reevaluating programs to ensure they meet their objectives efficiently, the government can free up substantial funds. These savings could be redirected to critical areas such as housing, thereby enhancing the program’s sustainability without imposing additional financial burdens on taxpayers.

In the defense sector, there is a potential to save between 10 to 20 percent of the total budget by increasing productivity and streamlining non-combat operations[^(2)](https://www.mckinsey.com/industries/public-sector/our-insights/preserving-combat-power-when-defense-budgets-are-falling). This can be achieved by aligning military forces with strategic objectives, optimizing functional expenditures, and reducing non-combat personnel. Such measures would preserve combat power while freeing up resources that could be allocated to domestic priorities like the housing credit program. Implementing these cost-saving strategies effectively is crucial for maintaining the program’s sustainability and ensuring fiscal stability, all while continuing to meet other essential government services.

the goal of streamlining government operations and defense spending is to achieve savings without compromising essential services or the nation’s strength. By focusing on efficiency and eliminating waste, the government can reallocate resources to vital programs like the housing credit initiative without reducing the effectiveness of other critical functions.

This doesn’t mean reducing military strength; rather, it’s about aligning forces with strategic goals and cutting unnecessary expenditures. These savings could then be redirected to domestic programs without compromising national security or essential services.

The Government Accountability Office (GAO) suggests that the government can save substantial amounts by consolidating functions and eliminating redundant services across various agencies. This approach ensures that the government’s core missions are not affected while freeing up funds for important projects like the housing credit initiative.

By adopting such a balanced strategy, the government can make every taxpayer dollar count, supporting both the nation’s defense and the well-being of its citizens. This careful management of resources is what will allow the housing credit program to be a sustainable effort, helping first-time homebuyers and bolstering the housing market for the long term.

Based on the hypothetical model discussed, the government’s housing credit program for first-time homebuyers is projected to generate a positive cash flow. With an initial investment of $108 billion USD and an estimated net return of $150 billion USD over 6-8 years, the program would yield a return of $1.39 for every dollar invested. This translates to an average annual cash flow of $7 billion USD over 6 years or $5.25 billion USD over 8 years, indicating that the program could be financially beneficial and sustainable, supporting economic growth while aiding first-time homebuyers.",16,3,Strict-Marsupial6141,Kamala,2024-08-23 19:28:54+00:00,0.87,/r/Kamala/comments/1ezli5n/how_harris_will_or_can_fund_the_25000_credit_to/,False
1ezkcio,"In convention speech, Kamala Harris succeeded where Trump failed. ""I want you to know, I promise to be a president for all Americans. You can always trust me to put country above party and self.""",https://www.msnbc.com/rachel-maddow-show/maddowblog/convention-speech-kamala-harris-succeeded-trump-failed-rcna167918?icid=previouspost_bot,,94,2,Strict-Marsupial6141,Kamala,2024-08-23 18:40:26+00:00,0.98,/r/Kamala/comments/1ezkcio/in_convention_speech_kamala_harris_succeeded/,False
1ezg2e9,Senator Says Harris Will 'Be Ready To Sign' Marijuana Reform Bills If Elected President - Marijuana Moment,https://www.marijuanamoment.net/senator-says-harris-will-be-ready-to-sign-marijuana-reform-bills-if-elected-president/,,104,5,takemusu,Kamala,2024-08-23 15:45:43+00:00,0.98,/r/Kamala/comments/1ezg2e9/senator_says_harris_will_be_ready_to_sign/,False
1ezef7u,Harris Campaign Trolls Trump With Perfect Two-Word Response To His Bizarre Question About Her DNC Speech,https://www.comicsands.com/harris-trump-dnc-speech-troll-2669011256.html,,28,1,Blue_Wave2024,Kamala,2024-08-23 14:38:59+00:00,0.92,/r/Kamala/comments/1ezef7u/harris_campaign_trolls_trump_with_perfect_twoword/,False
1ezedb3,Jon Stewart Rips Apart Jesse Watters Over His DNC Takes ,https://v.redd.it/u7q5gbz2dfkd1,,46,3,GradientDescenting,Kamala,2024-08-23 14:36:50+00:00,0.94,/r/Kamala/comments/1ezedb3/jon_stewart_rips_apart_jesse_watters_over_his_dnc/,False
1eze5i5,Losing His Mind,https://youtu.be/1r-HVwvZMy0?si=QXX6iIzEUrTtAX8Z,,10,2,JimCripe,Kamala,2024-08-23 14:27:54+00:00,0.99,/r/Kamala/comments/1eze5i5/losing_his_mind/,False
1ezdvzr,“To stop men from voting for a woman.” Leaving this here for amusement. 🤭,https://v.redd.it/2w4v4wzxcekd1,,32,13,My1Thought,Kamala,2024-08-23 14:16:48+00:00,0.85,/r/Kamala/comments/1ezdvzr/to_stop_men_from_voting_for_a_woman_leaving_this/,False
1ezcc1q,2 queens ,https://i.redd.it/evvhcjfoxekd1.jpeg,,146,2,throwaway146225,Kamala,2024-08-23 13:09:04+00:00,0.98,/r/Kamala/comments/1ezcc1q/2_queens/,False
1eza04w,The President of Joy,https://i.redd.it/f7etnhhacekd1.jpeg,,113,7,SuperKeith88,Kamala,2024-08-23 11:09:41+00:00,0.98,/r/Kamala/comments/1eza04w/the_president_of_joy/,False
1ez9s9y,Being part of this election has helped heal me ,https://www.reddit.com/r/Kamala/comments/1ez9s9y/being_part_of_this_election_has_helped_heal_me/,"I became very cynical in 2016. I had my knee surgeries, then, and Trump was President. I saw how selfish people were, and I saw how selfish they continued to be in 2020. That was especially draining for me, with a pre existing heart condition, and immunes situation. I was so upset on 2016, even my cousin noted ""You are very angry tonight"". I am normally a happy person to be around. I get passionate, though. During the last few year I have become depleted. I was in my early 20s when Obama was elected, and that filled me with such HOPE. Same for when gay marriage was finally legalized. Now, I am feeling that sense of hope. The desire that people have to go forward. I want her to win, but I'm writing this out in case something bad happens. Let's remember this as a healing journey. We, as Americans, were tired of all the negativity. Even republicans are voting dems. We wanted change. We wanted our hope back. And she did that. She helped heal, and unite, a very divided nation. So thank you, to our joyful warrior-regardless what happens in November. Thank you to Kamala Harris.",59,16,SpiritualMedicine7,Kamala,2024-08-23 10:57:18+00:00,0.94,/r/Kamala/comments/1ez9s9y/being_part_of_this_election_has_helped_heal_me/,False
1ez7j6l,"'Let's show the world who we are and what we stand for, Freedom, Opportunity, Compassion, Fairness, and Endless Possibilities'",/r/Kamala_Harris_2024/comments/1ez7ern/lets_show_the_world_who_we_are_and_what_we_stand/,,21,2,Strict-Marsupial6141,Kamala,2024-08-23 08:28:07+00:00,0.99,/r/Kamala/comments/1ez7j6l/lets_show_the_world_who_we_are_and_what_we_stand/,False
1ez5ag9,I've Checked and YES this is True,https://v.redd.it/yygle6shfnjd1,,57,11,BlueSky2777,Kamala,2024-08-23 05:54:04+00:00,0.99,/r/Kamala/comments/1ez5ag9/ive_checked_and_yes_this_is_true/,False
1ez4rdw,"Kamala National Security - Case 1, Insurrection prevention",https://www.reddit.com/r/Kamala/comments/1ez4rdw/kamala_national_security_case_1_insurrection/,"An example of National Security

Insurrection Security:

* Preventive Measures: Fostering strong democratic institutions and promoting social cohesion to address the underlying causes of insurrections.
* Intelligence and Surveillance: Employing intelligence agencies to monitor and identify potential insurrection threats before they materialize.
* Law Enforcement: Training law enforcement to respond effectively and proportionately to civil unrest, ensuring the protection of citizens’ rights to peaceful assembly and protest.
* Legal Frameworks: Crafting laws that clearly define insurrection and provide guidelines for lawful responses, while upholding the constitutional right to peaceful protest.
* Community Engagement: Encouraging open dialogue with communities to build trust and resolve grievances, and recognizing peaceful protest as a legitimate form of expression.
* Crisis Response: Developing rapid response plans to address insurrections, including the use of emergency services and the military if necessary, while safeguarding peaceful demonstrators.
* International Cooperation: Collaborating with international partners to prevent and respond to insurrections, especially those with cross-border implications, and sharing best practices for respecting peaceful protests.",6,4,Strict-Marsupial6141,Kamala,2024-08-23 05:19:36+00:00,0.81,/r/Kamala/comments/1ez4rdw/kamala_national_security_case_1_insurrection/,False
1ez2yji,Opportunity Economy,https://www.reddit.com/r/Kamala/comments/1ez2yji/opportunity_economy/,"The “Opportunity Economy” of the Kamala and Tim economic blueprint is a visionary approach to fostering an environment where legal, skilled individuals can thrive. It’s about creating an economy that not only sustains but also empowers, ensuring fair wages and equitable growth. This blueprint is dedicated to dismantling barriers and leveraging technology to open up global trade, setting the stage for a future where prosperity is not a privilege but a shared reality.

At the heart of this blueprint is the belief that a resilient economy is built on the foundation of inclusive governance. By prioritizing civil and human rights, every voice is amplified, and every paycheck is fair. The blueprint takes a firm stand against corporate overreach and price gouging, reinforcing consumer rights and managing inflation to benefit every household. It champions diversity and inclusion in the workplace, recognizing that our collective strength lies in our differences, fostering a culture where innovation and productivity flourish.
This economic policy is not just a set of goals; it’s a commitment to action. It’s about investing in sustainable practices and climate change solutions, ensuring a healthy planet parallels a robust economy. 

The blueprint also emphasizes enhancing border security and modernizing immigration processes to address labor gaps with a diverse, skilled workforce, including young Americans. It does not provide benefits to illegal immigrants but instead clarifies skilled worker roles. Drivers license access, currently state-based, will be further clarified at the Federal level with robust tests and exams. Always with a positive purpose.

The blueprint also reimagines public law enforcement with community-centric initiatives, enhancing safety and security for all. By streamlining immigration and modernizing border security, it supports a dynamic workforce.

Housing and Homeownership: The blueprint includes measures to address housing shortages and make homeownership more accessible. 

Tax Credits and Small Businesses: There are specific tax credits aimed at revitalizing factory towns and supporting small businesses. Healthcare and Education: The plan also emphasizes support for healthcare workers and focuses on education and workforce development.

The Opportunity Economy is a promise of a brighter future, where innovation, sustainability, and global leadership drive economic output. 

It’s a future where the U.S. sets the standard for a world where freedom, justice, and prosperity are not just ideals but tangible realities for all. This blueprint emphasizes enhancing border security and streamlining immigration processes, rather than providing housing to illegal immigrants. Always with a positive purpose.

Additionally, the blueprint focuses on cutting red tape and streamlining regulations, removing duplicate and burdensome regulations to foster a more efficient industrial sector. This approach aims to increase the percentage of sustainable industrial practices, targeting 30% and beyond. It also aims to reposition the U.S. as a leading global exporter, showcasing the nation’s commitment to being an industrial leader.",14,8,Strict-Marsupial6141,Kamala,2024-08-23 03:36:12+00:00,0.93,/r/Kamala/comments/1ez2yji/opportunity_economy/,False
1ez2e61,"Statement from Vice President Kamala Harris on the Passing of Congressman Bill Pascrell, Jr. | The White House",https://www.whitehouse.gov/briefing-room/statements-releases/2024/08/22/statement-from-vice-president-kamala-harris-on-the-passing-of-congressman-bill-pascrell-jr/,,27,1,Plus-Bluejay-2024,Kamala,2024-08-23 03:06:22+00:00,0.93,/r/Kamala/comments/1ez2e61/statement_from_vice_president_kamala_harris_on/,False
1ez22z5,Evil never sleeps,https://i.redd.it/bq1rmj6s3akd1.jpeg,,52,1,Human_Capital_Stock,Kamala,2024-08-23 02:50:46+00:00,0.95,/r/Kamala/comments/1ez22z5/evil_never_sleeps/,False
1eyxrod,Democratic National Convention: Day 4 livestream,https://www.youtube.com/watch?v=nKNW_KHYrbY,,14,3,Liberty_Chip_Cookies,Kamala,2024-08-22 23:24:25+00:00,0.86,/r/Kamala/comments/1eyxrod/democratic_national_convention_day_4_livestream/,False
1eyv42l,Cat Men for Democracy ,https://www.reddit.com/r/Kamala/comments/1eyv42l/cat_men_for_democracy/,I created this with AI to make a point! ,8,1,Americafirst22,Kamala,2024-08-22 21:28:49+00:00,0.83,/r/Kamala/comments/1eyv42l/cat_men_for_democracy/,False
1eyp2d3,Some great news for Coach Walz 💪💪💪,https://www.reddit.com/gallery/1eyp2d3,,70,6,Plus-Bluejay-2024,Kamala,2024-08-22 17:19:31+00:00,0.94,/r/Kamala/comments/1eyp2d3/some_great_news_for_coach_walz/,False
1eynx7l,Doug Emhoff's Ex-Wife Has Iconic Reaction After Fan Compares Her Support Of Harris To Melania,https://www.comicsands.com/kerstin-emhoff-dnc-melania-trump-2669002462.html,,56,3,Blue_Wave2024,Kamala,2024-08-22 16:35:05+00:00,0.97,/r/Kamala/comments/1eynx7l/doug_emhoffs_exwife_has_iconic_reaction_after_fan/,False
1eylrio,Kamala Harris Praised For Stopping Rally To Help Fan In Medical Distress: 'This Is Who We Are',https://www.comicsands.com/harris-stops-milwaukee-rally-medic-2669002301.html,,48,1,Blue_Wave2024,Kamala,2024-08-22 15:10:07+00:00,0.98,/r/Kamala/comments/1eylrio/kamala_harris_praised_for_stopping_rally_to_help/,False
1eydciu,"R.F.K., Jr., is an embarrassment to the legacy of J.F.K., Edward Kennedy, and R.F.K., Sr.",https://i.redd.it/9ylq3z8v46kd1.png,,176,8,SoCalLynda,Kamala,2024-08-22 07:33:20+00:00,0.98,/r/Kamala/comments/1eydciu/rfk_jr_is_an_embarrassment_to_the_legacy_of_jfk/,False
1ey9f7h,This art from Kamala's 2020 campaign is still so iconic. Artwork by Tracie Ching.,https://i.redd.it/s6gxz4yfx4kd1.jpeg,,119,1,SuperKeith88,Kamala,2024-08-22 03:29:58+00:00,0.98,/r/Kamala/comments/1ey9f7h/this_art_from_kamalas_2020_campaign_is_still_so/,False
1ey5mky,This explains it all.,https://i.redd.it/12gh4gnm04kd1.jpeg,,68,3,SoCalLynda,Kamala,2024-08-22 00:26:02+00:00,0.96,/r/Kamala/comments/1ey5mky/this_explains_it_all/,False
1ey4ga3,Watching the DNC speeches last night. Please read.,https://i.redd.it/7zmj82wbf1kd1.jpeg,,30,1,littleoldlady71,Kamala,2024-08-21 23:31:32+00:00,0.97,/r/Kamala/comments/1ey4ga3/watching_the_dnc_speeches_last_night_please_read/,False
1ey0p2q,"No Kings Act, will move to Committee review, then floor debates",https://apnews.com/article/supreme-court-schumer-immunity-senate-king-149763b93d62599eac7d0a7c77ff4d4a,,48,4,Strict-Marsupial6141,Kamala,2024-08-21 20:52:19+00:00,0.98,/r/Kamala/comments/1ey0p2q/no_kings_act_will_move_to_committee_review_then/,False
1exy4ja,How Kamala Harris became Donald Trump’s supertroll and found his weak spot,https://www.independent.co.uk/news/world/americas/us-politics/kamala-harris-donald-trump-democrat-strategy-b2597619.html,,108,7,newzee1,Kamala,2024-08-21 19:08:38+00:00,0.99,/r/Kamala/comments/1exy4ja/how_kamala_harris_became_donald_trumps_supertroll/,False
1extm32,Releasing Economic policy further details in about an hour.. (stay tuned),https://www.reddit.com/r/Kamala/comments/1extm32/releasing_economic_policy_further_details_in/,Stay tuned. I will provide a tease and plus an explainable for the 17-25 age crowd or so. It will be constantly updated into the night.,7,33,Strict-Marsupial6141,Kamala,2024-08-21 16:09:39+00:00,0.89,/r/Kamala/comments/1extm32/releasing_economic_policy_further_details_in/,False
1ext9l3,Harris Walks a Strategic Line on Policy,https://thinkbigpicture.substack.com/p/harris-walks-strategic-line-policy,,12,1,Blue_Wave2024,Kamala,2024-08-21 15:56:23+00:00,0.88,/r/Kamala/comments/1ext9l3/harris_walks_a_strategic_line_on_policy/,False
1exjfvq,SHE WILL.,https://i.redd.it/ljbaik9uyyjd1.png,,76,3,Whole-Ad-1768,Kamala,2024-08-21 07:27:11+00:00,0.96,/r/Kamala/comments/1exjfvq/she_will/,False
1exge3y,Kamala Harris raises $500 Million in one month as enthusiasm grows: Report,https://www.newsweek.com/kamala-harris-raises-500-million-one-month-report-1942103,,166,6,Strict-Marsupial6141,Kamala,2024-08-21 04:16:13+00:00,0.98,/r/Kamala/comments/1exge3y/kamala_harris_raises_500_million_in_one_month_as/,False
1exbyo1,A One-Man Crime Wave,https://i.redd.it/u5hkfrizxwjd1.jpeg,,57,5,SoCalLynda,Kamala,2024-08-21 00:38:45+00:00,0.97,/r/Kamala/comments/1exbyo1/a_oneman_crime_wave/,False
1ex3be9,WALZ AND KAMALA,https://youtu.be/gh5pGcNB1Cg?si=9OZalgjpSR3XOy-a,,4,1,JimCripe,Kamala,2024-08-20 18:37:09+00:00,0.75,/r/Kamala/comments/1ex3be9/walz_and_kamala/,False
1ex1g91,Two Visions of the Future ,https://i.redd.it/9ub46zf6sujd1.jpeg,,25,2,SoCalLynda,Kamala,2024-08-20 17:22:37+00:00,0.9,/r/Kamala/comments/1ex1g91/two_visions_of_the_future/,False
1ewxg2c,The Latest: The Obamas and Emhoff are set to headline the DNC on Day 2,https://abcnews.go.com/US/wireStory/latest-obama-emhoff-set-headline-dnc-day-2-112977165,,29,1,Strict-Marsupial6141,Kamala,2024-08-20 14:45:36+00:00,0.97,/r/Kamala/comments/1ewxg2c/the_latest_the_obamas_and_emhoff_are_set_to/,False
1ewxe2i,"Day (Night) 2: What time does the DNC in Chicago start today? Speaker list, schedule and more",https://www.nbcchicago.com/dnc-chicago-2024/dnc-in-chicago-day-2-timing-schedule-list-of-speakers-street-closures-and-more/3526505/,,10,2,Strict-Marsupial6141,Kamala,2024-08-20 14:43:25+00:00,0.86,/r/Kamala/comments/1ewxe2i/day_night_2_what_time_does_the_dnc_in_chicago/,False
1ewwtqx,"I love you, America",https://youtu.be/OfQH4FZ3KxY?si=wWkS92PdlAtXcDyo,,44,3,Plus-Bluejay-2024,Kamala,2024-08-20 14:20:48+00:00,0.98,/r/Kamala/comments/1ewwtqx/i_love_you_america/,False
1ewwn5a,He was also forced out of the dressing rooms. #DonaldTrump #KamalaHarris,https://youtube.com/shorts/XhXhySnxG8Y?si=FHjg1kBa9GaNVOqD,,9,1,Extreme_Professional,Kamala,2024-08-20 14:13:08+00:00,0.91,/r/Kamala/comments/1ewwn5a/he_was_also_forced_out_of_the_dressing_rooms/,False
