id,title,url,selftext,score,num_comments,author,subreddit,created_utc,upvote_ratio,permalink,stickied
1frfonr,Gov. Tim Walz x Anthony Ramos | Harris-Walz 2024,https://youtu.be/x4qP_8O5S78?si=WUMKLEESB9GLfUqO,,13,1,Plus-Bluejay-2024,Kamala,2024-09-28 14:37:23+00:00,0.78,/r/Kamala/comments/1frfonr/gov_tim_walz_x_anthony_ramos_harriswalz_2024/,False
1fr10ex,I Want ROUND TWO!,https://i.redd.it/xld7awecltqd1.jpeg,,21,2,SoCalLynda,Kamala,2024-09-27 23:23:47+00:00,0.89,/r/Kamala/comments/1fr10ex/i_want_round_two/,False
1fr0wvr,FEAR,https://i.redd.it/n94c740eqfrd1.gif,,9,2,SoCalLynda,Kamala,2024-09-27 23:18:56+00:00,0.77,/r/Kamala/comments/1fr0wvr/fear/,False
1fqzbu4,The Bootlicker’s Ballad,https://i.redd.it/067a4sigcfrd1.png,,3,1,feast-of-folly,Kamala,2024-09-27 22:01:10+00:00,0.71,/r/Kamala/comments/1fqzbu4/the_bootlickers_ballad/,False
1fqvssg,"Hey Fl, NC and Ga! ",https://i.redd.it/tyeu2gcu7crd1.jpeg,,85,1,Jazzlike_Sky497,Kamala,2024-09-27 19:22:05+00:00,0.97,/r/Kamala/comments/1fqvssg/hey_fl_nc_and_ga/,False
1fqu6l8,Pathetic,https://i.redd.it/1hwe9zld7erd1.jpeg,,162,5,SoCalLynda,Kamala,2024-09-27 18:10:36+00:00,0.97,/r/Kamala/comments/1fqu6l8/pathetic/,False
1fqu2xg,Keep up the pressure. He's becoming even more desperate and unhinged.,https://i.redd.it/u43eyyyk6erd1.jpeg,,45,2,SoCalLynda,Kamala,2024-09-27 18:06:08+00:00,0.94,/r/Kamala/comments/1fqu2xg/keep_up_the_pressure_hes_becoming_even_more/,False
1fqtjxr,HAPPY FRIDAY!  Need a little lift today?  Here you go…,https://youtu.be/OC4314zDttY,We are not going back!,9,2,Boxcars4Peace,Kamala,2024-09-27 17:43:48+00:00,0.84,/r/Kamala/comments/1fqtjxr/happy_friday_need_a_little_lift_today_here_you_go/,False
1fqrvev,Harris Just Slipped In Another Epically Shady Dig At Trump's Rally Crowd Sizes During Interview,https://www.comicsands.com/harris-msnbc-trump-small-rally-2669280805.html,,44,2,Blue_Wave2024,Kamala,2024-09-27 16:30:34+00:00,0.94,/r/Kamala/comments/1fqrvev/harris_just_slipped_in_another_epically_shady_dig/,False
1fqosjh,All Americans,https://i.redd.it/70sawcpq1drd1.jpeg,,95,2,SoCalLynda,Kamala,2024-09-27 14:17:14+00:00,0.99,/r/Kamala/comments/1fqosjh/all_americans/,False
1fqoo1u,STAND UP for AMERICA!,https://i.redd.it/clrkk3br0drd1.jpeg,,29,8,SoCalLynda,Kamala,2024-09-27 14:11:43+00:00,0.84,/r/Kamala/comments/1fqoo1u/stand_up_for_america/,False
1fqodt3,Voter registration deadline is fast approaching!,https://i.redd.it/wl9q2kl2t7rd1.jpeg,,25,3,Spirited_Damage8529,Kamala,2024-09-27 13:59:15+00:00,0.96,/r/Kamala/comments/1fqodt3/voter_registration_deadline_is_fast_approaching/,False
1fqnfbw,"North Carolina removes 747,000 from voter rolls, citing ineligibility",https://thehill.com/homenews/campaign/4901476-north-carolina-purges-747k-voters/,CHECK YOUR VOTER STATUS ,82,6,UIUC202,Kamala,2024-09-27 13:13:57+00:00,0.97,/r/Kamala/comments/1fqnfbw/north_carolina_removes_747000_from_voter_rolls/,False
1fqje6o,Honest Trump Ad,https://v.redd.it/jgb6y31n3ard1,,67,6,quite_odd2,Kamala,2024-09-27 09:00:56+00:00,0.98,/r/Kamala/comments/1fqje6o/honest_trump_ad/,False
1fqbhkz,The Purge: Trump,https://youtu.be/A68jGATa0DA?si=H2Y6RQObaJr6GDCG,,1,1,Extreme-Degree3775,Kamala,2024-09-27 00:38:43+00:00,0.55,/r/Kamala/comments/1fqbhkz/the_purge_trump/,False
1fq44vg,Tim Walz Reminds Students to Register to Vote | Harris-Walz 2024,https://youtu.be/yhnbvrll2FE?si=Z4d1bdOzMq4bcQUh,,29,1,Plus-Bluejay-2024,Kamala,2024-09-26 19:05:04+00:00,0.91,/r/Kamala/comments/1fq44vg/tim_walz_reminds_students_to_register_to_vote/,False
1fq3g64,Harris outspends Trump 3-to-1 as Wall Street cash floods in,https://fortune.com/2024/09/23/harris-outspending-trump-5-million-day-recent-donation-surge/,,57,1,takemusu,Kamala,2024-09-26 18:36:09+00:00,0.94,/r/Kamala/comments/1fq3g64/harris_outspends_trump_3to1_as_wall_street_cash/,False
1fq3d6h,Vice Pres. Harris & Ukrainian Pres. Zelensky Deliver Remarks at White House,https://www.c-span.org/video/?538730-1/vice-pres-harris-ukrainian-pres-zelensky-deliver-remarks-white-house,,16,1,Strict-Marsupial6141,Kamala,2024-09-26 18:32:42+00:00,0.84,/r/Kamala/comments/1fq3d6h/vice_pres_harris_ukrainian_pres_zelensky_deliver/,False
1fpz5uc,Senate Democrats launch first multimillion-dollar TV investments in Texas and Florida ,https://amp.cnn.com/cnn/2024/09/26/politics/senate-democrats-florida-texas-election,,120,4,Healthy_Block3036,Kamala,2024-09-26 15:36:59+00:00,0.98,/r/Kamala/comments/1fpz5uc/senate_democrats_launch_first_multimilliondollar/,False
1fpy3w8,"Freedom Over Fascism. Women (particularly Black women) taking the lead in pro-democracy politics. Instrumental in getting Kamala's campaign going quickly, consolidating power, and driving the narrative. Also, an invitation for women to run for office.",https://www.reddit.com/r/Kamala/comments/1fpy3w8/freedom_over_fascism_women_particularly_black/,"[Emily Cain and Stephanie Wilson discussing Black women's leadership in democratic politics and Kamala's campaign](https://reddit.com/link/1fpy3w8/video/njs5oqgz26rd1/player)

",34,1,NotUsefulDoc,Kamala,2024-09-26 14:53:32+00:00,0.95,/r/Kamala/comments/1fpy3w8/freedom_over_fascism_women_particularly_black/,False
1fpxjjp,Where Kamala Harris stands on 10 key issues,https://www.bbc.com/news/articles/cx924r4d5yno,,10,1,takemusu,Kamala,2024-09-26 14:28:56+00:00,0.87,/r/Kamala/comments/1fpxjjp/where_kamala_harris_stands_on_10_key_issues/,False
1fpww4w,Kamala Harris Gives 'Loser' Trump A Brutal Reminder About His Manufacturing Record,https://www.comicsands.com/kamala-harris-trump-manufacturing-losers-2669274992.html,,87,1,Blue_Wave2024,Kamala,2024-09-26 14:00:42+00:00,0.97,/r/Kamala/comments/1fpww4w/kamala_harris_gives_loser_trump_a_brutal_reminder/,False
1fpo3v8,United States Announces Significant New Military Assistance for Ukraine,https://www.state.gov/united-states-announces-significant-new-military-assistance-for-ukraine-11/,,7,1,Strict-Marsupial6141,Kamala,2024-09-26 04:32:23+00:00,1.0,/r/Kamala/comments/1fpo3v8/united_states_announces_significant_new_military/,False
1fpnotg,Big tech will play the key role on Project 2025’s anti-abortion plans. Here’s how,https://project2025news.com/big-tech-will-play-the-key-role-on-project-2025s-anti-abortion-plans-heres-how/,,2,1,sayrkhan,Kamala,2024-09-26 04:07:04+00:00,1.0,/r/Kamala/comments/1fpnotg/big_tech_will_play_the_key_role_on_project_2025s/,False
1fpmz6s,"'VOTE BLUE""- US Air Force Vet TEARS INTO Trump And Urges We End The MAGA Nightmare And Project 2025",https://youtu.be/Ty9MklqxfeY?si=zcHsd82wWgGds3N7,"🇺🇸 As a proud U.S. Air Force Veteran, Steve Trexler is voting for @KamalaHarris and @TimWalz to put an end to the MAGA nightmare and Project 2025:

Trump is a ""clear and present danger to our democracy and national security.""
",3,1,JimCripe,Kamala,2024-09-26 03:25:49+00:00,1.0,/r/Kamala/comments/1fpmz6s/vote_blue_us_air_force_vet_tears_into_trump_and/,False
1fpmurc,Mark Cuban leaves Trump PANICKING with brilliant attack,https://youtu.be/I_PrIqs5rls?si=eB6uJZS6hGAg6ah0,"Mark Cuban SINKS Trump ON FOX NEWS,  endorsing Kamala.",28,1,JimCripe,Kamala,2024-09-26 03:18:32+00:00,0.98,/r/Kamala/comments/1fpmurc/mark_cuban_leaves_trump_panicking_with_brilliant/,False
1fpl6sg,Tim Walz: Don't Skip the Apple Cider Donuts | Harris-Walz 2024,https://youtu.be/kDZ_Zpx-P8w?si=p8B4gR3jBKySFaHy,,9,1,Plus-Bluejay-2024,Kamala,2024-09-26 01:48:09+00:00,0.85,/r/Kamala/comments/1fpl6sg/tim_walz_dont_skip_the_apple_cider_donuts/,False
1fpf4k4,"Kamala Harris endorsed by over 400 economists, former policymakers",https://thehill.com/homenews/campaign/4895899-kamala-harris-economists-former-policymakers-endorsement/?utm_source=substack&utm_medium=email,,132,2,Free_Swimming,Kamala,2024-09-25 20:57:39+00:00,0.99,/r/Kamala/comments/1fpf4k4/kamala_harris_endorsed_by_over_400_economists/,False
1fpc7gc,"LIVE: Kamala Harris delivers major speech on the economy in Pittsburgh
",https://www.youtube.com/watch?v=uq-zTQl83nw,,30,4,Strict-Marsupial6141,Kamala,2024-09-25 18:54:11+00:00,0.97,/r/Kamala/comments/1fpc7gc/live_kamala_harris_delivers_major_speech_on_the/,False
1fp9j92,A ONE-MAN CRIME WAVE,https://i.redd.it/76za9qlflzqd1.jpeg,"Additionally, Kamala Harris' opponent is awaiting trial in relation to three more criminal indictments, including one that is likely to be restored after being previously dismissed in a corrupt way by a judge who Trump, himself, appointed.",73,3,SoCalLynda,Kamala,2024-09-25 17:02:39+00:00,0.97,/r/Kamala/comments/1fp9j92/a_oneman_crime_wave/,False
1fp9cev,Sam Elliott Drops The F-Bomb In Fiery New Video Supporting Harris—And Fans Are Fired Up,https://www.comicsands.com/sam-elliott-harris-f-bomb-2669264489.html,,135,3,Blue_Wave2024,Kamala,2024-09-25 16:55:13+00:00,0.99,/r/Kamala/comments/1fp9cev/sam_elliott_drops_the_fbomb_in_fiery_new_video/,False
1fp845z,"""Vice President Kamala Harris continues to hold slightly more voter support than former President Donald Trump in the 2024 race for president. Trump’s support is virtually unchanged from his levels when Biden was in the race from Monmouth polling going back a year.""",https://www.monmouth.edu/polling-institute/reports/monmouthpoll_us_091724/,,34,2,Strict-Marsupial6141,Kamala,2024-09-25 16:04:18+00:00,0.98,/r/Kamala/comments/1fp845z/vice_president_kamala_harris_continues_to_hold/,False
1fp7eoc,Increasing support from young male voters ,https://www.reddit.com/r/Kamala/comments/1fp7eoc/increasing_support_from_young_male_voters/,"I've been thinking a lot about the disconnect between young male voters and Kamala Harris' campaign. These voters are new to politics, they may be less informed, and often they are not as wealthy as the typical Reddit user. Many among them we simply cannot reach, however the one's we can reach, have some really important characteristics:

1. They love their mothers, sisters, aunts, wives/girlfriends. The women in their lives are important to them.

2. When they hear lies like ""after birth abortion"" they don't know how to respond. They might agree in the moment just because they don't know. However, if we talk to them with empathy, they will listen.

3. They are still figuring out what what kind of men they want to be. This is going to be a long process for them.

So what can we do about it?

I think we need to remind them of that love they hold for the women in their lives. Remind them of how much they care and how far they willing to go to protect the women they care about.

As for political lies, we can keep presenting them with clear facts about abortion, women's health care, and reproductive needs. We can also work to better provide real time fact checking to political lies as they happen. Don't let the lies breathe, counter them on the spot.

As for examples, we can lean more into Tim Walz. As a veteran, husband, and father, he will appeal to their own images of themselves while demonstrating what it means to be a man who supports Kamala Harris. We can also bring in more Gen X and older men are presenting similar examples.

These men need role models, us men who support Kamala Harris can be those role models.

What do you all think?",12,8,true_enthusiast,Kamala,2024-09-25 15:35:08+00:00,0.94,/r/Kamala/comments/1fp7eoc/increasing_support_from_young_male_voters/,False
1fp78ll,Harris to More Fully Detail Economic Plans,https://www.nytimes.com/2024/09/24/us/politics/harris-economy.html,,64,9,Strict-Marsupial6141,Kamala,2024-09-25 15:27:59+00:00,0.96,/r/Kamala/comments/1fp78ll/harris_to_more_fully_detail_economic_plans/,False
1fp6wb5,U.S. Remains Committed to Israel's Security Following Weekend Attacks,https://www.defense.gov/News/News-Stories/Article/Article/3914752/us-remains-committed-to-israels-security-following-weekend-attacks/,,5,1,Strict-Marsupial6141,Kamala,2024-09-25 15:14:00+00:00,1.0,/r/Kamala/comments/1fp6wb5/us_remains_committed_to_israels_security/,False
1fp64k8,"FACT SHEET: Biden-Harris Administration Announces New Investments to Protect Freshwater Resources, Enhance Drought and Climate Resilience",https://www.whitehouse.gov/briefing-room/statements-releases/2024/09/25/fact-sheet-biden-%e2%81%a0harris-administration-announces-new-investments-to-protect-freshwater-resources-enhance-drought-and-climate-resilience/,,28,1,Strict-Marsupial6141,Kamala,2024-09-25 14:42:34+00:00,0.98,/r/Kamala/comments/1fp64k8/fact_sheet_bidenharris_administration_announces/,False
1fotk1s,Trump Cheered When Russia Hacked Hillary Clinton's Emails. Now His Embarrassing Documents Have Been Stolen by Iranian Hackers,https://www.reddit.com/r/Kamala/comments/1fotk1s/trump_cheered_when_russia_hacked_hillary_clintons/,"
https://futurism.com/donald-trump-iran-hack-hillary-clinton-russia

s/BanishTrump 

",87,1,StratHistory,Kamala,2024-09-25 02:01:22+00:00,0.99,/r/Kamala/comments/1fotk1s/trump_cheered_when_russia_hacked_hillary_clintons/,False
1foq2c0,Jennifer Lawrence endorses Harris ,https://people.com/jennifer-lawrence-endorses-kamala-harris-womens-rights-documentaries-exclusive-8717082?taid=66f2e3e4bb8dff0001658a79&utm_campaign=peoplemagazine&utm_content=new&utm_medium=social&utm_source=twitter.com,,222,5,takemusu,Kamala,2024-09-24 23:06:29+00:00,0.99,/r/Kamala/comments/1foq2c0/jennifer_lawrence_endorses_harris/,False
1fona8h,Trump's Social Media Stock Just Plummeted—And The Harris Campaign Is Trolling Him Hard,https://www.comicsands.com/harris-campaign-trump-media-stock-2669262451.html,,134,6,Blue_Wave2024,Kamala,2024-09-24 21:01:10+00:00,0.99,/r/Kamala/comments/1fona8h/trumps_social_media_stock_just_plummetedand_the/,False
1foes5w,Common Sense | Harris-Walz 2024,https://youtu.be/maV7hlF_ufQ?si=dGg2p0npOhsUHGUC,,7,1,Plus-Bluejay-2024,Kamala,2024-09-24 15:07:54+00:00,0.73,/r/Kamala/comments/1foes5w/common_sense_harriswalz_2024/,False
1foeqf2,"When you see questions about fracking or comments that a journalist ""doesn't know what Kamala plans,"" it's a trap and its disingenuous. www.freedomoverfascism.us",http://www.freedomoverfascism.us,,31,1,NotUsefulDoc,Kamala,2024-09-24 15:05:53+00:00,0.96,/r/Kamala/comments/1foeqf2/when_you_see_questions_about_fracking_or_comments/,False
1foe7c0,Kamala's opponent is the oldest nominee for president in U.S. history; he is older than the average life span of an American male.,https://i.redd.it/b4ttm1irrrqd1.jpeg,"No one wants a President J.D. Vance.
",164,31,SoCalLynda,Kamala,2024-09-24 14:43:53+00:00,0.98,/r/Kamala/comments/1foe7c0/kamalas_opponent_is_the_oldest_nominee_for/,False
1fodr43,"Teamsters representing GA, FL, AL endorse Harris-Walz!!!",https://i.redd.it/85mtub0borqd1.jpeg,,160,5,Plus-Bluejay-2024,Kamala,2024-09-24 14:24:30+00:00,0.98,/r/Kamala/comments/1fodr43/teamsters_representing_ga_fl_al_endorse_harriswalz/,False
1fodabp,The feathers are falling off this bird.,https://i.redd.it/znsryizlkrqd1.jpeg,"The orange chicken turns a cowardly yellow whenever he faces Kamala Harris.

Keep up the pressure. And, volunteer at www.KamalaHarris.com",30,2,SoCalLynda,Kamala,2024-09-24 14:03:48+00:00,0.88,/r/Kamala/comments/1fodabp/the_feathers_are_falling_off_this_bird/,False
1focgla,"Melania got paid $237,500 for speaking at a Trump fundraiser",https://www.reddit.com/r/Kamala/comments/1focgla/melania_got_paid_237500_for_speaking_at_a_trump/,No other spouse has ever been paid for helping raise money for their spouse in the history of the US.  And they won't divulge where the money came from.  The corruption just never stops.   ,127,12,ballsdeepinmywine,Kamala,2024-09-24 13:27:01+00:00,0.97,/r/Kamala/comments/1focgla/melania_got_paid_237500_for_speaking_at_a_trump/,False
1fo0dug,weakness,https://i.redd.it/2yru67fojnqd1.jpeg,,52,1,SoCalLynda,Kamala,2024-09-24 00:58:45+00:00,0.91,/r/Kamala/comments/1fo0dug/weakness/,False
1fno81m,Kamala Harris Answers The Web's Most Searched Questions | WIRED,https://youtu.be/u9-cjwpthz4?si=8PxvOa9UHcUOC26E,,22,1,JimCripe,Kamala,2024-09-23 16:09:42+00:00,0.89,/r/Kamala/comments/1fno81m/kamala_harris_answers_the_webs_most_searched/,False
1fnnspj,"Fact Check: Report on Progress Made to Reduce Gun Violence One Year After Creating White House Office of Gun Violence Prevention
",https://www.whitehouse.gov/briefing-room/statements-releases/2024/09/23/fact-sheet-preisdent-biden-and-vice-president-harris-issue-report-on-progress-made-to-reduce-gun-violence-one-year-after-creating-white-house-office-of-gun-violence-prevention/,,8,1,Strict-Marsupial6141,Kamala,2024-09-23 15:52:07+00:00,0.78,/r/Kamala/comments/1fnnspj/fact_check_report_on_progress_made_to_reduce_gun/,False
1fnkjvc,"Montana Secretary of State Christi Jacobsen left Kamala Harris' name OFF the absentee ballot! Only Trump and RFK Jr. were offered as presidential options, voting had gone live.",https://dailyinterlake.com/news/2024/sep/20/ballot-error-shuts-down-montana-online-absentee-voting-system/,,131,22,My1Thought,Kamala,2024-09-23 13:33:15+00:00,0.98,/r/Kamala/comments/1fnkjvc/montana_secretary_of_state_christi_jacobsen_left/,False
1fnhwhq,Choose Change,https://youtu.be/COTJMJRFX2w?si=h_X-Yd280kDrn5g_,"There’s two sides, but only one that represents real change in this election: Kamala Harris
 ",17,2,JimCripe,Kamala,2024-09-23 11:14:49+00:00,0.85,/r/Kamala/comments/1fnhwhq/choose_change/,False
1fneckl,What should we expect from Vance during the debate?,https://www.reddit.com/r/Kamala/comments/1fneckl/what_should_we_expect_from_vance_during_the_debate/,"A little nervous about it, as he can restrain himself-unlike Trump. I'm also trying not to underestimate him. However, I find him difficult to read.",19,40,SpiritualMedicine7,Kamala,2024-09-23 06:50:54+00:00,0.85,/r/Kamala/comments/1fneckl/what_should_we_expect_from_vance_during_the_debate/,False
1fnd2wl,San Carlos Apache Tribal Council Endorses Harris-Walz Campaign,https://nativenewsonline.net/currents/san-carlos-apache-tribal-council-endorses-harris-walz-campaign,,21,1,takemusu,Kamala,2024-09-23 05:18:55+00:00,0.84,/r/Kamala/comments/1fnd2wl/san_carlos_apache_tribal_council_endorses/,False
1fncyzb,Mark Robinson meets Martin Luther King,https://www.youtube.com/watch?v=p2wjfnsbYy8&ab_channel=randombizznis,,1,1,WillCle216,Kamala,2024-09-23 05:11:18+00:00,0.57,/r/Kamala/comments/1fncyzb/mark_robinson_meets_martin_luther_king/,False
1fn5f8p,Best Sign Ever in Pittsburgh!,https://i.redd.it/3m28wf7bsfqd1.jpeg,"Looking for a Hail Mary in November!

",107,3,lefindecheri,Kamala,2024-09-22 22:25:36+00:00,0.97,/r/Kamala/comments/1fn5f8p/best_sign_ever_in_pittsburgh/,False
1fn11yr,A NATIONAL DISGRACE,https://i.redd.it/edpswu4kn8qd1.jpeg,,92,1,SoCalLynda,Kamala,2024-09-22 19:13:42+00:00,0.97,/r/Kamala/comments/1fn11yr/a_national_disgrace/,False
1fn11a5,"At best, Trump is a false prophet; at worst, he is the Antichrist.",https://i.redd.it/nwdb5boiteqd1.jpeg,,41,8,SoCalLynda,Kamala,2024-09-22 19:12:49+00:00,0.92,/r/Kamala/comments/1fn11a5/at_best_trump_is_a_false_prophet_at_worst_he_is/,False
1fn0nyn,Biden-Harris Administration Announces $90 Million to Accelerate Building Code Adoption and Save Americans Money,https://www.energy.gov/articles/biden-harris-administration-announces-90-million-accelerate-building-code-adoption-and,,38,1,Strict-Marsupial6141,Kamala,2024-09-22 18:56:58+00:00,0.93,/r/Kamala/comments/1fn0nyn/bidenharris_administration_announces_90_million/,False
1fmxk29,Deportation Requires a Foreign Country that Is Willing to Cooperate,https://i.redd.it/i7vbom0xt8qd1.jpeg,,48,2,SoCalLynda,Kamala,2024-09-22 16:40:55+00:00,0.94,/r/Kamala/comments/1fmxk29/deportation_requires_a_foreign_country_that_is/,False
1fmx7e5,Statement from Vice President Harris on the Anniversary of the White House Office of Gun Violence Prevention,https://www.whitehouse.gov/briefing-room/statements-releases/2024/09/22/statement-from-vice-president-harris-on-the-anniversary-of-the-white-house-office-of-gun-violence-prevention/,,2,1,Strict-Marsupial6141,Kamala,2024-09-22 16:25:24+00:00,0.66,/r/Kamala/comments/1fmx7e5/statement_from_vice_president_harris_on_the/,False
1fmwhri,How ever bad you think it is…it’s worse,https://imghoster.co/7x7wJbdaHODgWd8,,7,1,RaouR,Kamala,2024-09-22 15:53:58+00:00,0.82,/r/Kamala/comments/1fmwhri/how_ever_bad_you_think_it_isits_worse/,False
1fmue28,kamalayonce 🤩,https://v.redd.it/l563ph7il1qd1,,1,1,Whole-Ad-1768,Kamala,2024-09-22 14:20:37+00:00,0.6,/r/Kamala/comments/1fmue28/kamalayonce/,False
1fmu7lg,Trump Calls MSNBC Host A 'Bimbo' After She Makes Case For Voting Against Him,https://www.huffpost.com/entry/donald-trump-stephanie-ruhle-bill-maher-bimbo_n_66e5b40fe4b0e9e4c582b6a6,,74,6,Strict-Marsupial6141,Kamala,2024-09-22 14:12:24+00:00,0.97,/r/Kamala/comments/1fmu7lg/trump_calls_msnbc_host_a_bimbo_after_she_makes/,False
1fmra1g,"Trump being horrible, as always, thinking kids are aborted after birth ",https://imghoster.co/MXD1lNWXpk48gP9,,21,5,RaouR,Kamala,2024-09-22 11:41:17+00:00,0.95,/r/Kamala/comments/1fmra1g/trump_being_horrible_as_always_thinking_kids_are/,False
1fmr5jx,The party of family values my ass,https://imghoster.co/0Zge3duRo3hCFsw,,9,1,RaouR,Kamala,2024-09-22 11:33:47+00:00,0.84,/r/Kamala/comments/1fmr5jx/the_party_of_family_values_my_ass/,False
1fmr3w9,"How much do you want to bet that Diddy is going to snitch on Trump?
",https://imghoster.co/en/9SSrEG1sL7ggKau,,156,20,RaouR,Kamala,2024-09-22 11:30:55+00:00,0.97,/r/Kamala/comments/1fmr3w9/how_much_do_you_want_to_bet_that_diddy_is_going/,False
1fmr0c6,In the event you needed more incentive to vote for Kamala Harris.,https://imghoster.co/en/aufVETOpsUzLuV5,,23,6,RaouR,Kamala,2024-09-22 11:24:39+00:00,0.96,/r/Kamala/comments/1fmr0c6/in_the_event_you_needed_more_incentive_to_vote/,False
1fmqw3m,Trump is a demented weirdo  ,https://imghoster.co/en/7NgZ3OecBrlmMQT,,12,2,RaouR,Kamala,2024-09-22 11:17:06+00:00,0.84,/r/Kamala/comments/1fmqw3m/trump_is_a_demented_weirdo/,False
1fmqun9,Dumbest president in US history ,https://imghoster.co/en/3f52Cx2ptY2aF6U,,30,1,RaouR,Kamala,2024-09-22 11:14:32+00:00,0.92,/r/Kamala/comments/1fmqun9/dumbest_president_in_us_history/,False
1fme5li,"Trump raped a 13 year old girl in 1994. Here is that girl, Katie Johnson, at the age of 35 giving a full description of what Trump did to her",https://www.youtube.com/watch?v=gnib-OORRRo,,161,11,dartie,Kamala,2024-09-21 22:04:47+00:00,0.99,/r/Kamala/comments/1fme5li/trump_raped_a_13_year_old_girl_in_1994_here_is/,False
1fmcysi,"WISCONSIN: You can request an absentee ballot and vote for presidential, Senate, House, and down-ballot candidates RIGHT NOW...",https://i.redd.it/35cjjjs098qd1.jpeg,,29,3,Plus-Bluejay-2024,Kamala,2024-09-21 21:07:31+00:00,0.91,/r/Kamala/comments/1fmcysi/wisconsin_you_can_request_an_absentee_ballot_and/,False
1fltow8,"Harris, With an Online Avalanche, Outspends Trump by Tens of Millions",https://www.nytimes.com/2024/09/20/us/politics/kamala-harris-trump-campaign-spending.html?campaign_id=9&emc=edit_nn_20240920&instance_id=134806&nl=the-morning&regi_id=53831380&segment_id=178346&te=1&user_id=fe5d662adf685ae9dedd7464c832fcdf,,109,2,Free_Swimming,Kamala,2024-09-21 03:10:59+00:00,1.0,/r/Kamala/comments/1fltow8/harris_with_an_online_avalanche_outspends_trump/,False
1flr9fh,Trump ramps up push for Nebraska to change electoral vote allocation,https://www.washingtonpost.com/politics/2024/09/20/nebraska-electoral-college-trump-omaha/,,3,1,Strict-Marsupial6141,Kamala,2024-09-21 00:53:33+00:00,1.0,/r/Kamala/comments/1flr9fh/trump_ramps_up_push_for_nebraska_to_change/,False
1flpjan,Client wanted a decal...,https://i.redd.it/0wr3z7a4t1qd1.jpeg,,55,16,Nojmore,Kamala,2024-09-20 23:25:14+00:00,0.84,/r/Kamala/comments/1flpjan/client_wanted_a_decal/,False
1flphqj,"Remarks by Vice President Harris at a Campaign Event | Atlanta, GA",https://www.whitehouse.gov/briefing-room/speeches-remarks/2024/09/20/remarks-by-vice-president-harris-at-a-campaign-event-atlanta-ga-2/,,1,1,Strict-Marsupial6141,Kamala,2024-09-20 23:22:58+00:00,1.0,/r/Kamala/comments/1flphqj/remarks_by_vice_president_harris_at_a_campaign/,False
1flmjwb,OPINION: I co-chaired Nikki Haley's Iowa campaign. I am endorsing Kamala Harris.,https://www.desmoinesregister.com/story/opinion/columnists/iowa-view/2024/09/20/republicans-for-kamala-harris-dawn-roberts-iowa-campaign-nikki-haley/75306017007/,,51,1,LadyWinterSnow22,Kamala,2024-09-20 21:04:01+00:00,0.99,/r/Kamala/comments/1flmjwb/opinion_i_cochaired_nikki_haleys_iowa_campaign_i/,False
1flkkhf,🤌🏿🤌🏿🤌🏿🤌🏿🤌🏿,https://i.redd.it/vp31hwsgo0qd1.jpeg,,170,6,Suspect118,Kamala,2024-09-20 19:37:21+00:00,0.98,/r/Kamala/comments/1flkkhf/_/,False
1fljbb7,WATCH LIVE: Harris speaks about abortion rights at Atlanta campaign rally,https://www.pbs.org/newshour/politics/watch-live-harris-speaks-about-abortion-rights-at-atlanta-campaign-rally,,28,4,Strict-Marsupial6141,Kamala,2024-09-20 18:43:12+00:00,0.95,/r/Kamala/comments/1fljbb7/watch_live_harris_speaks_about_abortion_rights_at/,False
1flio24,Swift endorsement mobilizes over 3X more voters than Biden,https://fortune.com/2024/09/20/taylor-swift-kamala-harris-joe-biden-endorsement-mobilize-voter-registration/,,183,9,Strict-Marsupial6141,Kamala,2024-09-20 18:14:53+00:00,0.99,/r/Kamala/comments/1flio24/swift_endorsement_mobilizes_over_3x_more_voters/,False
1fleb5s,"Music producer here. I've been really inspired by Kamala, her message, and her campaign, so I made some music and put this video together!",https://www.youtube.com/watch?v=MBmWZbOoPQc,,20,1,dep,Kamala,2024-09-20 15:09:13+00:00,0.92,/r/Kamala/comments/1fleb5s/music_producer_here_ive_been_really_inspired_by/,False
1flcgkk,Secretary Blinken’s Paris Meeting with Quint Representatives,https://www.state.gov/secretary-blinkens-paris-meeting-with-quint-representatives/,,2,4,Strict-Marsupial6141,Kamala,2024-09-20 13:48:41+00:00,0.75,/r/Kamala/comments/1flcgkk/secretary_blinkens_paris_meeting_with_quint/,False
