id,title,url,selftext,score,num_comments,author,subreddit,created_utc,upvote_ratio,permalink,stickied
1g9xhf5,I don't even know anymore,https://www.reddit.com/r/trump/comments/1g9xhf5/i_dont_even_know_anymore/," Watching interviews and events the past 2 weeks or so, it became absolutely clear to me that Kamala should lose. Unfortunately, libs are living too much under a rock. I was absolutely dumfounded when I learned that there are libs that don't know why he was ""creepy Joe"" or that he even had that name at all. ",3,1,jsue42,trump,2024-10-23 00:26:31+00:00,1.0,/r/trump/comments/1g9xhf5/i_dont_even_know_anymore/,False
1g9xb5k,Just voted early 🗳️ Have you?,https://i.redd.it/tlgdp9mpfewd1.png,,7,2,MasteringTheRumble,trump,2024-10-23 00:18:11+00:00,1.0,/r/trump/comments/1g9xb5k/just_voted_early_have_you/,False
1g9x9x4,Not my favorite rapper going woke smh. No em noooo,https://i.redd.it/svofh0fgfewd1.jpeg,,2,9,Smoking420_,trump,2024-10-23 00:16:33+00:00,0.67,/r/trump/comments/1g9x9x4/not_my_favorite_rapper_going_woke_smh_no_em_noooo/,False
1g9x9la,That what I like to see in my city Nevada turning red baby ,https://i.redd.it/wr52smddfewd1.jpeg,,2,1,Smoking420_,trump,2024-10-23 00:16:05+00:00,1.0,/r/trump/comments/1g9x9la/that_what_i_like_to_see_in_my_city_nevada_turning/,False
1g9w83j,How will Republicans avoid voting fraud? Will they put in hard measures to stop the cheating?,https://www.reddit.com/r/trump/comments/1g9w83j/how_will_republicans_avoid_voting_fraud_will_they/,What happen if Trump loses due to voter fraud. What will Republicans do to stop the fraud and catch it in time? I’m genuinely worried that the Demonrats will cheat their asses off again and claim a win. ,0,5,BetterWork3143,trump,2024-10-22 23:25:59+00:00,0.38,/r/trump/comments/1g9w83j/how_will_republicans_avoid_voting_fraud_will_they/,False
1g9w7j5,"Trump on Joe Rogan, this Friday",https://i.redd.it/m78r5xfa6ewd1.jpeg,Trump’s campaign schedule is blocked on Friday until 7:30pm in Michigan. He’ll likely be in Austin that morning. ,4,1,tiskrisktisk,trump,2024-10-22 23:25:11+00:00,0.83,/r/trump/comments/1g9w7j5/trump_on_joe_rogan_this_friday/,False
1g9vu99,Unlimited votes!,https://v.redd.it/u41jdf103ewd1,,3,1,MilesFassst,trump,2024-10-22 23:07:58+00:00,0.67,/r/trump/comments/1g9vu99/unlimited_votes/,False
1g9vgt6,"Hey, I am voting for Harris, but I wanted to post this here. This really upset me. Someone tore up my sign. I am super disappointed that someone would do that. We are a democracy and should treat each other kindly.",https://i.redd.it/99hg9dc60ewd1.jpeg,,0,31,FrivolousFont,trump,2024-10-22 22:50:57+00:00,0.42,/r/trump/comments/1g9vgt6/hey_i_am_voting_for_harris_but_i_wanted_to_post/,False
1g9vaek,This happened in California,https://i.redd.it/afeg0pcnydwd1.jpeg,"Guy came in to my store and after he paid said ""Don't forget to vote"" and gave me this Trump coin, we talked a bit and I told him I'm definitely voting for Trump, this is a regular occurrence, and customers are constantly complimenting my MAGA hat at work",5,1,jcornman24,trump,2024-10-22 22:42:21+00:00,0.78,/r/trump/comments/1g9vaek/this_happened_in_california/,False
1g9unuc,My Trump yard sign ,https://i.redd.it/zd11zlyhtdwd1.jpeg,This is ,87,8,Soggy-Welder2265,trump,2024-10-22 22:13:39+00:00,0.85,/r/trump/comments/1g9unuc/my_trump_yard_sign/,False
1g9ume4,SERIOUSLY??,https://i.redd.it/j15633r7tdwd1.jpeg,,3,1,rushfan2112556,trump,2024-10-22 22:11:53+00:00,1.0,/r/trump/comments/1g9ume4/seriously/,False
1g9uir3,McDoNaLdS wAs sTaGeD ,https://i.redd.it/v6idcolesdwd1.jpeg,You don’t say …,5,1,Heavy-Effect-19,trump,2024-10-22 22:07:21+00:00,0.86,/r/trump/comments/1g9uir3/mcdonalds_was_staged/,False
1g9u22w,Robert Downey Jr. says he wishes Elon Musk 'would control his behavior a little more',https://www.businessinsider.com/robert-downey-jr-wishes-elon-musk-would-control-his-behavior-2024-10,RDJ MIND YOUR FUCKING BUSINESS YOU SHOULD NOT TALK EITHER...,12,9,massapeal79,trump,2024-10-22 21:47:17+00:00,0.88,/r/trump/comments/1g9u22w/robert_downey_jr_says_he_wishes_elon_musk_would/,False
1g9twc7,For sure........ ,https://i.redd.it/u6mjqavjndwd1.jpeg,,183,9,wrevans2,trump,2024-10-22 21:40:24+00:00,0.9,/r/trump/comments/1g9twc7/for_sure/,False
1g9tkfz,VOTE DONALD TRUMP FOR PRESIDENT 2024! 🇺🇲 🐘,https://i.redd.it/07i8nyp0ldwd1.jpeg,,63,2,Fun-Kale321,trump,2024-10-22 21:25:57+00:00,0.93,/r/trump/comments/1g9tkfz/vote_donald_trump_for_president_2024/,False
1g9tal5,jd vance rally,http://www.youtube.com/watch?v=_0ghxikurjA,,9,1,fembro621,trump,2024-10-22 21:14:05+00:00,0.91,/r/trump/comments/1g9tal5/jd_vance_rally/,False
1g9sxlr,Trump on Rogan!,https://www.politico.com/live-updates/2024/10/22/2024-elections-live-coverage-updates-analysis/trump-joe-rogan-podcast-00184894,,0,1,LeoLover77,trump,2024-10-22 20:59:12+00:00,0.5,/r/trump/comments/1g9sxlr/trump_on_rogan/,False
1g9sws7,Trump on Joe Rogan!!,https://www.reddit.com/r/trump/comments/1g9sws7/trump_on_joe_rogan/,Yes!,2,1,LeoLover77,trump,2024-10-22 20:58:13+00:00,0.63,/r/trump/comments/1g9sws7/trump_on_joe_rogan/,False
1g9s8r9,Empire of Lies,https://x.com/DefiyantlyFree/status/1848394250691715108#m,,1,1,fembro621,trump,2024-10-22 20:30:00+00:00,0.57,/r/trump/comments/1g9s8r9/empire_of_lies/,False
1g9s0h2,Can’t mention God to democrats now… ,https://v.redd.it/2cuap6ya9dwd1,,22,10,MilesFassst,trump,2024-10-22 20:20:23+00:00,0.74,/r/trump/comments/1g9s0h2/cant_mention_god_to_democrats_now/,False
1g9rh29,I had to upvote lol ,https://i.redd.it/o1m9ottf5dwd1.jpeg,,4,2,Ok-Listen3715,trump,2024-10-22 19:58:46+00:00,0.64,/r/trump/comments/1g9rh29/i_had_to_upvote_lol/,False
1g9r5mn,"Donald Trump leading in majority of swing states, new poll shows",https://www.telegraph.co.uk/us/politics/2024/10/22/election-poll-trump-winning-four-seven-key-swing/,,7,2,TheTelegraph,trump,2024-10-22 19:45:41+00:00,0.77,/r/trump/comments/1g9r5mn/donald_trump_leading_in_majority_of_swing_states/,False
1g9r06p,BREAKING NEWS: TRUMP TO APPEAR ON JOE ROGAN FRIDAY 10/25,https://www.reddit.com/r/trump/comments/1g9r06p/breaking_news_trump_to_appear_on_joe_rogan_friday/,"LET’S GET IT! 

[https://www.yahoo.com/news/trump-appear-guest-joe-rogan-193131982.html](https://www.yahoo.com/news/trump-appear-guest-joe-rogan-193131982.html)
",14,1,UnicornOfAllTrades,trump,2024-10-22 19:39:18+00:00,0.82,/r/trump/comments/1g9r06p/breaking_news_trump_to_appear_on_joe_rogan_friday/,False
1g9qpji,Kamala Harris hit by fresh plagiarism allegations,https://www.telegraph.co.uk/us/politics/2024/10/22/kamala-harris-embroiled-in-second-plagiarism-row/,,0,2,TheTelegraph,trump,2024-10-22 19:27:08+00:00,0.47,/r/trump/comments/1g9qpji/kamala_harris_hit_by_fresh_plagiarism_allegations/,False
1g9qld2,TRUMPHAMMER40K,https://i.redd.it/pr8zaxczycwd1.jpeg,YOUR PRIMARCH NEEDS YOU!!!!,8,2,ChadThunderStonks,trump,2024-10-22 19:22:26+00:00,0.7,/r/trump/comments/1g9qld2/trumphammer40k/,False
1g9pzsn,"Trump Meets with Minority Leaders Amid Rising Support from Latino Voters, Poll Shows",https://m10news.com/trump-meets-with-minority-leaders-amid-rising-support-from-latino-voters-poll-shows/,,0,1,M10News,trump,2024-10-22 18:58:02+00:00,0.33,/r/trump/comments/1g9pzsn/trump_meets_with_minority_leaders_amid_rising/,False
1g9pmf2,Democrats vs Republicans,https://www.reddit.com/gallery/1g9pmf2,,2,1,fembro621,trump,2024-10-22 18:42:43+00:00,0.56,/r/trump/comments/1g9pmf2/democrats_vs_republicans/,False
1g9pfvv,Help finding a video,https://www.reddit.com/r/trump/comments/1g9pfvv/help_finding_a_video/,"First of all, I’m a major Trump supporter, so don’t think I’m trying to find this video to hate on him. It’s one of my favorite Trump videos. A reporter is asking him about a foreign leader and you can tell that Trump has no idea who they are talking about, but tries to act like he does know and it’s absolutely hilarious. If anybody knows the video I’m talking about, please attach it below. Thanks, and MAGA!",0,1,AnteaterLow4774,trump,2024-10-22 18:35:27+00:00,0.5,/r/trump/comments/1g9pfvv/help_finding_a_video/,False
1g9p80j,needed too,https://www.reddit.com/r/trump/comments/1g9p80j/needed_too/,"got a 7 day ban oin X for saying that the uk gov can suck my you know so i just had to throw it out somewhere that kamala and trudeau and kier starmer all suck 

  
the US needs to be free again and rid ourselves of these commy pigs in the west ",0,2,Prestigious_Duck_377,trump,2024-10-22 18:26:27+00:00,0.38,/r/trump/comments/1g9p80j/needed_too/,False
1g9p1tl,Early Voted. My first vote at 38 years old. Long lines of Trump voters. All different backgrounds talking about voting Trump. This is the inclusion we need. Coming together for a great cause. ,https://i.redd.it/6kxmhsbancwd1.jpeg,,14,3,BaitForWenches,trump,2024-10-22 18:19:08+00:00,0.75,/r/trump/comments/1g9p1tl/early_voted_my_first_vote_at_38_years_old_long/,False
1g9ovgc,Liberals Never Cease to Amaze Me ,https://i.redd.it/ytki9j6fmcwd1.jpeg,,106,31,Montrosaur,trump,2024-10-22 18:12:02+00:00,0.89,/r/trump/comments/1g9ovgc/liberals_never_cease_to_amaze_me/,False
1g9ojws,"As of today, October 22nd, Trump leads Harris in Georgia, Pennsylvania, Arizona, Michigan, North Carolina, and Maine’s 2nd district",https://www.reddit.com/r/trump/comments/1g9ojws/as_of_today_october_22nd_trump_leads_harris_in/,"Source : https://www.270towin.com/2024-presidential-election-polls/

This is pretty shocking at this point, as many polling sites are known to lean blue and favor democrats with polling biases. Continue to go out and vote!


Edit: For reference, Harris had a huge lead on this site (nearly 7%) in early September. ",13,2,Log2223,trump,2024-10-22 17:59:14+00:00,0.73,/r/trump/comments/1g9ojws/as_of_today_october_22nd_trump_leads_harris_in/,False
1g9o8om,Coca-cola boycott,https://i.redd.it/7heoq2sthcwd1.jpeg,,510,45,PsychSage,trump,2024-10-22 17:46:16+00:00,0.91,/r/trump/comments/1g9o8om/cocacola_boycott/,False
1g9o44c,I can’t wait until these idiots cry again. ,https://v.redd.it/7op4elgugcwd1,,20,20,bash76,trump,2024-10-22 17:40:56+00:00,0.7,/r/trump/comments/1g9o44c/i_cant_wait_until_these_idiots_cry_again/,False
1g9o0pw,"BREAKING: Voters in Tarrant County, Texas are reporting that the voting machines are flipping their votes from Trump to Kamala Harris",https://v.redd.it/wa1w8e6kgbwd1,,26,5,Blob_zombie,trump,2024-10-22 17:37:01+00:00,0.73,/r/trump/comments/1g9o0pw/breaking_voters_in_tarrant_county_texas_are/,False
1g9nudv,Vote Blue No Matter What,https://i.redd.it/vyn5dlmrecwd1.jpeg,,23,1,fembro621,trump,2024-10-22 17:29:35+00:00,0.77,/r/trump/comments/1g9nudv/vote_blue_no_matter_what/,False
1g9ntt3,ESTABLISHMENT,https://i.redd.it/mkhkwwxoecwd1.jpeg,,70,1,fembro621,trump,2024-10-22 17:28:56+00:00,0.88,/r/trump/comments/1g9ntt3/establishment/,False
1g9nq35,On oldie but a goodie,https://i.redd.it/u8dmpjrzdcwd1.jpeg,,290,11,pussy_impaler337,trump,2024-10-22 17:24:47+00:00,0.96,/r/trump/comments/1g9nq35/on_oldie_but_a_goodie/,False
1g9ng1z,Question about voting,https://www.reddit.com/r/trump/comments/1g9ng1z/question_about_voting/,"There is no one running against my current county prosecutor, so she is the only one on the ballot. Will I have to vote for her or will I be able to leave that open?",0,3,Urdaddysfavgirl,trump,2024-10-22 17:13:23+00:00,0.33,/r/trump/comments/1g9ng1z/question_about_voting/,False
1g9mls1,A great take we should all consider,https://v.redd.it/j2g9snnt5cwd1,,4,2,arandomgirludontknow,trump,2024-10-22 16:39:01+00:00,0.64,/r/trump/comments/1g9mls1/a_great_take_we_should_all_consider/,False
1g9mli2,Is Kamala Harris a DEI candidate? Tell me why or why not?,https://www.reddit.com/r/trump/comments/1g9mli2/is_kamala_harris_a_dei_candidate_tell_me_why_or/,i’m just wondering what people’s thoughts are.,26,42,GymVictim,trump,2024-10-22 16:38:39+00:00,0.75,/r/trump/comments/1g9mli2/is_kamala_harris_a_dei_candidate_tell_me_why_or/,False
1g9mhet,Standing in line getting ready to vote and it feels like 2016 again.,/r/Conservative/comments/1g9jro3/standing_in_line_getting_ready_to_vote_and_it/,,1,1,fembro621,trump,2024-10-22 16:33:55+00:00,0.55,/r/trump/comments/1g9mhet/standing_in_line_getting_ready_to_vote_and_it/,False
1g9lwc4,Do they really not realize Kamala is already failing them?,https://i.redd.it/kiyoiwyn0cwd1.jpeg,"PS just to be clear, I agree the minimum wage does need to be adjusted on occasion inflation, but these people don’t realize paying a minimum was worker an over the top increase devalues the supervisory and management roles therefor those get adjusted and the price of goods and services goes up across the board and suddenly we are back in the same damn boat!",35,7,Montrosaur,trump,2024-10-22 16:10:05+00:00,0.83,/r/trump/comments/1g9lwc4/do_they_really_not_realize_kamala_is_already/,False
1g9lj9y,Since McDonald's Ice Cream Machine is always Broke🍦,https://i.redd.it/wlyuct5zxbwd1.jpeg,,7,2,Verdigris101,trump,2024-10-22 15:55:06+00:00,0.65,/r/trump/comments/1g9lj9y/since_mcdonalds_ice_cream_machine_is_always_broke/,False
1g9li48,Central Park 5 Sue Donald Trump for Defamation ,https://www.reddit.com/r/trump/comments/1g9li48/central_park_5_sue_donald_trump_for_defamation/,"# [Central Park 5 Sue Donald Trump for Defamation](https://www.verity.news/story/2024/central-park-sue-donald-trump-for-defamation?p=re2908)

# The Facts

* The members of the Central Park Five — whose conviction of the 1989 rape of a woman in Central Park, NYC, was overturned in 2002 — are suing former US Pres. Donald Trump over comments made during the Sept. 10 presidential debate.[\[1\]](https://thehill.com/regulation/court-battles/4944619-central-park-five-sue-trump-defamation/)[\[2\]](https://www.nbcnews.com/news/us-news/exonerated-central-park-five-sue-trump-defamation-debate-comments-rcna176403)
* During the debate, Democratic presidential candidate Kamala Harris alluded to how Trump ""took out a full-page ad in the New York Times calling for the execution of five young black and Latino boys,"" referring to his public response to the crime at the time.[\[3\]](https://nypost.com/2024/10/21/us-news/central-park-five-sue-trump-charging-false-and-defamatory-statements-during-debate/)
* Responding to Harris, Trump argued: ""They admitted — they said, they pled guilty. And I said, well, if they pled guilty they badly hurt a person, killed a person ultimately.""[\[4\]](https://www.washingtonpost.com/national-security/2024/10/21/trump-central-park-five-lawsuit/)
* The lawsuit — filed by Korey Wise, Yusef Salaam, Raymond Santana, Kevin Richardson, and Antron McCray — claims the statements were ""false and defamatory,"" arguing that they ""never pled guilty"" and that ""none of the victims of the Central Park assaults were killed.""[\[5\]](https://www.newsmax.com/newsfront/central-park-five-sue-trump/2024/10/21/id/1184875/)[\[6\]](https://www.nytimes.com/2024/10/21/nyregion/trump-central-park-five-defamation-lawsuit.html)
* Trump campaign spokesman Steven Cheung referred to the lawsuit — which seeks $225K in damages — as a further incident of ""frivolous Election Interference.""[\[3\]](https://nypost.com/2024/10/21/us-news/central-park-five-sue-trump-charging-false-and-defamatory-statements-during-debate/)
* This comes after the five, whose convictions were eventually overturned on the basis of DNA evidence, reached a $41M settlement with NYC in 2014 over their wrongful imprisonment.[\[4\]](https://www.washingtonpost.com/national-security/2024/10/21/trump-central-park-five-lawsuit/)

# Sources

[\[1\] The Hill](https://thehill.com/regulation/court-battles/4944619-central-park-five-sue-trump-defamation/)

[\[2\] NBC](https://www.nbcnews.com/news/us-news/exonerated-central-park-five-sue-trump-defamation-debate-comments-rcna176403)

[\[3\] New York Post](https://nypost.com/2024/10/21/us-news/central-park-five-sue-trump-charging-false-and-defamatory-statements-during-debate/)

[\[4\] Washington Post](https://www.washingtonpost.com/national-security/2024/10/21/trump-central-park-five-lawsuit/)

[\[5\] Newsmax](https://www.newsmax.com/newsfront/central-park-five-sue-trump/2024/10/21/id/1184875/)

[\[6\] New York Times](https://www.nytimes.com/2024/10/21/nyregion/trump-central-park-five-defamation-lawsuit.html)

The Spin

Left narrative

Donald Trump has made openly racist comments for decades, ranging from his response to the original Central Park 5 arrests to this more recent debate with Harris. Not only were these men wrongfully arrested, put behind bars, and smeared by figures like Trump in 1989, but they continue to face false accusations today. If he wishes to continue defaming innocent people, he must face the consequences in court.

Right narrative

Trump never mentioned the race of the Central Park Five 1989, and he, like the rest of the public, was under the impression that they were guilty. Misspeaking about a group of men who happen to be Black doesn't make someone racist. Even though the media know this, they'll continue to smear Trump so as to achieve their real goal: stopping him and his policies on crime prevention from getting back to the White House.





",1,1,DeepDreamerX,trump,2024-10-22 15:53:41+00:00,0.56,/r/trump/comments/1g9li48/central_park_5_sue_donald_trump_for_defamation/,False
1g9lhsz,Propaganda now 🤦‍♂️,https://i.redd.it/6804nn7oxbwd1.jpeg,,63,25,tomuglycruise,trump,2024-10-22 15:53:19+00:00,0.83,/r/trump/comments/1g9lhsz/propaganda_now/,False
1g9lbsy,To all my fellow Retirees and Veterans ,https://i.redd.it/y2ispozfwbwd1.jpeg,,110,4,XenephobeX,trump,2024-10-22 15:46:26+00:00,0.88,/r/trump/comments/1g9lbsy/to_all_my_fellow_retirees_and_veterans/,False
1g9l6ej,Early voting numbers for FL,https://i.redd.it/ghwa1pcbvbwd1.jpeg,More Dems voted by mail so far. More Republicans voted early. ,2,1,Montrosaur,trump,2024-10-22 15:40:06+00:00,0.62,/r/trump/comments/1g9l6ej/early_voting_numbers_for_fl/,False
1g9kams,"Kamala puts up Townhall. Gets told to questioner that there are no asking questions and all pre selected. She is fake, just waiting when this puppets nose grows.",https://v.redd.it/00cxr1gpobwd1,,113,11,I_will_delete_myself,trump,2024-10-22 15:03:08+00:00,0.87,/r/trump/comments/1g9kams/kamala_puts_up_townhall_gets_told_to_questioner/,False
1g9k5wy,"Donald Trump given McDonald's award in hurricane-""obliterated town""",https://www.newsweek.com/donald-trump-given-mcdonalds-award-hurricane-obliterated-town-1972841,,16,2,newsweek,trump,2024-10-22 14:57:57+00:00,0.71,/r/trump/comments/1g9k5wy/donald_trump_given_mcdonalds_award_in/,False
1g9jzm0,This reeks of desperation.,https://youtu.be/6bTpbDL5dcg?si=PcfUTMQq055eB00y,,0,4,SgtMajRom,trump,2024-10-22 14:50:30+00:00,0.33,/r/trump/comments/1g9jzm0/this_reeks_of_desperation/,False
1g9jfdm,This Post. ,https://i.redd.it/ixjcr515ibwd1.jpeg,I commented Go Trump! 🇺🇸 and I’m sure it’s going to get downvoted to hell. But I don’t care I want to voice my voice for Trump any chance I get!!,1,3,Mod3stacks,trump,2024-10-22 14:26:17+00:00,0.55,/r/trump/comments/1g9jfdm/this_post/,False
1g9jbur,TOO BIG TO RIG!,https://v.redd.it/xxx5nef9hbwd1,,182,10,Succulent_libtears,trump,2024-10-22 14:21:57+00:00,0.94,/r/trump/comments/1g9jbur/too_big_to_rig/,True
1g9j92p,"BREAKING: Voters in Tarrant County, Texas are reporting that the voting machines are flipping their votes from Trump to Kamala Harris",https://v.redd.it/ik7ptijrgbwd1,,490,136,RiyaSharma777,trump,2024-10-22 14:18:38+00:00,0.86,/r/trump/comments/1g9j92p/breaking_voters_in_tarrant_county_texas_are/,False
1g9ixe5,Behind the scenes with Trump at McDonalds,https://v.redd.it/i0xwndt7ebwd1,It's still funny,6,6,CornPopsBadBoys,trump,2024-10-22 14:04:17+00:00,0.6,/r/trump/comments/1g9ixe5/behind_the_scenes_with_trump_at_mcdonalds/,False
1g9io4h,Thoughts?,https://v.redd.it/flblw871n9wd1,,0,1,SgtMajRom,trump,2024-10-22 13:53:08+00:00,0.5,/r/trump/comments/1g9io4h/thoughts/,False
1g9hv1y,Spot the Difference: Kamala Harris or McDonald’s Employee?,https://getwokeup.com/?p=16054&fsp_sid=1425,,0,1,gratefulbobby,trump,2024-10-22 13:15:20+00:00,0.25,/r/trump/comments/1g9hv1y/spot_the_difference_kamala_harris_or_mcdonalds/,False
1g9hewg,Found this classic from the_donald in 2016,https://i.redd.it/hgpzdvxi1bwd1.jpeg,,73,6,svalbard32,trump,2024-10-22 12:53:48+00:00,0.87,/r/trump/comments/1g9hewg/found_this_classic_from_the_donald_in_2016/,False
1g9hbcs,Are Trump's Tit for Tat Tariffs justified?,https://www.reddit.com/r/trump/comments/1g9hbcs/are_trumps_tit_for_tat_tariffs_justified/,"The alliterative question of the day
",0,4,ZestycloseAd7528,trump,2024-10-22 12:48:45+00:00,0.43,/r/trump/comments/1g9hbcs/are_trumps_tit_for_tat_tariffs_justified/,False
1g9grb5,My thoughts about kamala… ,https://v.redd.it/vi32i5zivawd1,,311,63,None,trump,2024-10-22 12:19:35+00:00,0.82,/r/trump/comments/1g9grb5/my_thoughts_about_kamala/,False
1g9fxgt,Just early voted for Trump! My first election.,https://www.reddit.com/r/trump/comments/1g9fxgt/just_early_voted_for_trump_my_first_election/,"First election, voted straight R (except for unopposed democrat judges). I voted for Trump in the primary. Harris County, TX",380,37,putoriuse,trump,2024-10-22 11:34:51+00:00,0.92,/r/trump/comments/1g9fxgt/just_early_voted_for_trump_my_first_election/,False
1g9emar,"just made a fun song for trump ""Frying up the Lies""",https://www.reddit.com/r/trump/comments/1g9emar/just_made_a_fun_song_for_trump_frying_up_the_lies/,"https://reddit.com/link/1g9emar/video/jl7nfwme8awd1/player

",0,4,Smurgels,trump,2024-10-22 10:10:22+00:00,0.33,/r/trump/comments/1g9emar/just_made_a_fun_song_for_trump_frying_up_the_lies/,False
1g9eh82,Voting for Kamala is quite literally going against God. Here’s why. ,https://v.redd.it/h1nj1sas6awd1,"I saw this Tik Tok video posted to X and was mind blown!!!!

Being a Democrat could very likely or literally land you in hell if it exists. If Kamala is not the Antichrist herself, she is 100% an incarnate of a demonic form. 

As someone who lives in Los Angeles, I can 100% confirm to you that Hollywood is fully satanic. Everyone knows someone with a personal story with firsthand experience as either a witness or someone who briefly got sucked in. It’s something you harshly realize when you move here. They have ritualistic parties, practice dark crafts, and offer themselves to the devil. 

I’m telling you that shit is so real! Satanic practice is as real in Los Angeles, especially within the elite circles, as voodoo is in New Orleans. It’s not a secret to people here. So anyone that’s been theorizing and/or suspecting of this, you are correct. 

Also take note of how Hollywood is hardcore left. If you sell your soul, you have to follow the evil or else your career and reputation will be destroyed. It’s why you see people like Usher who was associated with Diddy singing at Kamala’s rally. 

When an upcoming celebrity wants to rise rapidly to fame, one of the initiation rituals into giving their life to darkness is releasing music regarding the devil, and selling their soul to him. Take Lil Nas for example. Or Doja Cat. 

One thing that is described about the end of times is that evil will be seen as good, and good will be seen as evil. If we fail to understand the truth and choose the right path, this is it. It’s why you suddenly have Elon Musk, a heavily scientific mind, talking about God.

This is not just an election that could determine the fate of humanity, but the true deeper root behind it is the great spiritual war.

I have so many chills writing this. 

You may not like Elon Musk (I do), but he is someone who was notoriously left and his 3 goals in life have always been, 1) To expand human consciousness and get humans to mars; 2) transform earth into a planet that uses sustainable energy; and 3) make robots and AI safe for its future in our society. 
^^^ so for him *specifically* to suddenly come out of the woodworks blaring red alarms, waving hundreds of red flags, and giving warnings that Trump losing will be the end of humanity, you would have to be stupid not to sit down and really think wit the fuck this is happening.

I can confidently tell you that no man, even a billionaire is going to pull this level of humanity ending warning stuff over fucking taxes, especially come *literally* out of left field for it.😂 He’s a genius with 1000 other ways he could persuade the public to vote one way if he had that vendetta, but it’s super clear that reasons within those lines simply don’t exist within his motives behind his campaign for Trump. Sure he agrees with republican tax policies but if we’re talking about the reasons behind his repeated warnings, that ain’t it. 

I’m not religious by any means, but knowing what I do, even I can attest to this shit. It’s real. All of it. It’s in front of everyone’s face. 

Remember, Kamala just told someone who said “Jesus is King” that they are at the wrong rally. 

Had I not moved to Los Angeles, I wouldn’t have as many chills writing this as I do, and I absolutely had to share this video because it confirmed everything. ",202,29,SonicDooscar,trump,2024-10-22 10:00:50+00:00,0.85,/r/trump/comments/1g9eh82/voting_for_kamala_is_quite_literally_going/,False
1g9edvc,Kamala Voters,https://i.redd.it/22ed9hdi5awd1.jpeg,If they don’t go back we’re Venezuela 2.0 ,81,3,Alligator-creep,trump,2024-10-22 09:53:42+00:00,0.88,/r/trump/comments/1g9edvc/kamala_voters/,False
1g9c8kw,Why are the fascists calling Trump fascist?,http://www.youtube.com/watch?v=5Zs099E7g9c,,15,2,fembro621,trump,2024-10-22 07:09:04+00:00,0.76,/r/trump/comments/1g9c8kw/why_are_the_fascists_calling_trump_fascist/,False
