id,title,url,selftext,score,num_comments,author,subreddit,created_utc,upvote_ratio,permalink,stickied
1g7zm6d,And old friend ditched me over my support for Trump!,https://www.reddit.com/r/trump/comments/1g7zm6d/and_old_friend_ditched_me_over_my_support_for/,"I tried contacting an old friend today. We have not spoken to each other in a decade. She right off the bat asked me about what I thought about Trump. I was not looking to get into politics right away. We have always been on opposite sides, me being Libertarian, and see an avowed Socialist.

I would like to think that I can be friends with anyone, regards of political affiliation. That used to be the case, but not anymore.

The leftist media has been very busy spreading vicious lies about Trump. Early on I checked out every claim they made and have found them to be FALSE. EVERY SINGLE ONE.

So I support Trump. I want to see Trump win in 2024, and will be sending in my ballot shortly. And if someone wants to defriend me for my support, so be it.

Trump 2024.

===============================

I decided to post my former friend's response here. To say this is vitriolic is the understatement of the millennium. Prepare yourself for a peek into the mind of someone thunderstruck with TDS. It is not pretty.

>*I honestly can't speak to you anymore. Trump is slime, a con artist, a rapist, and a traitor who licks Putin's ass. Anyone who loves him is also a traitor and deeply stupid for falling for his act.*

  
She knows me better than this. She knows that I am hyper-rational, critical thinker who checks things out.

>*He has outright told us he plans to replace all non-partisans working in government with loyalists and that he'll be a dictator on day one.*

Trump never said that, of course. And all presidents tend to replace people in the bureaucracy with their friends. Nothing new there.

>*His cultists are warming to the idea, and are now saying it's time for us to have a dictator. He loves Hitler, and wants to be the next one.*

I truly don´t know where she gets this stuff from. She was not this bad 10 years ago.

>*And if you think anyone with your skin color will be safe in his America, you are sadly mistaken. He says he plans to round up not just illegal, but also legal immigrants in internment camps,*

Oh, right into the Race FUDding crap. Probably because more blacks than ever support Trump. But she is buying this rhetoric hook, line, and sinker. She is not the same person I knew.

>*and calls all non-white countries ""shithole countries,"" so good luck getting your wife over here.*

I married a girl in Colombia, and will have no problems with that if we decide to do that. I know the procedure, as I did it once before. But my wife doesn´t really want to live in the US anyway. Europe would be a better choice, overall, for a number of reasons. But that's not something I will discuss here. And he never said that all ""non-white"" countries are shitholes.

>*He'll make sure all women's bodies are state-owned property, and under him, not only will abortion be illegal, but so will birth control for women. I'm sorry, but goodbye.*

My word. This sounds like it was ripped right of of Kamala's playbook.

There is no way to reason with that. TDS big time. And not worth my time at all. All lies, propaganda, and spin-doctoring. Now that I've had the chance to go over what she said more closely, the feeling is mutual. Not my friend. Good riddance. Yuck. Pig poo for brains.",99,89,el_toro_2022,trump,2024-10-20 14:12:52+00:00,0.8,/r/trump/comments/1g7zm6d/and_old_friend_ditched_me_over_my_support_for/,False
1g7z35u,"Lizzo said ""if Kamala is elected the whole country will look like Detroit."" ..  Do you want our WHOLE country to look like this?",https://v.redd.it/4zvjfz6f1xvd1,,239,46,RiyaSharma777,trump,2024-10-20 13:47:41+00:00,0.89,/r/trump/comments/1g7z35u/lizzo_said_if_kamala_is_elected_the_whole_country/,False
1g7y5j6,Couldn’t help myself 🤣,https://i.redd.it/xwblrl41twvd1.jpeg,,142,5,AmSirenProductions,trump,2024-10-20 13:00:38+00:00,0.89,/r/trump/comments/1g7y5j6/couldnt_help_myself/,False
1g7wql6,Dumbasses,https://i.redd.it/4bqbn2392tvd1.jpeg,,2,1,hidakii_chan,trump,2024-10-20 11:39:04+00:00,0.57,/r/trump/comments/1g7wql6/dumbasses/,False
1g7vqw8,"Trump, bring Trump ❤️",https://v.redd.it/eq1h01obilvd1,,0,1,Interesting_Cook209,trump,2024-10-20 10:31:36+00:00,0.33,/r/trump/comments/1g7vqw8/trump_bring_trump/,False
1g7vohb,I think the comment section are a bunch of leftist ,https://i.redd.it/lkopgszadrvd1.jpeg,,176,35,Sudden-Soil39,trump,2024-10-20 10:26:45+00:00,0.9,/r/trump/comments/1g7vohb/i_think_the_comment_section_are_a_bunch_of_leftist/,False
1g7v6md,And the Kamala sign people say they're brave,https://theohiostar.com/news/voters-in-pennsylvania-receive-threatening-letters-warning-there-will-be-consequences-for-supporting-trump/agreat/2024/10/19/,,0,1,fembro621,trump,2024-10-20 09:50:19+00:00,0.3,/r/trump/comments/1g7v6md/and_the_kamala_sign_people_say_theyre_brave/,False
1g7umo4,Lefties Can’t Take What They Dish Out,https://i.redd.it/wlf5d1tjnvvd1.jpeg,Apparently I need to learn how to “be competent at the internet” lol,116,21,Montrosaur,trump,2024-10-20 09:08:04+00:00,0.89,/r/trump/comments/1g7umo4/lefties_cant_take_what_they_dish_out/,False
1g7sy93,Jewish Scientist Proposes Cure for What He Calls the “Parasitic Condi…,https://archive.ph/XaOhE,,0,1,Accurate-gawd-9763,trump,2024-10-20 06:58:39+00:00,0.38,/r/trump/comments/1g7sy93/jewish_scientist_proposes_cure_for_what_he_calls/,False
1g7sp74,Anyone else feel like this is fake? Like… it feels more like people who are dressed up and claiming to be Trump supporters for a video.,https://v.redd.it/3h5067svusvd1,,20,22,onestubbornlass,trump,2024-10-20 06:41:09+00:00,0.73,/r/trump/comments/1g7sp74/anyone_else_feel_like_this_is_fake_like_it_feels/,False
1g7s0w9,Been a few years since I’ve seen good will hunting didn’t remember these cameos ,https://v.redd.it/81i6u7odouvd1,,0,2,Scottroofwalker,trump,2024-10-20 05:51:15+00:00,0.5,/r/trump/comments/1g7s0w9/been_a_few_years_since_ive_seen_good_will_hunting/,False
1g7s051,YouTube Channels that Have Been BANNED for ‘Hate Speech’ and Where to…,https://archive.ph/tX2B4,,0,1,Accurate-gawd-9763,trump,2024-10-20 05:49:46+00:00,0.33,/r/trump/comments/1g7s051/youtube_channels_that_have_been_banned_for_hate/,False
1g7rwdg,The state of reddit ,https://i.redd.it/z0r382ytmuvd1.jpeg,,482,80,shadowclient,trump,2024-10-20 05:42:16+00:00,0.9,/r/trump/comments/1g7rwdg/the_state_of_reddit/,False
1g7rs16,"I got in a few words against the abortion echo chamber. Don’t give up on free speech yet, we can end censorship with this election.",https://i.redd.it/7ee6dxx9luvd1.jpeg,,0,4,backintow3rs,trump,2024-10-20 05:33:32+00:00,0.25,/r/trump/comments/1g7rs16/i_got_in_a_few_words_against_the_abortion_echo/,False
1g7pnth,Thoughts on Polymarket,https://i.redd.it/rendpc5pwtvd1.jpeg,"Thoughts on this gap?

Polls looking good for trump too. Curious how others see this gap!",0,9,JoshKosh55,trump,2024-10-20 03:15:47+00:00,0.45,/r/trump/comments/1g7pnth/thoughts_on_polymarket/,False
1g7p9bw,Ayye Macarena Trump 2024🇺🇸,https://v.redd.it/gm3h05lbstvd1,Trumps ahead ,50,4,ASinful_Christian,trump,2024-10-20 02:51:15+00:00,0.81,/r/trump/comments/1g7p9bw/ayye_macarena_trump_2024/,False
1g7oxpn,Pennsylvania,https://i.redd.it/88wl1o9sotvd1.jpeg,"I live in Pennsylvania, the people have spoken. ",747,48,luvloping,trump,2024-10-20 02:31:26+00:00,0.91,/r/trump/comments/1g7oxpn/pennsylvania/,False
1g7ov1m,"Kamala and Trump both just had events in Detroit, Michigan. Here they are juxtaposed in 50x speed. Tell me again which candidate is “exhausted.”",https://v.redd.it/3exvvanuntvd1,,298,38,deepegg,trump,2024-10-20 02:27:05+00:00,0.91,/r/trump/comments/1g7ov1m/kamala_and_trump_both_just_had_events_in_detroit/,False
1g7ohpa,North Korea Sending Troops To Aid Russia In Ukraine War: South’s Spy Agency,https://www.reddit.com/r/trump/comments/1g7ohpa/north_korea_sending_troops_to_aid_russia_in/,Russia saving there body's weapons for real war now...North Korea has bodies and weapons waste... And North Korea gets stuff from Russia.,0,2,massapeal79,trump,2024-10-20 02:06:01+00:00,0.4,/r/trump/comments/1g7ohpa/north_korea_sending_troops_to_aid_russia_in/,False
1g7ocuj,RUNNING WITH THE DEVIL - And It’s Not Van Halen! Total BULLSH*T,https://www.youtube.com/live/ROhEUBOqU5E,,0,1,swrncpete,trump,2024-10-20 01:58:37+00:00,0.33,/r/trump/comments/1g7ocuj/running_with_the_devil_and_its_not_van_halen/,False
1g7np1p,Scariest Halloween decoration I’ve seen so far in my deep blue Maryland neighborhood,https://i.redd.it/qo18fh75ctvd1.jpeg,https://cdn11.bigcommerce.com/s-9i278zd3bm/images/stencil/1280x1280/products/520/1592/harris-walz_yardSing_sideA-url__51262.1723139069.png?c=1,81,10,GregaslayYT,trump,2024-10-20 01:20:34+00:00,0.88,/r/trump/comments/1g7np1p/scariest_halloween_decoration_ive_seen_so_far_in/,False
1g7nogt,Just helped my elderly in-laws get mail in ballot,https://www.reddit.com/r/trump/comments/1g7nogt/just_helped_my_elderly_inlaws_get_mail_in_ballot/,"They are too old to vote regular so I got them ballot and helped them fill it out.  They are going Trump and straight line GOP.  

Please help anyone you know to vote. Many people don’t vote but if you help them they will.

I just can’t stand the hatred for Trump and the weaponization of the courts.  Democrats need to pay for this.",8,4,Nearing_retirement,trump,2024-10-20 01:19:40+00:00,0.68,/r/trump/comments/1g7nogt/just_helped_my_elderly_inlaws_get_mail_in_ballot/,False
1g7mtvf,Is there any result data from the early voting yet? Or do we not hear those numbers until Election Day?,https://www.reddit.com/r/trump/comments/1g7mtvf/is_there_any_result_data_from_the_early_voting/,Hdhdh,0,5,jp_trev,trump,2024-10-20 00:33:01+00:00,0.5,/r/trump/comments/1g7mtvf/is_there_any_result_data_from_the_early_voting/,False
1g7m1mp,The Amish ,https://v.redd.it/r5oikst7wsvd1,,518,11,BobbyABooey,trump,2024-10-19 23:51:18+00:00,0.94,/r/trump/comments/1g7m1mp/the_amish/,False
1g7lxxp,If you’re voting TRUMP CHECK THIS OUT!!!,https://www.instagram.com/reel/DBUwPexSWi4/?igsh=MTJldmpmMDdjcDQwcQ==,,0,1,snowflakerepellent,trump,2024-10-19 23:45:43+00:00,0.43,/r/trump/comments/1g7lxxp/if_youre_voting_trump_check_this_out/,False
1g7lu84,Living Free on the Water for Decades - Now Forced to Shore,https://youtu.be/L_4o2DIl7TA?si=z-XZfumqUnWmw6pD,Please share to make the government to leave these people alone...,0,3,massapeal79,trump,2024-10-19 23:40:20+00:00,0.44,/r/trump/comments/1g7lu84/living_free_on_the_water_for_decades_now_forced/,False
1g7l6vh,Are you really going to vote for this woman?,https://i.redd.it/lzi95lzrosvd1.jpeg,,360,260,PsychSage,trump,2024-10-19 23:09:36+00:00,0.82,/r/trump/comments/1g7l6vh/are_you_really_going_to_vote_for_this_woman/,False
1g7ky45,Times are tough for Kamala Harris,https://i.redd.it/fvbuemthmsvd1.jpeg,,36,0,Succulent_libtears,trump,2024-10-19 22:57:17+00:00,0.87,/r/trump/comments/1g7ky45/times_are_tough_for_kamala_harris/,False
1g7kt76,How are black people not offended by this??,https://i.redd.it/0j2nm7mblsvd1.jpeg,I would assume most Americans would agree that drug use is a barrier to a lot of things in life including being successful... But she acts like not being able to smoke weed is what's holding black men back! I know plenty of successful black men.. and guess what.. none of them smoke weed. ,92,43,Livid-Advantage-8268,trump,2024-10-19 22:50:14+00:00,0.89,/r/trump/comments/1g7kt76/how_are_black_people_not_offended_by_this/,False
1g7ksyw,Can she beat her all time record?,https://i.redd.it/eoum9q54isvd1.jpeg,,20,1,DeusRegnat,trump,2024-10-19 22:49:54+00:00,0.8,/r/trump/comments/1g7ksyw/can_she_beat_her_all_time_record/,False
1g7kqw2,Another deranged libtard,https://i.redd.it/gy7szfnpksvd1.jpeg,,12,4,Parking_Aerie_2054,trump,2024-10-19 22:46:49+00:00,0.7,/r/trump/comments/1g7kqw2/another_deranged_libtard/,False
1g7k63u,So true!!,https://i.redd.it/saodfcxgfsvd1.jpeg,,495,20,atendler1,trump,2024-10-19 22:17:26+00:00,0.92,/r/trump/comments/1g7k63u/so_true/,False
1g7jefd,Walz Ducks for Cover,https://i.redd.it/cx4gwdjs8svd1.jpeg,,7,1,jjsupc,trump,2024-10-19 21:40:01+00:00,0.73,/r/trump/comments/1g7jefd/walz_ducks_for_cover/,False
1g7inzp,Millennials at it again,https://i.redd.it/eii1571d2svd1.jpeg,,258,60,Parking_Aerie_2054,trump,2024-10-19 21:04:01+00:00,0.88,/r/trump/comments/1g7inzp/millennials_at_it_again/,False
1g7i9no,Their bravery is gonna cause us high groceries and men in women's bathroom 😅😅,https://i.redd.it/oifm6021zrvd1.jpeg,,314,71,father_ofthe_wolf,trump,2024-10-19 20:45:17+00:00,0.85,/r/trump/comments/1g7i9no/their_bravery_is_gonna_cause_us_high_groceries/,False
1g7hx7m,Democrats sending threats to people who vote for Trump in PA,https://v.redd.it/bnte775hvrvd1,,4,6,Alligator-creep,trump,2024-10-19 20:28:47+00:00,0.6,/r/trump/comments/1g7hx7m/democrats_sending_threats_to_people_who_vote_for/,False
1g7hh5x,Swing states- We need you! ,https://www.reddit.com/r/trump/comments/1g7hh5x/swing_states_we_need_you/,Lets go!!,0,1,Dezze82,trump,2024-10-19 20:07:39+00:00,0.5,/r/trump/comments/1g7hh5x/swing_states_we_need_you/,False
1g7h4cq,Madison Square Garden rally: When to get in line?,https://www.reddit.com/r/trump/comments/1g7h4cq/madison_square_garden_rally_when_to_get_in_line/,"For the Oct 27 rally at MSG, when will the line start forming? Never been to an event at MSG so can’t even imagine what the setup would be. ",3,3,chilanvilla,trump,2024-10-19 19:51:31+00:00,0.64,/r/trump/comments/1g7h4cq/madison_square_garden_rally_when_to_get_in_line/,False
1g7ffwf,License plate modification in Alabama,https://i.redd.it/0w54q3klbrvd1.jpeg,,19,4,President_Zucchini,trump,2024-10-19 18:33:58+00:00,0.77,/r/trump/comments/1g7ffwf/license_plate_modification_in_alabama/,False
1g7f31t,WWE Legend The Undertaker Teams Up with Donald Trump to Urge Voters: ‘Choose Wisely’,https://m10news.com/wwe-legend-the-undertaker-teams-up-with-donald-trump-to-urge-voters-choose-wisely/,,6,1,M10News,trump,2024-10-19 18:17:34+00:00,0.71,/r/trump/comments/1g7f31t/wwe_legend_the_undertaker_teams_up_with_donald/,False
1g7eo1p,The left seriously thinks the media is running cover for Trump,https://i.imgflip.com/978kd6.jpg,,121,48,jcornman24,trump,2024-10-19 17:58:35+00:00,0.83,/r/trump/comments/1g7eo1p/the_left_seriously_thinks_the_media_is_running/,False
1g7e5hg,Y’all ever played the video game ‘We Happy Few’ ,https://v.redd.it/h7j3vgd21rvd1,"‘We Happy Few’ is a video game Taking place within the retro-futuristic version of the mid-1960s, following an alternative version of World War II, players take control over one of three characters, each of whom seek to complete a personal task while escaping the fictional city of Wellington Wells – a crumbling dystopia on the verge of societal collapse, due to the overuse of a hallucinogenic drug that keeps its inhabitants blissfully unaware about the truth of their world, while leaving them easily manipulated and lacking morals.
This hallucinogenic drug is called ‘Joy’. People were forced to take Joy so they wouldn’t remember anything the government did and they would forget the war. 
Not a conspiracy theorist, just something I noticed and was wondering if anyone else did. ",53,34,tattedcatluver__,trump,2024-10-19 17:34:56+00:00,0.83,/r/trump/comments/1g7e5hg/yall_ever_played_the_video_game_we_happy_few/,False
1g7e4g9,Can you feel it? The vibe has shifted.,https://youtu.be/nPKRkBI7Uto?si=YUeG84cYnXwFcwU5,,2,1,deepegg,trump,2024-10-19 17:33:42+00:00,0.58,/r/trump/comments/1g7e4g9/can_you_feel_it_the_vibe_has_shifted/,False
1g7dvfj,Republicans are winning the Georgia early vote right now (This NEVER happens). VOTE EARLY! TOO BIG TO RIG!,https://i.redd.it/tgs59yhpyqvd1.jpeg,,73,20,deepegg,trump,2024-10-19 17:22:23+00:00,0.93,/r/trump/comments/1g7dvfj/republicans_are_winning_the_georgia_early_vote/,False
1g7du27,Daily reminder that you and everyone you know saw a miracle. Never forget this.,https://v.redd.it/babjlsmfyqvd1,,398,42,deepegg,trump,2024-10-19 17:20:40+00:00,0.91,/r/trump/comments/1g7du27/daily_reminder_that_you_and_everyone_you_know_saw/,False
1g7drbw,Kamala at Fox interview,https://i.redd.it/rau5niqxxqvd1.jpeg,,113,3,PsychSage,trump,2024-10-19 17:17:23+00:00,0.87,/r/trump/comments/1g7drbw/kamala_at_fox_interview/,False
1g7dns6,"There are 3 states where Trump's team believe he is already on track to win. ""At this point, you can't say that about any of the blue wall states for Harris."" -- TOO BIG TO RIG. IF YOU CAN VOTE EARLY, BANK YOUR VOTE!",https://v.redd.it/tpx79gknwqvd1,,16,6,deepegg,trump,2024-10-19 17:13:27+00:00,0.8,/r/trump/comments/1g7dns6/there_are_3_states_where_trumps_team_believe_he/,False
1g7dklv,Street Wear Sticker ,https://i.redd.it/pckycou5qlvd1.jpeg,,0,4,ZS_1174,trump,2024-10-19 17:09:24+00:00,0.4,/r/trump/comments/1g7dklv/street_wear_sticker/,False
1g7d0zc,Even 538 shows trump is likely to win,https://i.redd.it/21huy0o0sqvd1.png,,50,17,HedgefundHunter,trump,2024-10-19 16:44:13+00:00,0.87,/r/trump/comments/1g7d0zc/even_538_shows_trump_is_likely_to_win/,False
1g7cxec,She will just keep blaming Trump,https://v.redd.it/nxxpdjhkjqvd1,,144,8,Succulent_libtears,trump,2024-10-19 16:39:41+00:00,0.89,/r/trump/comments/1g7cxec/she_will_just_keep_blaming_trump/,False
1g7ck1a,Latest,https://tatobin4.wixsite.com/theredpill/single-post/2024-trump-rallies,,0,1,SavageOldBastard,trump,2024-10-19 16:22:32+00:00,0.44,/r/trump/comments/1g7ck1a/latest/,False
1g7byk6,I need a status update on Donald Trump winning the '24 election,https://www.reddit.com/r/trump/comments/1g7byk6/i_need_a_status_update_on_donald_trump_winning/,"I've been so busy with work -- 2 jobs & doing overtime -- because of how crazy inflation has been and haven't been able to catch up with the news

What's going on with a few weeks before the election? Is Trump going to win?",4,12,borat_he_like_you,trump,2024-10-19 15:55:28+00:00,0.61,/r/trump/comments/1g7byk6/i_need_a_status_update_on_donald_trump_winning/,False
1g7bjfw,Trump appeared on my wall. What should I do? I’m not even American ,https://i.redd.it/l74762vvfqvd1.jpeg,,473,78,pyotr_vozniak,trump,2024-10-19 15:36:13+00:00,0.92,/r/trump/comments/1g7bjfw/trump_appeared_on_my_wall_what_should_i_do_im_not/,False
1g7bhba,Polk County Sheriff says the government is complicit in human trafficking ,https://www.msn.com/en-us/movies/news/florida-sheriff-says-us-government-is-complicit-in-aiding-human-trafficking/vi-AA1swIjM?ocid=socialshare,Thoughts?,1,2,SMDHinTx,trump,2024-10-19 15:33:28+00:00,0.57,/r/trump/comments/1g7bhba/polk_county_sheriff_says_the_government_is/,False
1g7b9jx,I voted!,https://i.redd.it/jo4s7xqldqvd1.jpeg,Let’s get this W! ,503,105,TheJohnnyAllen,trump,2024-10-19 15:23:26+00:00,0.88,/r/trump/comments/1g7b9jx/i_voted/,False
1g7an4c,"A Pittsburgh area bakery sells special election style cookies and Trump is leading Kamala 21,000 to 6,000 in sales… ""We didn't find anyone buying Harris cookies.""",https://v.redd.it/uwraqmrf8qvd1,,103,6,RiyaSharma777,trump,2024-10-19 14:54:45+00:00,0.88,/r/trump/comments/1g7an4c/a_pittsburgh_area_bakery_sells_special_election/,False
1g7a6n0,Imagine thinking this is good. The Left keeps asking incredulously: “who will pick the cotton?”,https://nfap.com/research/new-nfap-policy-brief-immigrants-and-americas-labor-force-growth/,,6,2,backintow3rs,trump,2024-10-19 14:32:27+00:00,0.62,/r/trump/comments/1g7a6n0/imagine_thinking_this_is_good_the_left_keeps/,False
1g7a167,Why is it more socially acceptable to openly be a Trump supporter in 2024 versus in 2016 and 2020?,https://www.reddit.com/r/trump/comments/1g7a167/why_is_it_more_socially_acceptable_to_openly_be_a/,"Anyone notice more people are openly saying they support Trump now? More celebrities and public figures? I see celebrities, athletes, and public figures like Dennis Quad, Waka Flocka, Undertaker, Elon Musk, Brett Favre, Harrison Butker, Brittany Mahomes, Danica Patrick, Amber Rose, Kodak Black, Dana White, 50 cent, Lil Wayne openly saying they support Trump. Very few public figures came out in support of Trump in 2016

What happened between now and 2016? Why are people more open about supporting Trump now and it's less taboo?  ",92,98,ZoomerAmerican,trump,2024-10-19 14:24:49+00:00,0.77,/r/trump/comments/1g7a167/why_is_it_more_socially_acceptable_to_openly_be_a/,False
1g79ouh,This is what happens when the current president puts ILLEGAL IMMIGRANTS before Americans! 💔🗳️🇺🇸,https://i.redd.it/wap8rcd10qvd1.jpeg,,141,8,V1nce-AL,trump,2024-10-19 14:07:23+00:00,0.87,/r/trump/comments/1g79ouh/this_is_what_happens_when_the_current_president/,False
1g79doe,Why is President Trump cancelling so many events and interviews?,https://www.reddit.com/r/trump/comments/1g79doe/why_is_president_trump_cancelling_so_many_events/,Is his recent exhaustion and confusion evidence of being targeted by a directional energy weapon like with Havana syndrome or something?,0,10,C00LD4D,trump,2024-10-19 13:51:52+00:00,0.26,/r/trump/comments/1g79doe/why_is_president_trump_cancelling_so_many_events/,False
1g78n17,Tim Walz - Taking the Latest Campaign Up a Notch.🦆🏈🍺,https://i.redd.it/6rhnm9lbqpvd1.jpeg,,17,1,Verdigris101,trump,2024-10-19 13:13:04+00:00,0.75,/r/trump/comments/1g78n17/tim_walz_taking_the_latest_campaign_up_a_notch/,False
1g76vny,I'm gonna Trump you out  song from a buddy of mine lol,https://www.reddit.com/r/trump/comments/1g76vny/im_gonna_trump_you_out_song_from_a_buddy_of_mine/,[https://www.youtube.com/watch?v=pmy\_li9p39c](https://www.youtube.com/watch?v=pmy_li9p39c),0,1,AllAboard2024,trump,2024-10-19 11:31:36+00:00,0.5,/r/trump/comments/1g76vny/im_gonna_trump_you_out_song_from_a_buddy_of_mine/,False
1g766p9,Newsweek says he's leading all swing states,https://www.reddit.com/r/trump/comments/1g766p9/newsweek_says_hes_leading_all_swing_states/,[Electoral College Map Projector Flips All Battleground States to Donald Trump](https://www.msn.com/en-us/news/politics/electoral-college-map-projector-flips-all-battleground-states-to-donald-trump/ar-AA1svmXx?ocid=widgetonlockscreen&cvid=b9969ce2d51947fda6c8b10df8df0ded&ei=15),27,7,DB24Corsair,trump,2024-10-19 10:43:08+00:00,0.74,/r/trump/comments/1g766p9/newsweek_says_hes_leading_all_swing_states/,False
1g74vk6,Cuba is collapsing. ,/r/cuba/comments/1g6v0he/cuba_is_collapsing/,,12,5,lolzuwish,trump,2024-10-19 09:02:53+00:00,0.8,/r/trump/comments/1g74vk6/cuba_is_collapsing/,False
1g74eyy,Israeli Actions Push Iran Closer to Nuclear Weapons • Stimson Center,https://www.stimson.org/2024/israeli-actions-push-iran-closer-to-nuclear-weapons,,0,2,vivek_for_POTUS,trump,2024-10-19 08:26:47+00:00,0.4,/r/trump/comments/1g74eyy/israeli_actions_push_iran_closer_to_nuclear/,False
1g72x7a,predictions are scaring me ,https://www.reddit.com/r/trump/comments/1g72x7a/predictions_are_scaring_me/,I do still have hope but hearing from people that have accurately predicted past elections predicting a Horrible Harris victory is anxiety inducing to say the least is there anything that could help put my mind at ease?😅,8,32,Dangerous-Victory223,trump,2024-10-19 06:32:27+00:00,0.63,/r/trump/comments/1g72x7a/predictions_are_scaring_me/,False
1g72wqf,I did a thing.,https://i.redd.it/qzld5w7pqnvd1.jpeg,,12,9,dirtydiarrheawater,trump,2024-10-19 06:31:28+00:00,0.62,/r/trump/comments/1g72wqf/i_did_a_thing/,False
1g72sg6,I made a Trump Shooter Game for Fun.,https://www.reddit.com/r/trump/comments/1g72sg6/i_made_a_trump_shooter_game_for_fun/,"[https://game-8z4.pages.dev/](https://game-8z4.pages.dev/)

you can use arrow keys for movement and space bar for firing. 

Game was made using chatgpt.

https://preview.redd.it/c415wnv2pnvd1.png?width=2870&format=png&auto=webp&s=26e8b304503e75d7efc7496d45df8cf6bc5e3014

",0,4,Georgeprethesh,trump,2024-10-19 06:22:46+00:00,0.43,/r/trump/comments/1g72sg6/i_made_a_trump_shooter_game_for_fun/,False
1g71pm8,"As a Brazilian, Harris keeping the border open would suck for me (that's not an immigrant, but I have a VISA)",https://www.reddit.com/r/trump/comments/1g71pm8/as_a_brazilian_harris_keeping_the_border_open/,"Her keeping the border open would suck for me, a ""legal"" (it's in quotes cuz I don't live in the US), as people will dislike everyone that isn't American due to being illegally in, having support and being able to vote (as well as good part of Legals, with green cards and citizenships while not having to do half of it), and, consequently, tourists like me. Also Trump 2024 so he can help take Xandão down!",0,6,NumerousEmu6702,trump,2024-10-19 05:06:35+00:00,0.33,/r/trump/comments/1g71pm8/as_a_brazilian_harris_keeping_the_border_open/,False
1g70yfj,watch trump get instant karma'd live in detroit with a 25 minute failed mic check...lol,https://www.reddit.com/r/trump/comments/1g70yfj/watch_trump_get_instant_karmad_live_in_detroit/,"Instant Karma....and it's great considering how he downed detroit last week!



[https://www.youtube.com/live/NlVezwjmyLs?si=zErCUAjTr68IfwrJ](https://www.youtube.com/live/NlVezwjmyLs?si=zErCUAjTr68IfwrJ)",0,5,Phast_enough,trump,2024-10-19 04:17:59+00:00,0.32,/r/trump/comments/1g70yfj/watch_trump_get_instant_karmad_live_in_detroit/,False
1g70tmo,I got my life size cutout of Donald Trump ready for Election Day!,https://i.redd.it/no6w87mf1nvd1.jpeg,Life size cutout of Trump🇺🇸🇺🇸🇺🇸,40,7,iTzToOdAnKK,trump,2024-10-19 04:09:51+00:00,0.84,/r/trump/comments/1g70tmo/i_got_my_life_size_cutout_of_donald_trump_ready/,False
1g70f5o,What Could Possibly Go Wrong?,https://i.redd.it/5g2tejx2xmvd1.png,,25,2,apestonkie,trump,2024-10-19 03:45:30+00:00,0.82,/r/trump/comments/1g70f5o/what_could_possibly_go_wrong/,False
