id,title,url,selftext,score,num_comments,author,subreddit,created_utc,upvote_ratio,permalink,stickied
1g4e7b7,Countering the 'muh fascist' argument,https://www.reddit.com/r/trump/comments/1g4e7b7/countering_the_muh_fascist_argument/,Hi y'all! High school teacher here dreading the Fun Election Night I'll be at. Most colleagues and students go into diatribes about Trump being fascist and all. I tried to look for videos on countering this on YouTube but get nothing but MSM bull when looking it up. Any tips on countering their whole list of complaints and not being called a Chamberlain immediately? Thanks and MAGA!,8,15,fuchsiarush,trump,2024-10-15 18:07:02+00:00,0.63,/r/trump/comments/1g4e7b7/countering_the_muh_fascist_argument/,False
1g4dzac,What’s with the dancing? (1hr 58),https://www.youtube.com/live/l3sxCuOExf4,"This seem a bit strange, what do you think his plan is?",2,3,Patient_Internal_977,trump,2024-10-15 17:57:54+00:00,0.55,/r/trump/comments/1g4dzac/whats_with_the_dancing_1hr_58/,False
1g4cqk6,He keeps on rising! ,https://i.redd.it/s7hordr6cyud1.png,,1285,259,hahafunyes,trump,2024-10-15 17:05:36+00:00,0.84,/r/trump/comments/1g4cqk6/he_keeps_on_rising/,False
1g4ca46,Share this before they take it down!!!,https://v.redd.it/6ksdmb3d8yud1,,32,0,Succulent_libtears,trump,2024-10-15 16:46:52+00:00,0.8,/r/trump/comments/1g4ca46/share_this_before_they_take_it_down/,False
1g4bvnt,The last illegal immigrant executed for killing American citizens was back in 2008,https://i.redd.it/0i21cebm5yud1.jpeg,,16,6,Succulent_libtears,trump,2024-10-15 16:29:59+00:00,0.65,/r/trump/comments/1g4bvnt/the_last_illegal_immigrant_executed_for_killing/,False
1g4bsy7,Imagine Trump bending over and you literally get triggered by it ,https://i.redd.it/h17rv8m95yud1.jpeg,,232,70,KatrinaGraceUS,trump,2024-10-15 16:26:48+00:00,0.89,/r/trump/comments/1g4bsy7/imagine_trump_bending_over_and_you_literally_get/,False
1g4brlj,Our Enemies Choice,https://i.redd.it/isn3lv1z4yud1.jpeg,,22,2,jjsupc,trump,2024-10-15 16:25:09+00:00,0.69,/r/trump/comments/1g4brlj/our_enemies_choice/,False
1g4bk59,Video I Captured Of Donald Trump Town Hall Rally Crowds Prior To His Speech At Oaks Expo On October 14th 2024,https://www.youtube.com/watch?v=DpYcv-7noQg&t=1s,,0,1,Lyosea1994,trump,2024-10-15 16:16:22+00:00,0.5,/r/trump/comments/1g4bk59/video_i_captured_of_donald_trump_town_hall_rally/,False
1g4bfsd,Young illegal immigrants in big blue city get out of jail free after feral attacks,https://www.foxnews.com/us/juvenile-illegal-immigrant-gang-members-behind-robbery-spree-stay-out-jail-due-age,,13,1,ghost-ns,trump,2024-10-15 16:11:13+00:00,0.78,/r/trump/comments/1g4bfsd/young_illegal_immigrants_in_big_blue_city_get_out/,False
1g4b55p,Trump Attacker EXPOSED As Hoax,https://youtu.be/VCdhB3dPfx8?si=O5o1-irQwY5OFBMA,,0,1,2016TRDPro,trump,2024-10-15 15:59:08+00:00,0.47,/r/trump/comments/1g4b55p/trump_attacker_exposed_as_hoax/,False
1g4aqrx,Anyone have a playlist for the music at the town hall?,https://v.redd.it/yxuyrzs8xxud1,I think it would be fun to make a playlist of the music played at the town hall yesterday! Can anyone help identify the songs?,47,30,brandalknows,trump,2024-10-15 15:42:09+00:00,0.73,/r/trump/comments/1g4aqrx/anyone_have_a_playlist_for_the_music_at_the_town/,False
1g4a9u0,Donald Trump - The Outlier (Full Documentary),https://www.youtube.com/watch?v=xyuNwlLi-5s,,0,2,kalbanes,trump,2024-10-15 15:22:21+00:00,0.4,/r/trump/comments/1g4a9u0/donald_trump_the_outlier_full_documentary/,False
1g4a7ah,Don’t Open It !,https://i.redd.it/2ko0uh08txud1.jpeg,,3,1,jjsupc,trump,2024-10-15 15:19:18+00:00,0.58,/r/trump/comments/1g4a7ah/dont_open_it/,False
1g4a5mb,Consequences,https://i.redd.it/fmnb20dvsxud1.jpeg,,15,2,jjsupc,trump,2024-10-15 15:17:19+00:00,0.72,/r/trump/comments/1g4a5mb/consequences/,False
1g49zs7,KPEWORLDWIDE on Instagram,https://www.instagram.com/reel/DBI09Qnx80Q/?igsh=MWp0eXVjMzJnM3NsYw==,These cops need to be in jail.,0,1,massapeal79,trump,2024-10-15 15:10:31+00:00,0.25,/r/trump/comments/1g49zs7/kpeworldwide_on_instagram/,False
1g49ucl,Vote !,https://i.redd.it/bw7d8ciiqxud1.jpeg,,12,1,jjsupc,trump,2024-10-15 15:04:06+00:00,0.7,/r/trump/comments/1g49ucl/vote/,False
1g49j5s,Donald Trump leads Kamala Harris among early voters in swing states: poll,https://www.newsweek.com/kamala-harris-donald-trump-early-voting-poll-1969124,,51,6,newsweek,trump,2024-10-15 14:50:55+00:00,0.78,/r/trump/comments/1g49j5s/donald_trump_leads_kamala_harris_among_early/,False
1g4922f,Tampon tim,https://i.redd.it/66zja96ckxud1.jpeg,,44,6,note1er,trump,2024-10-15 14:29:30+00:00,0.68,/r/trump/comments/1g4922f/tampon_tim/,False
1g48t9p,A Little Irony,https://i.redd.it/ckqaqhifixud1.jpeg,,82,5,jjsupc,trump,2024-10-15 14:18:48+00:00,0.82,/r/trump/comments/1g48t9p/a_little_irony/,False
1g48pop,Make Them Affordable,https://i.redd.it/o8x3kg3ohxud1.jpeg,,443,30,jjsupc,trump,2024-10-15 14:14:32+00:00,0.91,/r/trump/comments/1g48pop/make_them_affordable/,False
1g48n2f,Kinda Rare,https://i.redd.it/pe6ktkt2hxud1.jpeg,,2,1,jjsupc,trump,2024-10-15 14:11:13+00:00,0.55,/r/trump/comments/1g48n2f/kinda_rare/,False
1g48ir0,Google It !,https://i.redd.it/uqmcm5q3gxud1.jpeg,,3,1,jjsupc,trump,2024-10-15 14:05:45+00:00,0.61,/r/trump/comments/1g48ir0/google_it/,False
1g48b8f,Ideals,https://i.redd.it/ox47m1qfexud1.jpeg,,2,2,jjsupc,trump,2024-10-15 13:56:24+00:00,0.56,/r/trump/comments/1g48b8f/ideals/,False
1g48ao3,Polymarket Odds,https://www.reddit.com/r/trump/comments/1g48ao3/polymarket_odds/,"https://preview.redd.it/jcluil1aexud1.png?width=1261&format=png&auto=webp&s=e11dfc1ac37eabdac2ffca12701eb2ee17dfb387

",5,4,backintow3rs,trump,2024-10-15 13:55:39+00:00,0.63,/r/trump/comments/1g48ao3/polymarket_odds/,False
1g487uf,Now Really ?,https://i.redd.it/wdp3uafmdxud1.jpeg,,6,2,jjsupc,trump,2024-10-15 13:51:53+00:00,0.62,/r/trump/comments/1g487uf/now_really/,False
1g47yp8,The Cover-Up,https://i.redd.it/uh1srmejbxud1.jpeg,,7,1,jjsupc,trump,2024-10-15 13:40:10+00:00,0.64,/r/trump/comments/1g47yp8/the_coverup/,False
1g47qqa,Kamala’s Vision,https://i.redd.it/fgjyutmn9xud1.jpeg,,138,6,jjsupc,trump,2024-10-15 13:29:37+00:00,0.86,/r/trump/comments/1g47qqa/kamalas_vision/,False
1g47of4,Just Another Day,https://i.redd.it/axu72kg49xud1.jpeg,,9,1,jjsupc,trump,2024-10-15 13:26:38+00:00,0.67,/r/trump/comments/1g47of4/just_another_day/,False
1g47nln,She really shouldn’t drink before a rally.,https://v.redd.it/f7i6vhlw8xud1,,455,126,RiyaSharma777,trump,2024-10-15 13:25:30+00:00,0.84,/r/trump/comments/1g47nln/she_really_shouldnt_drink_before_a_rally/,False
1g45zk5,Relax Please,https://www.reddit.com/r/trump/comments/1g45zk5/relax_please/,"Can’t wait until something happens that makes this he said she said shit stop dominating our lives as US citizens. It’s fucking exhausting and does none of us any good. We”re all being played by the powers that be with this tension. Money is distracted on both sides instead of going to us common folk. It’s a political economy. TV and media always reflects where the money is going. So if you really want a better financial condition for yourself, ignore this political game you’re investing all your thoughts and time into, and invest in yourself. ",0,8,roscoe_gobbles,trump,2024-10-15 12:02:07+00:00,0.4,/r/trump/comments/1g45zk5/relax_please/,False
1g45zbk,Secret of Success,https://i.redd.it/ahdetfeztwud1.jpeg,,44,1,jjsupc,trump,2024-10-15 12:01:46+00:00,0.78,/r/trump/comments/1g45zbk/secret_of_success/,False
1g45y5t,Kamala’s Plan,https://i.redd.it/ny898udptwud1.jpeg,,0,1,jjsupc,trump,2024-10-15 12:00:13+00:00,0.5,/r/trump/comments/1g45y5t/kamalas_plan/,False
1g44u5b,Trump media stock soars as election odds move in ex-president's favor,https://www.newsweek.com/trump-media-stock-truth-social-election-odds-1969061,,24,3,newsweek,trump,2024-10-15 10:51:13+00:00,0.76,/r/trump/comments/1g44u5b/trump_media_stock_soars_as_election_odds_move_in/,False
1g43jtb,Make America Great Again (I'm from canada),https://v.redd.it/ychsfw2u0wud1,,256,11,Dazzling-Heart6342,trump,2024-10-15 09:18:31+00:00,0.9,/r/trump/comments/1g43jtb/make_america_great_again_im_from_canada/,False
1g42yvn,"Bought it when I was shooting a lot of uhh, trap.",https://i.redd.it/8hvfoks9svud1.jpeg,,0,3,Verdigris101,trump,2024-10-15 08:31:03+00:00,0.38,/r/trump/comments/1g42yvn/bought_it_when_i_was_shooting_a_lot_of_uhh_trap/,False
1g41wss,"US warns Iran to stop plotting against Trump, says US official",https://www.reuters.com/world/us-warns-iran-stop-plotting-against-trump-says-us-official-2024-10-15/,,0,3,YusufZain002,trump,2024-10-15 07:04:29+00:00,0.14,/r/trump/comments/1g41wss/us_warns_iran_to_stop_plotting_against_trump_says/,False
1g41evl,Now we know where Kamala gets it from ...,https://www.youtube.com/watch?v=XSe0T8sOVAI,,0,1,SavageOldBastard,trump,2024-10-15 06:27:21+00:00,0.46,/r/trump/comments/1g41evl/now_we_know_where_kamala_gets_it_from/,False
1g3zkh7,Kamala trying to buy black votes,https://i.redd.it/6x7tlb0akuud1.jpeg,Kamala is trying to bribe black men into voting for her. If Trump did this but with whites it would be labeled as racist and shut down by the government instantly. I love how the democrats are so one sided and racist and they don’t even try to hide it.,221,111,iTzToOdAnKK,trump,2024-10-15 04:23:49+00:00,0.85,/r/trump/comments/1g3zkh7/kamala_trying_to_buy_black_votes/,False
1g3yr9x,Pretty sure I know the clear answer here,https://i.redd.it/8hv8mw1qbuud1.jpeg,,34,6,dylanlovespies,trump,2024-10-15 03:35:52+00:00,0.81,/r/trump/comments/1g3yr9x/pretty_sure_i_know_the_clear_answer_here/,False
1g3yjaf,Happy Indigenous People Day 😁😁,https://v.redd.it/mx2b470k9uud1,,0,2,xbigvmanx,trump,2024-10-15 03:23:45+00:00,0.35,/r/trump/comments/1g3yjaf/happy_indigenous_people_day/,False
1g3ygxj,Whats Justice ? Interesting video and this says something Trump Supporters should be emboldened by...,https://v.redd.it/09xr2dxn2rud1,,0,1,tomcat91709,trump,2024-10-15 03:20:06+00:00,0.4,/r/trump/comments/1g3ygxj/whats_justice_interesting_video_and_this_says/,False
1g3y13o,Kamala Harris plagiarized her book from Wikipedia. You can’t make this up but she sure can.,https://v.redd.it/r09wf40q4uud1,,0,2,Scottroofwalker,trump,2024-10-15 02:56:45+00:00,0.33,/r/trump/comments/1g3y13o/kamala_harris_plagiarized_her_book_from_wikipedia/,False
1g3xzux,"These liberals with Trump derrangements syndrome, need to be locked up in asylums!!!",https://i.redd.it/6fvofdfiytud1.jpeg,,10,1,Succulent_libtears,trump,2024-10-15 02:54:52+00:00,0.71,/r/trump/comments/1g3xzux/these_liberals_with_trump_derrangements_syndrome/,False
1g3xzb8,Every promise even Tax cut for the middle class are lies from Kamala Harris,https://v.redd.it/95rni07cytud1,,10,1,Succulent_libtears,trump,2024-10-15 02:54:06+00:00,0.75,/r/trump/comments/1g3xzb8/every_promise_even_tax_cut_for_the_middle_class/,False
1g3xwm9,Stupidity of the left,https://i.redd.it/3cfdo3ok3uud1.jpeg,Trump is not the problem. Their mentality is !!!,443,33,Instr-FTO,trump,2024-10-15 02:50:11+00:00,0.93,/r/trump/comments/1g3xwm9/stupidity_of_the_left/,False
1g3xt86,What an incredible combination ,https://i.redd.it/yq30a6ko2uud1.jpeg,Love these two working together. MAGA is a work in progress. Go USA 🇺🇸 ,0,4,Instr-FTO,trump,2024-10-15 02:45:11+00:00,0.33,/r/trump/comments/1g3xt86/what_an_incredible_combination/,False
1g3xjko,Nothing triggers libt@rds more ,https://i.redd.it/8cyosp4bbsud1.jpeg,,69,2,Succulent_libtears,trump,2024-10-15 02:31:32+00:00,0.86,/r/trump/comments/1g3xjko/nothing_triggers_libtrds_more/,False
1g3xg4u,Anyone in the SoCal area?,https://i.redd.it/mrzbzn6cztud1.jpeg,Meeting at trump national golf course right before the election!! :),3,2,Htk5150,trump,2024-10-15 02:26:26+00:00,0.6,/r/trump/comments/1g3xg4u/anyone_in_the_socal_area/,False
1g3xfxu,Early Voting,https://i.redd.it/82ij1ebaztud1.jpeg,Let's go and Make America Great Again!,574,54,OneDisastrous998,trump,2024-10-15 02:26:10+00:00,0.88,/r/trump/comments/1g3xfxu/early_voting/,False
1g3xets,Truth bomb,https://i.redd.it/aidhlbteytud1.jpeg,,48,3,Succulent_libtears,trump,2024-10-15 02:24:30+00:00,0.85,/r/trump/comments/1g3xets/truth_bomb/,False
1g3x6u4,As the Reddit leftists try and portray them as Trump supporters and According to all the left wing subs the Nazi boat was the only trump supporters there. That’s how the propaganda works.,https://v.redd.it/0o5d8jnorsud1,,169,27,Succulent_libtears,trump,2024-10-15 02:12:54+00:00,0.95,/r/trump/comments/1g3x6u4/as_the_reddit_leftists_try_and_portray_them_as/,False
1g3wsn4,Trump takes a lead in Vegas betting odds,https://i.redd.it/ckf5yefattud1.jpeg,,40,2,None,trump,2024-10-15 01:52:33+00:00,0.78,/r/trump/comments/1g3wsn4/trump_takes_a_lead_in_vegas_betting_odds/,False
1g3w5q9,Firefighters ,https://v.redd.it/x8gypmc7ntud1,I hope he can handle a water hose better than he can a dance floor. They call this move the tampon tango. ,9,21,Sea-Revolution7308,trump,2024-10-15 01:19:08+00:00,0.66,/r/trump/comments/1g3w5q9/firefighters/,False
1g3vnn9,"This is the beginning of a censorship campaign for the left. Most ""scientist/researchers"" are bought and paid for. ",https://www.uts.edu.au/news/tech-design/right-leaning-political-figures-fuel-online-hate,,4,1,ChiefRom,trump,2024-10-15 00:54:05+00:00,0.67,/r/trump/comments/1g3vnn9/this_is_the_beginning_of_a_censorship_campaign/,False
1g3vkv7,Starbucks is scaling back discounts and promotions | CNN Business,https://www.reddit.com/r/trump/comments/1g3vkv7/starbucks_is_scaling_back_discounts_and/,Greedy motherfuckers ,0,1,massapeal79,trump,2024-10-15 00:50:10+00:00,0.5,/r/trump/comments/1g3vkv7/starbucks_is_scaling_back_discounts_and/,False
1g3vcgi,Join our meme community! ,https://www.reddit.com/r/trump/comments/1g3vcgi/join_our_meme_community/,"Do you love Donald Trump, the Conservative Party and Memes?! Then join us over at r/conservativeshitposts !!",1,4,Succulent_libtears,trump,2024-10-15 00:38:59+00:00,0.54,/r/trump/comments/1g3vcgi/join_our_meme_community/,True
1g3p9gn,One of the rare moments when Joker was actually sane...,https://v.redd.it/93poas5upqud1,,0,1,Minute-Pomelo9302,trump,2024-10-14 20:02:54+00:00,0.5,/r/trump/comments/1g3p9gn/one_of_the_rare_moments_when_joker_was_actually/,False
1g3uwrd,SNL mocks Kamala Harris in game show spoof,https://www.reddit.com/r/trump/comments/1g3uwrd/snl_mocks_kamala_harris_in_game_show_spoof/,[https://www.msn.com/en-us/news/politics/snl-mocks-kamala-harris-middle-class-family-interview-response-during-family-feud-skit/vi-AA1sbHbx?ocid=socialshare&pc=W046&cvid=a1011cbe4ae442a9965f41a16253d5cf&ei=29#details](https://www.msn.com/en-us/news/politics/snl-mocks-kamala-harris-middle-class-family-interview-response-during-family-feud-skit/vi-AA1sbHbx?ocid=socialshare&pc=W046&cvid=a1011cbe4ae442a9965f41a16253d5cf&ei=29#details),4,2,espositojoe,trump,2024-10-15 00:17:00+00:00,0.64,/r/trump/comments/1g3uwrd/snl_mocks_kamala_harris_in_game_show_spoof/,False
1g3udwo,Roundup,https://i.redd.it/bn6ahm6k7tud1.jpeg,,3,2,jjsupc,trump,2024-10-14 23:50:45+00:00,0.67,/r/trump/comments/1g3udwo/roundup/,False
1g3ud00,Stupid,https://v.redd.it/zh625g7c7tud1,,302,15,jjsupc,trump,2024-10-14 23:49:31+00:00,0.89,/r/trump/comments/1g3ud00/stupid/,False
1g3ub30,Call Them What They Are,https://i.redd.it/otobrffv6tud1.jpeg,,9,1,jjsupc,trump,2024-10-14 23:46:53+00:00,0.67,/r/trump/comments/1g3ub30/call_them_what_they_are/,False
1g3u9sy,"Oaks, PA Townhall",https://www.reddit.com/r/trump/comments/1g3u9sy/oaks_pa_townhall/,"Tonight has been messy, two people went down from the heat, Trump was all over the situation, including risking his safety to open doors to bring air into a hot arena. America's Grandpa was awesome with the people for a cruddy situation with the building. Too bad the SS is not good enough to allow Trump to keep the rallies outside.

DJ Trumpy-Trump was having his boy Justin drop the tracks, albeit it was Pavarotti, and Ave Maria.",0,2,goshon021,trump,2024-10-14 23:45:08+00:00,0.44,/r/trump/comments/1g3u9sy/oaks_pa_townhall/,False
1g3u4xv,Hilary won’t like this lol ,https://www.instagram.com/reel/DBHrudmMW4A/?igsh=cmhndmNwd2Y1cG02,,0,3,ActualTackle3636,trump,2024-10-14 23:39:02+00:00,0.38,/r/trump/comments/1g3u4xv/hilary_wont_like_this_lol/,False
1g3u1yf,Cancel Culture at it again. Link in comments.,https://i.redd.it/efd3sdzr4tud1.png,,121,42,OnePlusFanBoi,trump,2024-10-14 23:35:09+00:00,0.84,/r/trump/comments/1g3u1yf/cancel_culture_at_it_again_link_in_comments/,False
1g3tz02,Trump receives unanimous endorsement from Border Patrol union,https://www.foxnews.com/politics/trump-receives-unanimous-endorsement-from-border-patrol-union,,61,0,UltraMagat,trump,2024-10-14 23:31:10+00:00,0.9,/r/trump/comments/1g3tz02/trump_receives_unanimous_endorsement_from_border/,False
1g3t8ea,Here’s a literal conservative shitpost ,https://v.redd.it/l0fdgclh8sud1,,4,1,WBigly-Reddit,trump,2024-10-14 22:55:44+00:00,0.6,/r/trump/comments/1g3t8ea/heres_a_literal_conservative_shitpost/,False
1g3t2up,Friendly interviewer/crowd: 10/10.  Incompetence: 10/10.,https://i.redd.it/8vf3f7i0wsud1.png,,53,1,ExNihiloAdInfinitum,trump,2024-10-14 22:48:21+00:00,0.88,/r/trump/comments/1g3t2up/friendly_interviewercrowd_1010_incompetence_1010/,False
1g3rutn,❤️💞🥰 [OC],https://i.redd.it/lfws3ljemsud1.png,,22,3,ExNihiloAdInfinitum,trump,2024-10-14 21:52:29+00:00,0.77,/r/trump/comments/1g3rutn/oc/,False
1g3qmns,Confused Joe Biden makes bizarre statement following Hurricane Milton - YouTube,https://www.youtube.com/watch?v=n1BfsMpNe_M,,0,0,LibransRule,trump,2024-10-14 20:59:42+00:00,0.44,/r/trump/comments/1g3qmns/confused_joe_biden_makes_bizarre_statement/,False
1g3rsxz,🇺🇸M⚔️A🇺🇸G⚔️A🇺🇸,https://i.redd.it/4gie17n1msud1.png,Nuff Said!,419,24,Antron-Eiderlon,trump,2024-10-14 21:50:10+00:00,0.92,/r/trump/comments/1g3rsxz/maga/,False
1g3r94q,America’s Hope,https://i.redd.it/f2dqwekphsud1.jpeg,,82,1,jjsupc,trump,2024-10-14 21:25:51+00:00,0.87,/r/trump/comments/1g3r94q/americas_hope/,False
1g3r821,Harris Voters,https://i.redd.it/40mza08hhsud1.jpeg,,349,18,Perfect_Quiet7603,trump,2024-10-14 21:24:33+00:00,0.89,/r/trump/comments/1g3r821/harris_voters/,False
1g3qqga,Walz new book and movie coming out;,https://www.reddit.com/r/trump/comments/1g3qqga/walz_new_book_and_movie_coming_out/,"https://preview.redd.it/d1vsvfspdsud1.jpg?width=1027&format=pjpg&auto=webp&s=d527bf2904a2014fd3f4c40d5535e838fb6ced6f

",0,1,BlindLDTBlind,trump,2024-10-14 21:03:47+00:00,0.33,/r/trump/comments/1g3qqga/walz_new_book_and_movie_coming_out/,False
1g3qpdm,Happy Christopher Columbus Day Everyone,https://v.redd.it/dujzvg3kdsud1,,14,5,xbigvmanx,trump,2024-10-14 21:02:35+00:00,0.64,/r/trump/comments/1g3qpdm/happy_christopher_columbus_day_everyone/,False
1g3qd3i,A Soy Boy for Kamala tries attacking a Trump supporter.  Hilarious!,https://www.reddit.com/r/trump/comments/1g3qd3i/a_soy_boy_for_kamala_tries_attacking_a_trump/,[https://youtu.be/iksWBLe1PaE?si=uX7p4MyaCjCTlfsU](https://youtu.be/iksWBLe1PaE?si=uX7p4MyaCjCTlfsU),4,1,espositojoe,trump,2024-10-14 20:48:35+00:00,0.64,/r/trump/comments/1g3qd3i/a_soy_boy_for_kamala_tries_attacking_a_trump/,False
1g3qazv,I’m surprised they didn’t turn his mic off! Beta liberal —> conservative Chad,https://v.redd.it/ypnfeeat8sud1,,65,2,Succulent_libtears,trump,2024-10-14 20:46:10+00:00,0.87,/r/trump/comments/1g3qazv/im_surprised_they_didnt_turn_his_mic_off_beta/,False
1g3q6mp,Alexa doesn't wish you a happy Columbus Day,https://www.reddit.com/r/trump/comments/1g3q6mp/alexa_doesnt_wish_you_a_happy_columbus_day/,But she wishes you a Happy Indigenous People's Day!,3,4,ghost-ns,trump,2024-10-14 20:41:07+00:00,0.58,/r/trump/comments/1g3q6mp/alexa_doesnt_wish_you_a_happy_columbus_day/,False
1g3q27v,Why Donald Trump Should Win the 2024 Election,https://m10news.com/why-donald-trump-should-win-the-2024-election/,,4,1,M10News,trump,2024-10-14 20:35:48+00:00,0.59,/r/trump/comments/1g3q27v/why_donald_trump_should_win_the_2024_election/,False
1g3q1jy,Withholding Aid,https://i.redd.it/yaqjki3n8sud1.jpeg,,206,15,jjsupc,trump,2024-10-14 20:35:01+00:00,0.91,/r/trump/comments/1g3q1jy/withholding_aid/,False
1g3pyux,Election Integrity in Michigan,https://i.redd.it/3qpxh9a38sud1.jpeg,,37,1,jjsupc,trump,2024-10-14 20:31:56+00:00,0.86,/r/trump/comments/1g3pyux/election_integrity_in_michigan/,False
1g3pk10,CALI checking IN 🫵🏻🦅,https://i.redd.it/jm51eij25sud1.jpeg,LETS DO THIS FOR OUR FUTURE AND THE COUNTRY❤️,489,39,mysteriousprincessx,trump,2024-10-14 20:15:01+00:00,0.91,/r/trump/comments/1g3pk10/cali_checking_in/,False
1g3ncgt,Va checking in 😎,https://i.redd.it/k31a16fyorud1.jpeg,Black male who was brainwashed to vote the other way checking in sent my ballot off last week!  Never felt better (to vote) lol,608,42,shastyles1,trump,2024-10-14 18:44:41+00:00,0.89,/r/trump/comments/1g3ncgt/va_checking_in/,False
1g3mmw6,"Spotted today in Milwaukee, Wisconsin",https://i.redd.it/0a2rvaepjrud1.jpeg,,14,1,codemotionart,trump,2024-10-14 18:15:46+00:00,0.69,/r/trump/comments/1g3mmw6/spotted_today_in_milwaukee_wisconsin/,False
1g3kqk1,Interesting. Where is her earpiece tho?,https://v.redd.it/z4jxmac76rud1,,59,5,Deafboy45,trump,2024-10-14 16:59:37+00:00,0.84,/r/trump/comments/1g3kqk1/interesting_where_is_her_earpiece_tho/,False
1g3k9js,Kamala Harris accused of plagiarising Wikipedia in her book,https://www.telegraph.co.uk/us/politics/2024/10/14/kalama-harris-donald-trump-election-president-politics/,,21,2,TheTelegraph,trump,2024-10-14 16:40:30+00:00,0.7,/r/trump/comments/1g3k9js/kamala_harris_accused_of_plagiarising_wikipedia/,False
1g3js6s,Who’s Right?,https://i.redd.it/asnjm8f9zqud1.jpeg,,130,4,Pure-Guard-3633,trump,2024-10-14 16:20:40+00:00,0.89,/r/trump/comments/1g3js6s/whos_right/,False
1g3jq7h,To all the haters out there. Happy Columbus Day!,https://i.redd.it/tvfahqluyqud1.jpeg,,25,5,SouthMastodon3125,trump,2024-10-14 16:18:21+00:00,0.74,/r/trump/comments/1g3jq7h/to_all_the_haters_out_there_happy_columbus_day/,False
1g3j73a,They really had me convinced that men are the problem,https://v.redd.it/zowzm3zwuqud1,,9,5,Scottroofwalker,trump,2024-10-14 15:56:20+00:00,0.61,/r/trump/comments/1g3j73a/they_really_had_me_convinced_that_men_are_the/,False
1g3j6rt,ANTIFA came out of the basement and forgot to change their clothes ,https://v.redd.it/dphpwhwuuqud1,,240,88,Scottroofwalker,trump,2024-10-14 15:55:59+00:00,0.8,/r/trump/comments/1g3j6rt/antifa_came_out_of_the_basement_and_forgot_to/,False
1g3j62c,Tim Walz has to make up some new places he was at soon ,https://v.redd.it/ylr0rqcpuqud1,,12,2,Scottroofwalker,trump,2024-10-14 15:55:08+00:00,0.66,/r/trump/comments/1g3j62c/tim_walz_has_to_make_up_some_new_places_he_was_at/,False
1g3j5oy,I’ve had enough about hearing that Trump is a racist,https://v.redd.it/eoz79fjmuqud1,,24,2,Scottroofwalker,trump,2024-10-14 15:54:43+00:00,0.74,/r/trump/comments/1g3j5oy/ive_had_enough_about_hearing_that_trump_is_a/,False
1g3j4mp,The victim is GUILTY!!! ,https://v.redd.it/81nrn0jeuqud1,,2,1,Scottroofwalker,trump,2024-10-14 15:53:27+00:00,0.54,/r/trump/comments/1g3j4mp/the_victim_is_guilty/,False
1g3j2kj,They don’t like it when you bring receipts,https://v.redd.it/ond2y1tytqud1,,3,1,Scottroofwalker,trump,2024-10-14 15:51:04+00:00,0.57,/r/trump/comments/1g3j2kj/they_dont_like_it_when_you_bring_receipts/,False
1g3j2yx,Epstein got Epsteined by who,https://v.redd.it/ku3ws8l1uqud1,,4,1,Scottroofwalker,trump,2024-10-14 15:51:30+00:00,0.59,/r/trump/comments/1g3j2yx/epstein_got_epsteined_by_who/,False
1g3j3cy,"I thought AI was going to be a problem, at first",https://v.redd.it/9rzakbs4uqud1,,6,1,Scottroofwalker,trump,2024-10-14 15:51:56+00:00,0.61,/r/trump/comments/1g3j3cy/i_thought_ai_was_going_to_be_a_problem_at_first/,False
1g3j02a,Kamala’s Project,https://i.redd.it/nk856xahtqud1.jpeg,,8,1,jjsupc,trump,2024-10-14 15:48:16+00:00,0.68,/r/trump/comments/1g3j02a/kamalas_project/,False
1g3hp4i,A cool guide to know when you're being gaslighted- The Only Way Harris can get Elected,https://i.redd.it/u8wms9k80qud1.jpeg,,1,2,tomcat91709,trump,2024-10-14 14:54:06+00:00,0.53,/r/trump/comments/1g3hp4i/a_cool_guide_to_know_when_youre_being_gaslighted/,False
1g3gydp,I’m voting for the candidate who chooses Americans over illegals.,https://i.redd.it/60bo4cn5equd1.jpeg,,935,97,RiyaSharma777,trump,2024-10-14 14:22:24+00:00,0.81,/r/trump/comments/1g3gydp/im_voting_for_the_candidate_who_chooses_americans/,False
1g3eyc5,Great Again !,https://i.redd.it/jtms3o0mxpud1.jpeg,,78,4,jjsupc,trump,2024-10-14 12:49:38+00:00,0.85,/r/trump/comments/1g3eyc5/great_again/,False
1g3exeh,America First,https://i.redd.it/o628d6ndxpud1.jpeg,,584,54,jjsupc,trump,2024-10-14 12:48:20+00:00,0.92,/r/trump/comments/1g3exeh/america_first/,False
1g3exbu,“COMMIE KAMALA” is a better name than Comrade Kamala. ,https://www.reddit.com/r/trump/comments/1g3exbu/commie_kamala_is_a_better_name_than_comrade_kamala/,"It rolls off the tongue 👅 for one. 

But you can also repeat it: Commie Commie Kamala.   Reminds people she's a Kama Kama Chameleon ",1,3,Ayrab4Trump,trump,2024-10-14 12:48:14+00:00,0.52,/r/trump/comments/1g3exbu/commie_kamala_is_a_better_name_than_comrade_kamala/,False
1g3epm8,Strange,https://i.redd.it/1oexx2ggvpud1.jpeg,,199,7,jjsupc,trump,2024-10-14 12:37:34+00:00,0.93,/r/trump/comments/1g3epm8/strange/,False
1g3e7v7,Trump !,https://i.redd.it/vcygd5ayqpud1.jpeg,,197,6,jjsupc,trump,2024-10-14 12:12:18+00:00,0.89,/r/trump/comments/1g3e7v7/trump/,False
1g3e5gb,Well Done !,https://i.redd.it/3xk769vaqpud1.jpeg,,58,7,jjsupc,trump,2024-10-14 12:08:40+00:00,0.78,/r/trump/comments/1g3e5gb/well_done/,False
1g3e3ev,Socialism,https://i.redd.it/s3rj8siqppud1.jpeg,,4,1,jjsupc,trump,2024-10-14 12:05:30+00:00,0.6,/r/trump/comments/1g3e3ev/socialism/,False
